Text,Mark
"


Отвратительный университет и институт экономики в частности. 
Рекламная кампания и красочное представление университета являются лишь способом заманивания выпускников для выполнения своих планов по количеству поступивших, однако с действительностью не имеют ничего общего. Отношение преподавателей к студентам мягко говоря пренебрежительное и хамское. К****** Л.Р. &quot;преподаватель&quot;, который не гнушается оскорблять и унижать студентов  и делает это потому что может, даже после многочисленных жалоб её до сих пор не увольняют, объясняя это тем, что она профессор. Г****** Г. А. Заведующая кафедрой финансов и налогообложения, ни разу не пришла вовремя на пары(обычное опоздание для неё 20-30 минут, чуть реже 40 мин, оставшуюся пару проводила в спешке и недовольстве, что студенты от неё что-то требуют, постоянно пишут на почту, а она ничего не успевает). В данном случае напрашивается вопрос-а зачем набирать столько обязанностей, если не можешь с ними справляться? Так же на вручении дипломов каждый заведующий кафедрой вручал студентам дипломы сам, однако Г****а не посчитала нужным прийти вовремя и вместо неё вручение проводил Г*****. Также Г***** спустя рукава отнеслась к своим обяза...Показать полностью...нностям как научный руководитель ВКР и диплом с докладом у одногруппников дописывался за пол часа до выхода на защиту, однако стоит отметить, что несмотря на сырую работу своим дипломникам она выбила оценку &quot;отлично&quot;. Комиссия, сидевшая на защите диплома также не являлась объективной,вместо заслуженной оценки &quot; Отлично &quot;, они из своих личных соображений,не смотря на отзыв руководителя и рецензию с места практики, занизили оценку. При озвучивании желания аппеляции своему дипломному руководителю был получен ответ, что лучше не стоит и на вручении диплома тебе дадут грамоту за достойную ВКР, однако никакой грамоты не было,т.к. ответственный за организацию написания статьи так и не связался со мной. Сейчас я понимаю, что озвучивание перспективы вручения грамоты было лишь способом,чтобы не проводить аппеляцию, ведь это дополнительная волокита для кафедры. Г***** К. Е. являясь директором Института экономики, финансов и бизнеса, кроме как ораторской деятельностью и восхвалением своего института не занимается ни чем, либо просто не знает, что происходит в его любимом институте (что очень сомнительно). 
Со всей кафедры могу отметить положительно только преподавательскую деятельность С****** А. А. и Г********* Г. Х. - это действительно преподаватели, которые ответственно относятся к своей работе и любят её. 
В общем и целом, обучение на данной кафедре и данном университете можно оценить на 1 из 100,т.к преподаватели, являющиеся лицом института и управляющий состав относятся к своим обязанностям халатно. Если вы хотите поступать на направление, связанное с экономикой, обходите данный Вуз стороной. Приходя сюда и проведя в данном заведении 4 года, вы даже при большом старании уйдёте с тем же уровнем знаний, с которым пришли, зато с опустевшими карманами и загубленной нервной системой, либо вы научитесь(не побоюсь этого слова) &quot;лизать&quot; всем.",negative
"


В 2020 году я поступила на факультет «Зарубежная филология», так как не хватило баллов для поступления в Москву. 
Это было одно из худших решений моей жизни. Начать стоит с того, что о ФРГФ в народе ходит слава как о «лучшем гуманитарном факультете Башкирии». Так вот, если это лучший факультет, то мне страшно представить, что происходит на остальных. 1 сентября нам сразу сказали что нагрузка будет адовая, что совмещать учебу с работой будет невозможно. В целом, учить и правда нужно много (ну а чего вы ожидали от лингвистического направления), но я бы не сказала, что нагрузка была большой. В основном преподавателям плевать на вас, некоторые отказываются учить вас, если вы не купили их авторский учебник. 
Второй иностранный язык изучается на отвали, за год на немецком я научилась только считать. В конце года вас ждет «приятный» сюрприз - по профильным предметам вам, скорее всего, выведут автомат (3 выводят даже тем, кто не появлялся на лекциях), зато по предметам вроде истории или информатики вам придется пройти 9 кругов ада и задуматься о том, где найти денег на взятку преподу.
  Вас постоянно будут пытаться затянуть участвовать в различных внеучебных мероприятиях, на парах будут уд...Показать полностью...елять этому по 20-30 минут, обещая дополнительные баллы к сессии за спетую песенку (в частности это относится к Ш****** Ю.Х.) Все зарубежные стажировки и программы обмена на полгода стоят как 5 лет обучения в БГУ. Пары несколько раз отменяли прямо с утра в день самой пары. Про общежитие точно сказать не могу, но одногруппница ненавидит это место, жалуется на антисанитарию, ужасную вахтершу и быдло-соседей. 
Я пересдала ЕГЭ и перепоступаю в другой вуз, чему несказанно рада. ",negative
"


Здравствуйте! Я являюсь студеткой 3 курса БГУ Института экономики, финансы и бизнеса по направлению «Международный бизнес». В целом могу сказать, что вуз является классическим, и потому финансирование его оставляет желает лучшего. У вуза возникают постоянные проблемы с учебными программами, организацией. Помню, как когда-то на Дне открытых дверей, сам ректор говорил что-то вроде «и пусть мы не так хорошо финансируемся, как наши коллеги из угнту и угату...»(их поддерживают хотя бы авиационная и нефтяная отрасль). Жаль, что я не оценила эти слова тогда по достоинству.
Среди преподователей есть хорошие, но это скорее исключение, нежели правило. Качество образования довольно посредственное. Уровень языков, вопреки тому что было заявлено,  достаточно низкий. Вуз коррумпированный, в программе присутствуют много сомнительных по важности предметов.
Жаль потраченного времени и денег. Если бы я могла вернуться в конец 11 класса, то точно не выбрала бы данное направление в данном вузе.
Если вы хотите по-настоящему изучать экономику, бизнес, языки и быть востребованными специалистами, то вам точно не сюда!",negative
