Text,Mark
"


Всем привет! Я студент факультета компьютерных технологий и информатики, по направлению &quot;Прикладная математика и информатика&quot;. В отзыве речь пойдет именно об этом направлении, лишь слегка буду касаться других направлений факультета, т.к. на них не учусь.  

Набравшись опыта и впечатлений за первый курс обучения, я решил поделиться информацией с вами, дорогие абитуриенты, потому что сам помню, как мне было важно узнать как можно больше о вузе и специальности. 

Преподавательский состав сильный, отзывчивый , объясняют все довольно подробно, просят задавать как можно больше вопросов по темам, понимают, что студенты - люди, которые тянутся к знаниям, и относятся к ним уважительно(на парах по программированию и одной из математик обращаются к студентам как &quot;коллеги&quot;, что очень приятно). Никаких предубеждений по поводу пола у преподов нет. Очень хотелось бы отметить, что подавляющее большинство преподавателей молодые и это потрясающе: они говорят со студентами на одном языке, находят контакт и знают, как преподнести материал.  
Про проектную деятельность. После первого же семестра всем желающим предлагали участвовать в проектах по темам ИИ, Web, Роботостроение, Машинн...Показать полностью...ое зрение, Big Data и т.д. - во все проекты готовы принять любого, кто покажет достаточно навыков, либо же освоит их достаточно быстро. Тут действительно много возможностей занять себя и прокачать скиллы.
Отдельно про дисциплины &quot;Программирование&quot; ,&quot;Математика&quot; и &quot;Физика&quot;. Программирование дается с нуля, изучается язык С, вы можете не знать совсем ничего про программирование - вас научат. Также есть &quot;Информатика&quot;, где дают основные понятия в Python, тоже с нуля, тут бояться нечего. Математики на ВСЕМ факультете много, это неизбежно, и это правильно. Физика( Да, к сожалению она тут есть и все ФКТИшники ее не любят, но к большому счастью преподается она всего год и преподы в большинстве понимают, что нам она вообще не интересна и обходятся снисходительно. 
Все корпуса , кроме одного, находятся в одном дворе и не приходится ехать через город на следующую пару, а до отдельного корпуса - 15 минут от главного пешком. Внутри всех корпусов находиться приятно, аудитории светлые, просторные и теплые. Во многих аудиториях(если не во всех) установлены маркерные доски, что очень удобно. И сам двор очень красивый, в общем все условия для учебы.
Про отчисления. С ФКТИ отчисляют, не сомневайтесь, но чтобы вас отчислили, нужно действительно ничего не делать весь семестр. Главное - выполняйте дз в срок, лабораторные в срок и проблем не будет вообще. На хорошие оценки стоит действительно потрудиться, просто так 4 и 5 не ставят.
Общаги выдаются по баллам ЕГЭ после списков зачисления. Кто не получил - становится в очередь и ждет в течение курса. Под ФКТИ давали начиная с 250+-, точно не помню.  Про общаги стоит почитать на сайте, есть как в пешей доступности, так и подальше. Лично меня все бытовые условия в моей общаге устраивают от и до.
Для тех, кто метается между направлениями или кому не хватило баллов до желаемого направления - перевод с бюджета на бюджет возможен,  в рамках факультета академическая разница между предметами минимальная и после первого же семестра можно перевестись на другое направление, если в группах будет место. Направления &quot;Программная инженерия&quot; и &quot;Прикладная математика и информатика&quot; - это группы одного потока, т.е. на первом курсе все дисциплины одинаковые и с одинаковыми лекторами. Перевод с коммерческой основы ,конечно, возможен, но рассказать про него ничего не могу.

Общий вывод - ФКТИ и ЛЭТИ топ. Ни дня не жалел, что поступил сюда и с удовольствие продолжу учиться дальше.  И вам его советую.",positive
"


Всем привет. Разумеется, говорить о ВУЗе и факультете после только первого курса, который к тому же на половину прошёл на дистанционке, не совсем объективно. Но я постараюсь вывести основные моменты, которые могут быть интересны Вам, абитуриентам. Ежели Вы хотите получить более полную инфу от ребят постарше, идите в подслушку, там люди найдутся.
Отзыв нейтрален, хотя, в целом, мне нравится, но, я стараюсь быть объективен, и о минусах скажу тоже.
Так вот, ФЭЛ. 
Начнём с того, что будет вокруг Вас во время учёбы. То бишь, начнём с состоянии самих корпусов. С ремонтом тут всё неоднородно. Есть 6 и 5 корпуса, где глобальных проблем такого рода я не видел, кроме некоторых небольших проблем и чисто архитектурных особенностей, есть 1, 2 и 4 корпуса, где кроме некоторых аудиторий всё, скажем так, плохо, а есть на половину клёвый, а на половину чинящийся третий корпус. В общем, если резюмировать, бабки потихоньку вкладываются. Не так быстро, как хотелось бы, но, в целом, динамика положительная есть. 
Далее, также, смежная сфера, эт расположение корпусов. Корпуса с первого по пятый стоят недалеко от Невы на улице Профессора Попова, в минутах десяти от метро Петроградская. Шестой же, стоит в ...Показать полностью...другой стороне от метро, но тоже по Попова и тоже минутах в десяти-двадцати. Однако слава диспетчерской, тут есть принцип: если у студентов пары в шестом корпусе, они весь день в шестом корпусе. То есть, расписание ставят так, что один день в неделю вы весь день занимаетесь в шестёрке, а не бегаете от первых пяти к нему и обратно. Бегают иногда только преподы, но к ним тоже в этом плане стараются относиться по-человечески. Перерывы, кста, хорошие.
Коли пошли про перерывы, давайте поговорим про поесть. В универе есть столовые. Основные, это в 5 и 3 корпусах. Кормят хорошо, есть выпечка. Ценник, в целом, демократичный, но точно сказать не могу, я брал только выпечку. Была столовка в 6 корпусе ещё, но из-за ковидла её прикрыли. Ну и, в целом, коли местный хавчик вас не устроит, вокруг полно столовых и кафешек городских, времени, если не страдать ерундой, хватит.

Так-с, теперь скажу немного про учёбу. Как говорили при Союзе, как вЛЭТИшь, так и вЛЭТИшь. Иии, да, тут эт, отчасти, справедливо, учится трудновато многим. В целом, должен сказать, что тенденция на ФЭЛе простая: первые два-три года тут вам дают очень много общего, базового материала. В целом, как выразился один выпускник, во время бакалавриата, Вас будут пичкать всевозможными и изуверскими вариантами физики, химии и математики. Вообще, на курсе 13 групп, это около 320 человек. В целом, реализуются, по крайней мере, до недавнего времени так было, две специальности. В наборе 2021, как я понял, электронику и наноэлектронику рассобачили на 4 направления. Но это сути не меняет, первые два года на всём факультете одни и те же. Электроники вы или нанотехнологии изучаете, вообще без разницы, учите вы одно и то же: матан, физика, химия, кванты, алгебра и геометрия, мат статистика, методы матфиза, материалы электротехники, её же компоненты, тоэ, всякая экономика и история и так далее. Единственное возможное отличие, это что есть два потока по 160 человек. На разных потоках лекции ведут разные преподы, что порой чутка влияет.
Далее, поговорим о самих препода. Они тут разные. Есть очень хорошие, есть с прибабахом. В целом, особенно много приколов происходит на кафедре шизики, ой, простите, физики. Есть тут преподы-зайки, вроде А. Л. П********** или О. А. А********, которые всегда помогут и которым даже в вк можно написать с вопросом каким-нибудь. Но порой случаются преподы, вроде, Н. Л*****, которые являются явными сексистами и неприятными личностями, всеми силами старающиеся не принять лабы, но даже у них, будучи в опале, можно неплохо сдавать работы и всё успевать. На других кафедрах, с которыми вы будете работать, в основном, преподы нормальные, не злые. Могут быть очень строгими, но как люди, нормальными. И если на таких вот кадров с явными проблемами в мировосприятии не налетать, то будет у вас всё хорошо. Если вы не будете откровенным мудакам и лентяем, преподы с радостью пойдут на встречу, помогут, объяснят, поддержат, порой они могли позволить дерзость раскрыть нам инсайд инфу, например, как лучше общаться со сложными преподами. Порой они даже рады, если студенты просвляют интерес и пытаются понять то, чего не поняли. 
С точки зрения квалификации, здесь работают знатоки своего дела. Порой они, правда, не очень понятны для студентов, специфичны, забывают, что перваши ещё не успели толком обвыкнуться, но к этому надо просто привыкнуть. 

К вопросу о привыкнуть, очень хорошо помогают многие старшекурсники. Сливают лабы прошлых лет, методички и учебники, помогают решать сложные задачи, помогают общаться с проблемным преподами, дают советы по тому, что и как делать. В этом году, даже выкатили методу своего сочинения с азами, которые помогут первокурснику. Кроме того, к каждой группе прилеплен студент-куратор из числа ребят 2 и выше курсов, который обязан помогать студентам обживаться в университете. Да, не всем на них везёт, но, в основном, реально помогают. Иногда даже помогают кураторы других групп.

Ну и коль перешли к организациям, пара слов об внеучебке и администрации.
Вот тут начинаются приколы. Работает администрация по-разному. Порой не могут нормально сделать справку о, том, что ты учишься в универе. Порой могут ошибиться в очень глупых вещах. Деканат ФЭЛа, вещь довольно лютая, должников, кто просрал все полимеры, могут запросто отчислить. Да, порой с кучей долгов, при наличии должного везения можно крутиться довольно долго, но это редкость, хоть деканат и тянет сроки порой, среди всех факультетов, терпение у фэловского кончается быстрее всех.
Всякие студ организации есть. Есть студ отряды, студсовет, те же кураторы, театралка, КВН, конференции и прочее и прочее и прочее. Кроме того, на физре (она обязательна) секции идут по выбору: офп, кочалка, волейбол, аэробика, скалолазка и тд. Оборудование для этих занятий есть. И на некоторые секции даже есть нормативы.

Если резюмировать: баллы на ФЭЛ в прошлые года не очень высокие, но это не значит, что тут ваще расслабон и кайф. В течение сема, может быть, но потооооом. Поэтому, если не быковать, не лезть в конфликт, не страдать фигнёй всё время, а хоть немного стараться, то на 3 можно закрыться спокойно. На 4 уже надо трудиться. 
В общем, совет такой: не ленитесь и учтите, что фэл, это хорошее, но не не идеальное место и поэтому надо просто понять, как возникающие проблемы решать или обходить. 

Всем спасибо за внимание. ",medium
"


Всем привет, я окончил 2 курс ФКТИ (ИСиТ), и хочу рассказать абитуриентам, что их ждёт в ближайшем будущем.

Жить вы, скорее всего, будете недалеко от универа. Общаги хорошие. Большинство преподов классные, но тут как повезёт.
Зачёты тут дифференцированные, т.е с оценкой, так что стипендию вы вряд ли сохраните. Корпуса все рядом, почти все в хорошем состоянии. Из негатива: К******* уже хочет вас отчислить, попадаются отвратительные преподы (хотя так бывает в любом универе), много бесполезных непрофильных предметов (закрыть их изи), физика весь первый курс (это ад). Больше ниче плохого вспомнить не смог. 

Про физру, тут можно выбрать любую секцию (волейбол, баскетбол, атлетика, плавание) и ходить туда. Так что будет интересно.

В ЛЭТИ, как и почти любом универе, из вас не сделают разработчика. Поначалу вас будут кормить большим количеством математики и непрофильных предметов, всё это нужно просто пережить. Программирования будет меньше чем хотелось бы, так что готовьтесь прогать сами - и это нормально. Из языков программирования: на 1 курсе у вас будет или питон+си, или плюсы. Дальше джава или сишарп. Курсачи по проге на 1 курсе будут каждый семестр, и обычно они интересные.

Вкрат...Показать полностью...це, если хотите много ботать и стрессовать, для вас ОК не иметь свободного времени, для вас не проблема ~50 минут ежедневно ездить до универа и обратно в общагу (не касается БВИшников и платников), вы хотите пользоваться развитой экосистемой универа (и хотите чтобы универ вам нашел хорошую стажировку) -- вам на хорошие программы в ИТМО. Да и вообще в ИТМО намного больше проги, если у вас завышенные ожидания от универа, то поступайте туда (хотя все равно ботать всё придется самим, универ вас будет направлять и контролировать).

С другой стороны, есть ЛЭТИ, где пары зачастую начинаются в 11:35+ (это круто), где у вас будет меньше проги на первых курсах, но и общая нагрузка будет не такой большой -&gt; можно одновременно жить студенческой жизнью (бухать), учиться в универе и ботать самостоятельно. В ЛЭТИ реально много возможностей, и если вы не собираетесь просто плыть по течению, а хотите искать для себя что-то интересное и постоянно развиваться -- вы получите от этого университета всё, что вам нужно, главное искать. Так что если вы хотите ботать сами и иметь свободное время, ЛЭТИ классный выбор.

Но только не думайте что здесь изи, все-таки всё зависит от направления, преподавателей и вашего довузовского уровня подготовки.
А если будете забивать на учебу, отлетите. Особенно на ПИ/ПМИ.
Пока я не жалею, что поступил сюда.",positive
