Text,Mark
"


ЛЭТИ, как и большинство ВУЗов имеет положительные и отрицательные стороны. За 6 лет обучения и тех и тех накопилось примерно равное количество.

Положительные:
-----------------------------------------------
- есть сильные преподаватели, с которыми интересно работать;
- есть мощные аспиранты, которые тут не ради денег. А молодые преподаватели - очень важный элемент для любого ВУЗа;
- очень развита творческая жизнь. Всевозможные конкурсы, ЧГК, Хор, Вокальная студия, КВН, танцы и т.д. И всё на уровне - выше среднего, но за деньги, которые ниже возможного;
- отзывчивые люди - на кафедрах, в принципе в ВУЗе;
- неплохие компании-партнёры, где можно, при большом желании пройти практику;
- диплом ВУЗа, который неплохо ценится в компаниях;
- огромное количество учебных материалов и своя большая библиотека;
- возможность занимать как наукой, так и творчеством, тут помогут, подскажут, направят. Главное - иметь желание;
- исторический ВУЗ со своими традициями и именем Попова - классическое обучение, сейчас таких практически не осталось - единицы.

Отрицательные
-----------------------------------------------
- нет денег не только на студентов, но и на какую-то внутриВУЗовскую жизнь. Всё макси...Показать полностью...мально бюджетно - в плане, что исполняющие ничего от этого не получают совсем от слова СОВСЕМ... Кроме затраченного времени и сил;
- богатый профком, который не с большим желанием делится;
- отсутствие рекламы и пиара ВУЗа, в чём происходит значительное отставание от ИТМО, например;
- очень трудно выбить какую-то стипендию. Для этого нужно проделать кучи процедур и обойти много инстанций;
- магистратура. Очевидно, если самому не упираться в учёбу и не искать себя в науке, а заниматься заработком и своими делами, то это просто два года жизни и не более того... Ничего кроме общежития и студенческого времени не дают;
- есть странно неподъемные и нечто высокое возомнившие из себя кафедры... Например, кафедра инновационного менеджмента. Преподаватели на этой кафедре относятся к студентам, как непонятно к кому;
- слабый аппаратный набор в лабораториях, но зато все точно помнят, как опускали шарик в трубку с жидкостью;
- есть ужасные преподаватели. И речь не только о пожилых людях, которые забывают, о чём говорили, но и о принципиальных, узколобых. К одному из таких можно отнести Ш*** с КСУ. Человек не принимает своих ошибок в методичках и принципиально не ставит оценки, пока не измучает человека, но это относится только к тем, кто учит. К халявщикам такого отношения нет, там всё в порядке - в итоге.

Итог
-----------------------------------------------
У ВУЗа достаточно негативных моментов, от которых не трудно избавиться, но тут по большей части всё решает спонсирование, которого почему-то у ВУЗа нет, хотя он ежегодно выпускает огромное количество дипломированных специалистов, которые знают своё дело. И большая часть из них выходят уже трудоустроенными. 
Если описывать своё субъективное мнение: не смотря на все недостатки, ВУЗ дал мне самое главное - ... нет, не образование... Умение учиться, развиваться, искать самостоятельно пути и двигаться вперёд. Я благодарен этому ВУЗу, а в особенности всем негативным моментам, потому что они только закаляли и не давали сидеть на месте. Спасибо, &quot;ЛЭТИ&quot;! Этот ВУЗ дал путёвку в жизнь.",medium
"


Сейчас я третьекурснк, вуз в целом нравиться... самое лучшее в лэти это широкие рамки требований и возможностей... тоесть если вы хотите то получите отличные знания но придётся работать самому и донимать преподавателей, ( они кстати обычно не против) и думаю что база тут самая сильная... особенно ТОЭ, особенно если попадёте к Ч******* или З********* (те самые 89.9 которые всех обставят)  думаю года до 2030 они ещё могут дотянуть наверное... спешите блин, таких преподов больше в мире не осталось... ну а тем кто почемуто забил на учёбу тоже тут не кердык... тянут, дают кучу шансов и попыток, но автоматом никто не поставит... будь добр хоть прояесть что сдаёшь...(прогулял/проболел 2,5 месяца из 3 учебных но дали возможность выучить и закрыться)  льготы все на уровне как у любого гос вуза... люди в целом нормальные, атмосфера доброжелательная... общага так себе, но хорошо что есть... да столовки хреновые, но полно других в радиусе квартала... лабы делаем порой на старье - но так даже прикольнее в России полно мест где работоспособность изделия зависит от использующего человека...  да и не всё тут рухлядь, как доучитесь до 3го курса то  обучать вас будут на оборудовании которое поставля...Показать полностью...ют потенциальные работодатели... они вполне себе новые... у вуза есть имя, история и своя школа... показатели если их разделить на финансирование будут лучшими в спб точно...  итмо, лэти или политех? Смотря какая специальность Гф-политех, инженер как вид - точно лэти, ну а в итмо напомаженные мальчики  пргают лакированные компики... те кто зарубеж валить решил вам пожалуй туда... мы не обидимся если не увидим  тут ваши кислые физиономии...",positive
"


Я не студент, не преподаватель ЛЭТИ, и даже не отец студента - сын только в школу пошел. Сам я заканчивал матмех. Я работаю начальником отдела в одной из тех контор, которые принято называть предприятия ОПК, хотя на практике они делают почти все от паровозов до пароходов в завимости от заказчика. Пишу я этот текст потому что столкнулся с ситуацией массового и вопиющего НЕПРОФЕССИОНАЛИЗМА выпускников нескольких вузов в одном проекте. Так случилось - все мы смертны - ведущий разработчик одной из ключевых систем в нашем изделии скоропостижно скончался. Хороший был мужик, не старый и очень талантливый. А дедлайны жмут, работа сделана процентов на 50, осталось самое трудное - реальное железо. Залить все это, оттестить, цикл разработки, документация. Ну и сдать заказчику. Я стал лихорадочно искать кадры. Шибко квалифицированного быстро фиг найдешь, к тому же все говорят ставку делай на молодежь, вон у нас вузы какие-то там в какие-то рейтинги международные вошли, вся херня. Накидали мне резюме, выбрал я себе таких кадров - интеллигенты, образованные. Закончили два разных вуза, оба ну очень известные. Первый на рынке труда года два-три уже околачивается, пробует себя, значит. Другого взял...Показать полностью... с опытом работы из не менее известного вуза - там где всяких технарей разных готовят. Говорю - сделаете аппаратку? Они посмотрели на документацию, на это все, говорят - читать надо. Ну читайте. Читали-читали, вторая неделя уже к концу тем временем. Там ребята другие конечно проект делают, команда-то не развалилась, поэтому я и не волнуюсь особо. Потом первый, который из крутого вуза на И, подходит ко мне и говорит: &quot;вы знаете, Олег Саныч, у нашего проекта питч плохой. Мы его не сдадим, я думаю&quot;. Я просто о##ел. Говорю, что плохое? Антенна там говно, или передатчик барахлит еще понятно. А это что за чудо такое выдумал. Он смотрит на меня как Ленин на Каплан и презрительно так говорит: &quot;ну понимаете, он морально устарел. Должна быть броская модная идея. Чтобы инвестор за 3 минуты захотел денег вложить. И вообще у нас организация совковая какая-то. Надо ей ребрендинг устроить, тогда и заживем&quot;. Вышел я из курилки такой, пошатываясь, а навстречу второй идет, который в крутом техническом вузе работал. Говорю ему: ты-то как, вошел в работу? Он смотрит и говорит так тихо: &quot;я вам честно скажу, Олег Александрович, на таком оборудовании которое я у вас видел, еще мой папа работал у себя в КБ. Да и оплата труда у нас такая, что за эти деньги я должен только приходить&quot;. Тут я и осознал, что с нашим высшим техническим образованием что-то не так. Какой-то п##дец. Один пальцы гнет, маркетолог х##в, другому видите ли платят мало и стул старый на работе. Ему без опыта реальной работы (университет не в счет) сто тыщ сразу подавай. И чтобы кругом General Dynamics был, желательно. И в сортирах не очки. 
Вы спросите: дядь, а ЛЭТИ-то тут при чем? Да остальная часть команды оттуда была. Еще одного молодого взяли, и к дедлайну доделали. Сдали изделие. Я уж не знаю, в чем разница систем подготовки. Кормят мож чем другим. Но вот такая история. Когда модно и молодежно, это, конечно здорово. Но мне бы хотелось чтобы еще и работало. Чтоб люди железо знали, делать могли, и за работу свою отвечали. В общем, всем комсомольский пламенный привет тут.",positive
"


Итак, мой отзыв сейчас будет про самого ужасного преподавателя ЛЭТИ и по совместительству препода гуманитарного факультета К**** ЮРИЯ. Пришел этот экземпляр к нам из СПбГУ и лучше бы там и остался. 
Он совершенно неадекватный. Я от лица всех студентов заверяю, что этот преподаватель нуждается в психологической и психической госпитализации, его реакции совершенно неадекватный и он доводит весь поток за одну лекцию до головной боли. Серьезно. Вы когда нибудь слушали сумасшедшего человека? Так вот !то невозможно слушать! 
1. Он навязывает свое мнение , причем жёстко.
2. Он призывает вести аскетический образ жизни 
&quot; Никакого секса, никаких развлечений и ТД&quot;- это его цитата 
2. Невозможно возразить, он начинает оскорблять человека и принижать его статус, кричит&quot; кто ты такой тут&quot; , причем реакции на совершенно обычные вопросы. 
3. Девочки боятся его, они в прямом смысле боятся, что он бросился на них. 
4. Он оскорбляет поток.
5. Он выгоняет студентов с пары, просто потому что те подняли руку, а потом хотели что то сказать. 
6. Он противоречит в своих высказыааниях: сначала говорит, что мы ему хамим, когда весь поток сидит молча и просто боится что то сказать, а пото...Показать полностью...м сам нам хамит.
7. В целом , его поведение и реакции неадекватны, он начинает кричать в пустоту и типа учить нас жизни, все молчат, он взрывается ещё больше и кричит кричит кричит. 
8. У него маниакальная нааящевая идея, что мы его снимаем. По закону, мы имеем право снимать преподавателей на месте осуществления их должностных обязанностей, поэтому мы это и сделали
 
Если нужно будет сдать его в дурку, весь поток подпишет бумагу
Препода нам не поменяют, так как не на кого. 
Как выживать с психом, мы не понимает! Сос",negative
"


Что сказать вам за ЛЭТИ?
Слов мне нужных не найти.
Мы - венец архитектуры,
Танцев ВУЗ и физкультуры,
Учим тысячи балбесов,
Кодеров, тяжеловесов,
И армреслинга звезду,
И тупейшую п..зду,
Наш студент бузит в общаге,
Строит схемы на бумаге,
Курсачи, дипломы,  лабы
Напрягают всех неслабо. 
Защитится - тяпнет водки,
И уже в подводной лодке:
На все руки он мастак,
Чинит БИУСы и ГАК,
Знает технику с изнанки,
Связь дает и строит танки,
Отправляет сам в полет
Беспилотный самолет.
За хрустящую купюру
Он построит вам эпюру,
Соберет в один момент
Микронаноэлемент.
Что ж до жизни в институте
В ней, дружок, немало жути:
Матанализ, ТОР и ТОЭ -
Дело очень непростое!
Спросишь ты: а как же дамы,
И культурная программа?
КВН, Что-где-когда?
И подобная байда?
С этим все у нас в порядке:
Есть и конкурсы, и бл*дки.
Тут внутри ЛЭТИшных стен
Постоянный КВН.
Есть, конечно, и проблемы
Частью все вина системы.
Но в столовке таракан
Уже собственный изъян.
Впрочем этот недостаток
Не достоин так нападок,
Как столовская еда:
Вот уж где пришла беда.
Если вдруг ты колебался,
&quot;Поступать ли?&quot; сомневался,
Слушал всяческих лошар
И голимейший пиар.
Вот тебе, друж...Показать полностью...ок, совет:
Там где лоск, науки нет.
Нет технической находки
Там где вычурные шмотки.
Где попса и болтовня
Происходит лишь фигня.
Там где преподы суровы
Есть и школа, и основы,
Твердокаменный матан
Должен быть студенту дан.
Не плутайте, абитура,
У кого губа не дура
Нету лучшего пути
Чем в уютненьком ЛЭТИ!
",positive
"


Несмотря на отрицательную мордочку, символизирующую уныние, в которое я впал за годы обучения в ЛЭТИ, ЛЭТИ может быть хорошим вузом с определенных точек зрения.
Если вам в принципе нужен только диплом технического вуза, напрягаться с учебой вы не хотите, а хотите в это время заниматься своими делами - ЛЭТИ подойдет вам очень, очень хорошо. Если вам было по силам получить школьный аттестат, то и с обучением в ЛЭТИ вы справитесь. Балбесом никогда не был и с вымогательством не сталкивался, но в самой терминальной стадии лени коньяк с вашей стороны все решит. Второй большой плюс - отсрочка, родимая. Куда же без нее. Если бы она не была так важна в определенные годы жизни, эффективнее своими делами было бы заниматься и вовсе без ЛЭТИ.
Если же вы рассчитываете получить в вузе знания или интересную профессию - ЛЭТИ станет для вас большим разочарованием. Знаний вы здесь не получите, профессиональных навыков тоже. В моменты, когда (возможно) могло быть затронуто нечто практически полезное, от некоторых преподавателей вы прямо так и услышите: &quot;вот это мы проходить не будем, кто будет с этим работать - сам потом разберется, остальным это не надо&quot;. Спасибо, я конечно разберусь, но ...Показать полностью...см. 1 пункт. Я шел вроде как учиться чему-то от знающих людей, а получил &quot;да учись ты сам чему хочешь, вот тебе стипендия, льготный проездной, отсрочка - что еще тебе от вуза надо?&quot;. Что-то за эти годы вы, конечно, узнаете, но сгодится оно только быть репетитором у школьников и студентов ЛЭТИ помладше.
Нередко можно услышать что-то в духе известного сатирика &quot;в других вузах лучше обстоят дела с деньгами, но зато они тупые, а у нас смекалочка&quot;. Да, мы не выбираем, в какой стране родиться, и надо как-то себя подбодрить, но уж вуз-то выбрать мы себе в состоянии, и я надеюсь, что вы избежите моей ошибки.",negative
