Text,Mark
"


Очень удивлен восторженным отзывам. Я учусь на очно-заочном. Чтобы вы понимали уровень вуза, то к концу 3-го курса я не владел ни одним языком программирования. Языки программирования тут просто никто не преподает.  Были лекции по Си, на которых препод говорил про жизнь, был старый ассемблер, который чтобы запустить, надо установить ms-dos, периодически дают лабы, которые надо писать на с++, хотя лекций не было, и лабы эти не о чем. Структуры данных и алгоритмы тоже полный провал, даже не был темы сложность алгоритмов и препод говорил больше за жизнь, а не про предмет. Очень много непрофильных предметов с кучей тем. Про питон, java даже не заикайтесь. Может питон дадут на введении в машинное обучение и то скорее всего отправят онлайн курс проходить. Могу отметить только преподавателя по ОС Ш****** В. В.- очень интересный и полезный курс провел и М***** А.В. по матану. 
На очно-заочном лекции проходят по вечерам с 19 до 22 с копейками четыре раза в неделю. Физру ставят автоматом. Есть физика и другие предметы связанные с физикой это зависит от направления 090301 и 090302. На последнем направлении нету тоэ, схемотехники и еще много чего неинтересного, что несомненно плюс. 
Я бы рекомендовал обратить внимание на кафедру epam, которая открылась в этом году в университете в Вильнюсе. Там полностью дистанционный формат обучения с очными сессиями. Потому что в РФ только два-три вуза, где есть вечернее обучение и качество обучения вызывает вопросы.",negative
"


Первые пару курсов не подозреваешь насколько этот вуз шарага. Идёт достаточно сильный матан с сильными преподами, физика была неплохой, но после меня, говорили, был препод, превративший ее в жёсткий матан, что не есть 100% хорошо.
Но это все цветочки. Далее буду рассказывать касательно обучения на ЭПУ 3-4 курс и маги на кафедре ЭП. 
В общем для среднего студента это полная ерунда. За четыре года обучения было какое то безумное количество одной и той же вакуумной электроники. На минуточку технологии 100 летней давности. Нового за каждую иттерацию было с гулькин нос. Схемотехника простетская, на Ютубе лучше научиться можно. Микроконтроллеры только в магистратуре и, если правильно помню, даже не полноценный курс, а половинчатый. Задания чуть сложнее &quot;помигай светодиодом&quot;. То есть предметы которые действительно нужны даются в малом объеме, в сравнении с вакуумом. Добавлю, что хороший и обширный курс ТОЭ забывается к моменту начала схемоты, да и учитывая ее простоту не особо требуется. 
Вот на схемоте ещё относительно приличное оборудование на лабах было. Но вот на других предметах до треша откровенного доходило, приходилось периодически чинить прибор самостоятельно во время л...Показать полностью...аб или страшно было его касаться, вдруг рассыпется. Может сейчас уже обновили оборудование, но хз научились ли им пользоваться.
В магу можно попасть чисто из-за  договоренностей и мухляжа. Ты можешь учиться выше среднего и проиграть в разы по баллам троишнику, который чудом дожил до диплома, но зато с нарисованными статьями/докладами и т.п. Более того это высокоразвитое существо ещё и в аспирантуру также попадет.
Как откос от рабства 21 века, срочной армии, сойдёт (и то вместе с военкой). Кстати военку лучше выбирать сержанскую ибо: качество обучения ничтожно везде, но на лейта гораздо дольше и запарней, а раз дольше то и больше и сложнее экзы, а это не дёшево. 
Если есть вариант откосить от армейки и пойти на какие нить, условно, полугодовалые курсы, то лучше так и сделать. Велик шанс устроиться на хорошую работу и потратить гораздо меньше времени и нервов.
Чуть не забыл упомянуть, что откровенной коррупции не было. Были на квантах &quot;курсы&quot; у &quot;мистера 600 рублей&quot;. Предмет вел весело, но половину пар отменил, задачи на единственной кр дал далеко не те которые разбирали, пересдавать не давал вообще и предлагал курсы. Можно было не пересдавать, но тогда валил на экзе.
На кафедру ЭП идите только если на отвали. Полутрупы преподы вас мало чему научат, но могут задолбать)",negative
"


Я поступил на направление &quot;Информатика и вычислительная техника&quot; в 2020 году. За полтора года было и хорошее, и плохое, но первого точно намного больше.

Начнем с самого главного - преподавателей. Больше всего буду говорить о профильных предметах, то есть связанных  математикой и программированием.
В целом, примерно 8 из 10, но, возможно, мне просто повезло. Однако некоторые из лекторов и практиков реально вызывают восторг - первая лекция одного из таких закончилась стоячей овацией - а к другим ходишь только для посещаемости.
Алгебра и геометрия, алгебраические структуры - просто восхитительно, обожал эти пары. Почти регулярный диалог в пятницу утром перед дистанционной лекцией с одногруппником:
- Кайф, две пары у И****** [радостный смайлик]
- Да, ботаем [крутой смайлик]
Дискретная математика - тоже замечательно: лекции вполне интересные, но ничего сверхъестественного, а вот практик был просто отличный.
Математический анализ на первом курсе был, в целом, неплохой. Первый практик объяснял не слишком хорошо, а задания давал практически совпадающие с примерами, поэтому можно было повторить алгоритм, не разобравшись со смыслом своих действий. А вот второй давал большое задани...Показать полностью...е из нескольких десятков различных примеров на какой-то период времени. Вот здесь приходилось часами сидеть над лекциями, записями с практик, статьями на mathprofi и онлайн-калькуляторами, чтобы решить эти задачи, но зато при этом действительно вырабатывался навык, даже если иногда было больно.
Программирование - средне. Лекции - ничего особенного, лабораторки - тоже. Иногда слишком сложные, иногда слишком легкие, смотря повезет ли с вариантом. Приходилось сталкиваться с довольно странными требованиями от преподавателя без объяснений, зачем это нужно, но в целом сойдет.
На втором курсе перевелся на &quot;Программную инженерию&quot;, так как направление &quot;ИВТ&quot;, как оказалось, было слишком тесно (для меня) связано с физикой.
Теперь уже математическое моделирование оказалось тоже неплохим. Хотя лектор рассказывал материал тихо и довольно сумбурно, если привыкнуть и постараться сохранить концентрацию, окажется, что материал-то, на самом деле, интересный. Кроме того, были домашние задания от лектора, которые, если разобраться, тоже были достаточно полезными и интересными. Практик у нас был веселый: замучает у доски задачами, но материал ты поймешь, да еще и в процессе услышишь несколько анекдотов.
Комбинаторика и теория графов - еще лучше: лекции интересные, практики бодрые.
Объектно-ориентированное программирование - отлично. Сложные, иногда очень сложные лабы, но преподаватель дает отзыв и объясняет, как сделать лучше.
Алгоритмы и структуры данных - замечательно. Интересно, понятно, полезно.
Организация ЭВМ и систем, вычислительная математика - средне. Не так интересно, но тоже может пригодиться в жизни.
Если предмет непрофильный, то там обычно все не так радужно, но, как и в случае с остальными предметами, зависит от того, какой попадется преподаватель. Мне на правоведении было достаточно интересно, а на философии - совершенно нет, а у кого-то наоборот.

Оборудование и корпуса.
Некоторые лабораторки по физике, например, сдаются на, кажется, устаревшем оборудовании, но вроде бы все работает нормально. Ремонт есть не везде, но зимой не холодно. Зато холодно осенью, когда еще не включили отопление. Есть столовые с вроде бы нормальными ценами и едой, но более точно оценить не могу, так как случился коронавирус. В третьем корпусе недавно сделали ремонт - загляденье.

Расписание.
В целом, нормально. У нас не было окон, от двух до четырех пар в день. Но на первом курсе часто начинали днем и заканчивали вечером, так что по приходе в общагу уже было довольно поздно, поэтому желания заниматься практически не было. В третьем семестре занятия начинались по утрам, но получилось так, что почти все лабораторки были в четверг и пятницу. Теперь я знаю, что такое &quot;поспать три часа за двое суток&quot;.

Дополнительные фичи.
Именно это и сподвигло написать меня этот слив. Речь не про стипендии, так как они не слишком высокие: за все пятерки - а это не только экзамены, но и несколько дифференцированных зачетов - сейчас можно получать стипендию 5 тысяч в месяц.
Я говорю о том, что помимо учебы здесь есть полно других возможностей самореализоваться: студенческий университет, семинары по тропической математике, научные проекты со студентами, даже альтернативный экзамен по ДМ или КиТГ - выполнение проекта в течение семестра и защита его на сессии для получения автомата на экзамене - это возможности для знакомств с интереснейшими людьми, саморазвития и поиска своего пути. Те преподаватели и студенты, кто организует все это - очень заинтересованные и крутые люди.

Вывод.
Иногда тяжело, иногда совсем нет сил и времени. Но если ты хочешь учиться и развиваться, то здесь тебе наверняка в этом помогут. По крайней мере, я пришел сюда именно учиться, и мне здесь очень нравится.",positive
"


Плюсы:
- Из пар в первом семестре все были очными, кроме физры и лекции по истории в субботу — луч света в мраке дистанционки! 
- Попадались в основном просто замечательные преподаватели, очень приятно слушать человека который увлечён своим предметом
- Были дополнительные семинары по физике для отстающих
- Были дополнительные лекции и семинары по физике и математике для заинтересованных. 
- Не е*** мозги посещаемостью. 
- Дружный студенческий коллектив, сливающий всё что можно сливать :) 
- Хорошая столовая с разнообразной и вкусной едой
- Коррупции не замечено
- Приятная атмосфера нормальных честных людей. 

Минусы:
- Программа не рассчитана на текущее число пар (их ужасно мало, пятидневка по три, не считая дистанционной субботы — в девятом классе блин нагрузка сильнее), лабы по термодинамике начинаются в конце октября — лекции по термодинамике начинаются в конце декабря, лекции по химии тоже не успели полностью прочитать. Соответственно, гонят. 
- Столовая единственная на все корпусы, очереди ужасные. 
- В некоторых корпусах холодно, в других же — адское пекло. Ремонт как в квартире соседей — продолжается бесконечно и ездит по ушам прямо во время занятий.  
- ИТ — просто тихий уж...Показать полностью...ас, в школе, блин, нескольких лет изучения офисного пакета не хватило. Очень важные и нужные уроки по работе с майкрософт павер поинт, никогда же не задавали в школе презентаций, совсем никогда, в первый раз программу видим. Неиронично прочитали лекцию про вебстраницы (и их разнообразие кодировок текста) в сети &quot;Интернет&quot;. 
Было чуть-чуть матлаба, но совсем чуть-чуть, а по хорошему весь семестр из него состоять должен. 

Нейтральное:
- Внутри корпуса, как было замечено до меня, действительно выглядят частенько довольно обшарпанно, но единственный раз, когда это мешало — толстый и неровный слой краски на так-то добротных партах из массива (третий корпус четвёртый этаж), писать контрольные/экзамены неудобно.
- Пары в основном начинаются в 11:40
- Мест много и, соответственно, студенты слабые, практически всем на учёбу откровенно пое**** – но такова природа абсолютно любого студенческого коллектива

В целом — нормальный вуз для нормальных людей. Как в положительном, так и в отрицательном  смысле — если амбиции горят, хочется отдать жизнь за Нерзула (науку там, релокейт) — вам, наверное, не понравится. ",medium
"


Учился на кафедре БТС , являлся иностранным студентом , живу в стране в которой заблокированы многие соц.сети в том числе вк , в котором кидали материалы для дистанционного обучения и лабы. Прилететь так и не удалось. Пытался объяснить ситуацию деканату , но видимо всем фиолетово на иностранных студентов на бюджете и выгоднее было избавиться от меня чем принять мое положение. На дистанционном обучении смог проучиться один семестр (дальше начались проблемы с впнами и ужесточение закона об использовании интернета внутри страны). Дистанционное обучение было ужасным. У некоторых преподавателей не работал интернет и/или они тупо не проводили никаких пар и кидали материалы на почту. В целом приходилось учиться самому ибо никто толком ничего не объяснял. И было сложно с графиком на дистанционке так как часовые пояса сильно отличаются. Еще и некоторые преподаватели требовали качать программы которые не поддерживал мой старенький ноутбук, а на новый средств нет. Жаль что ВУЗ не понимает положение некоторых студентов и просто избавляются от них. ",negative
