Text,Mark
"


Я поступила на бакалавриат направления &quot;Информатика и вычислительная техника&quot; на очную форму обучения. Но, проучившись полтора курса, приняла решение отчислиться. Изначально писать слив о вузе не планировала.Однако была очень озадачена &quot;зеленой меткой&quot; и званием лучший вуз 2021 года по версии данного сайта.
Хочу обозначить проблемы, на которые наткнулась я. Начну с лайтового. Ну, во-первых, мне не очень нравилось учиться во &quot;вторую смену&quot;. Пары начинались в 11:40 и нередко заканчивались в семь вечера. Думаю, многие согласятся, что при таком расписании, день идет &quot;на минус&quot;.
Далее. Физкультура тут два раза в неделю и ходить на нее обязательно. Больше двух пропусков нужно отрабатывать. 
Еще один прикол данного вуза - все зачеты дифференцированные. То есть с оценкой. Не знаю, зачем так сделано. Видимо, чтобы сложнее было сохранить стипендию и платникам перевестись на бюджет.
Также хочу отметить обустройство и расположение. Как уже сказали многие, ремонт здесь плохой,стены обшарпанные. Но когда я уходила, вроде начали проводиться какие-то работы, как сейчас - не знаю. В библиотеке нет новых хороших учебников по специальности. 
Все корпуса располо...Показать полностью...жены в одном месте, поэтому от пары к паре придется ходить по улице в разные здания. Универ находится в десяти минутах от метро. По-началу норм, но со временем начинает з*******ь. 
Преподаватели и администрация. С хамским отношением я столкнулась еще в августе. На вступительном собрании проводившая его женщина из деканата общалась с нами как с птушниками. Ну ладно, думаю я, в семье не без урода. Но каково было мое удивление, когда я узнала, что для лэти такое отношение - обычное дело. Половина работающих здесь это маразматики с высоким самомнением и желанием унижать всех и вся. Постоянные упражнения в юморе, нелепые насмешки над студентами, самолюбование, удаления с пар. Однажды я имела наглость не посмеяться над шуткой одной молодой преподавательницы, и она заставила меня об этом сильно пожалеть. Администрация ничем не лучше. Каждый раз при посещении деканата приходилось &quot;отплясывать&quot;. И вообще, обращаясь к кому-то с вопросом/просьбой, я всегда говорила себе &quot;тебе будет больно, но ты должна улыбаться&quot;.  
Всеми обожаемый Ж******* А.В. не пришел на пересдачу, которая стояла у него в расписании. Я ждала его два часа, а когда все-таки нашла, он начал на меня кричать, говоря, что ему надо кого-то забрать из ментовки (а я-то тут причем, А?). В итоге сходила на пересдачу пять раз (задал задачку, которую не смог решить никто из моей группы). На пятый раз он-таки поставил мне тройку, но только после того, как я по его просьбе согласилась с тем, что я тупая баба. Заявление на него я писать не стала, он там явно человек не последний, с К********* А.С. дружит, а значит они этим моим заявлением просто подотрут себе ж***. Ну хотя бы узнаете вы. (Кстати, когда отчислялась, оказалось, что тройку он мне поставил на &quot;дне качества&quot;, видимо, просто помучить хотел)
Также непонятно зачем программистам так много физики, но эта тема уже вроде как обсосана. 
ЕДИНСТВЕННЫЙ плюс этого вуза - столовые. Они есть в каждом корпусе, с большим ассортиментом и адекватными ценами. 
***
Лучший вуз 2021 года? Нуу, для любителей БДСМ, наверное, подойдет...
Хорошо подумайте прежде чем сюда поступать. А если вы девочка - подумайте вдвойне. Чмор будет идти не только со стороны преподавателей, но и со стороны одногруппников (ну тут кому как повезет, конечно). Здесь самый первый отзыв - стишок, в котором четко видна мизогиния, и все его лайкают. Это как нельзя лучше отражает отношение к женскому полу в этом вузе. Любая девушка здесь априори тупая п****, и чтобы доказать обратное нужно очень сильно постараться. 

Все. У меня все. Спасибо, что прочитали! Никого не хотела обидеть! Всем добра! ",negative
"


Привет, читатель сайта отзывов! Ищешь лучший ВУЗ, который позволит тебе стать крутым программистом? Тебе точно не в ЛЭТИ, сейчас расскажу почему.

Когда я выбирал этот ВУЗ из других, прочел очень много восхищенных отзывов о ЛЭТИ на данном сайте, поэтому теперь хочу предостеречь тебя от моих ошибок:

1. По всем предметам предполагается наличие фундаментальных знаний, тонкости на парах рассматриваться не будут.
2. Физики и математики настолько много, что в какой-то момент у тебя точно появится ощущение, что ты поступил на физмат.
3. Будут ли на парах качественно объяснять весь огромный объем информации по физике и математике? Посмотри п.1, верный ответ - нет, не будут. Думаешь, спасут преподаватели? Тоже нет, так как будут объяснять непонятно и слишком уныло.
4. Может быть все круто с программированием? Увы, нет: преподаватели рассказывают материалы из книги, которая не рассчитана на уровень новичков, которые только знакомятся с азами.
5. Информатика? Новый уровень дна: у тебя не будет занятий от слова совсем, но при этом будут требовать лабораторные работы.
6. Английский язык? Перевод бесполезных текстов и заучивание бессмысленных предложений для хорошей оценки.
7. Выгодно выделяютс...Показать полностью...я на фоне остальных предметов практические занятия преподавателя по философии, однако нет никаких гарантий, что эти знания повлияют на что-то кроме расширения кругозора.
8. У некоторых преподавателей очевидно нет желания обучать студентов, либо они испытывают явную антипатию к ним.

Возможно, после прочтения моего отзыва ты скажешь: «Вздор, я только что прочёл массу положительных отзывов». Согласен, я бы тоже сомневался, но разве есть причины порицать ЛЭТИ необоснованно? На данную секунду я обучаюсь в другом университете, и нет, там не лучше, но там легче. Также хотелось бы сказать, чтобы ты не обольщался и изучал языки программирования самостоятельно, ибо университет никогда не сделает это за тебя. Выбор за тобой, а я добавлю, что обучение в ЛЭТИ для меня лично не стоило тех усилий, которые были затрачены на поступление.",negative
"


Я прочитал довольно много отрицательных отзывов про данный ВУЗ, основная масса которых исходит от студентов Гуманитарного Факультета. Здесь ситуация очень неоднозначная, ЛЭТИ имеет много плюсов и минусов.

Я - студент 3го курса этого замечательного ВУЗа. Не сказал бы, что я самый прилежный студент, по моему мнению я трачу довольно мало времени на учебу, но при этом, мой уровень знаний потрясающий! Я студент ФКТИ и многие поступают с мыслью, что их здесь научат кодить и ничего более. Эти ребята кривятся, когда учат математику, физику и т.д. (Многие были отчислены). На самом деле, любой программист уровнем выше веб-разработчика понимает, что математика - фундаментальная наука и да, может быть, брать интегралы или решать дифуры вручную вам не придется, но работа с конкретными математическими объектами везде если вы хотите быть кем-то значащим и по-настоящему незаменимым. Мне, как я думал, немного не повезло, я поступил в последний год со старым учебным планом, включащим в себя 3 семестра физики (1,2,3), семестр ТОЭ, отсутствие некоторых &quot;новых&quot; и перспективных дисциплин (Big Data, etc.). Но на самом деле, очень многие казавшиеся лишними дисциплины оказались очень полезны. Я ...Показать полностью...даже не думал, что мне интересна работа с Электротехникой или со Схемотехникой, но вот я сижу и делаю свои проекты с помощью Arduino :)

По поводу преподавателей:

В ЛЭТИ очень много м***ков, но еще больше очень душевных людей. 

С первого же курса ты можешь встретить такого замечательного препода фанаты группа Алиса как К****** А.С. В основном, этот персонаж с матмеха на парах травит байки, рассказывает анекдоты и т.д. Практические занятия у него - сдача кучи материала без права на ошибку. Так же этот товарищ известен НЕАДЕКВАТНЫМИ требованиями к студентам. В 3 семестре у нас был зачет по матанализу. Около 8-9 задач. Суть в том, что допускалось не более одной ошибки, даже вычислительной. Помимо этого, все пересдачи назначались на 8 утра, а после 3-4 часов сна довольно тяжело не ошибиться хоть где-нибудь. В итоге из моей группы отчислили 7 человек, из которых у многих это был единственный &quot;хвост&quot; за 3 семестра.

Физика:
С физикой тут тоже не очень просто. К студентам ФКТИ, часто &quot;бегущим&quot; от физики, относятся абсолютно так же, как к студентам других факультетов при том, что количество учебных часов Физики у нас меньше. Что мы имеем в итоге: учебных часов не хватает чтобы дать весь материал и часто очень сложно этот материал полностью понять. Относительно лаб по физике - тут все зависит от препода и зачастую все может быть очень обидно и несправедливо. На первом курсе у одной половины группы был старый препод, который принимал лабы с ошибками в вычислениях, буквально спал на парах и т.д. В это же время у другой половины группы лаб. занятия вел аспирант, задававший вопросы буквально про все в лабе и закидывающий студентов задачами. Лично у меня с физикой были большие проблемы, т.к. я закончил гумманитарную гимназию и физики у меня почти что не было. Я был в группе у аспиранта, сдавал лабы на зачетной неделе. Мы сидели с 11 утра до 10 вечера. Однако, преподаватель никого не унижал, не насмехался ни над кем. Со всех спрашивал одинаково и было видно, что человек просто хотел дать какие-то реальные знания. Мне было тяжело, но в конце дня мне уже не хотелось уходить, настолько было видно желание человека отдать все, что он может.

Лектор у нас была К****** Н.Н.. Человек очень странный и неоднозначный. Лекции она читает на отвали по презентации для заочников",positive
"


Немного ниже прочитал отзыв о том, что ЛЭТИ - это олицетворение совка. И так оно и есть. Ленинграда уже давно нет, а Ленинградский электротехнический институт все ещё существует.

Если по существу. Я учился на ГФ - РиСО.
Впечатления плохие. Преподаватели к сфере отношение имеют весьма косвенное, не практикуют десятилетиями. Соглашусь и с отзывом ниже, очень много странненьких. Самооценка при этом не хромает. Приходят на пару с таким видом, словно совмещают преподавание в ЛЭТИ с преподаванием в Кембридже, а между делом ещё руководят отделом креатива в студии Артемия Лебедева. Между тем, реальных навыков/знаний/профессионализма - кот наплакал.

Материал на парах дают 20-летней давности. Будьте готовы, что выйдете из вуза и пойдёте учиться по новой на курсы и мастер-классы, но уже за деньги. А жаль.

С тех пор как обновился зав.кафедрой есть какие-то подвижки. Но оооочень медленные и странные. Попытки обновить и омолодить кафедру больше похожи на эстафету бредовых кадровых решений. Серьезно, этих персонажей нужно видеть.

В общем есть наверное кто-то, кто закончил и ВУЗу благодарен, всем доволен и счастлив (пишет же здесь положительные отзывы кто-то). Но в моей группе довольных нет. От слова совсем.",negative
"


Я пока ещё студент, но молчать и ждать защиты диплома не могу.
Я учусь на гуманитарном факультете. Реклама и связи с общественностью. Вот, что я наблюдаю четвёртый год:
1) Абсолютная преподавательская некомпетентность
Возможно, когда-то эти люди имели отношение к СО. Сейчас это проф.непригодные преподаватели с абсолютно устаревшим контентом. В дополнение к этому, все, как на подбор, со странностями.
2) Организационный хаос
Никто ни за что не отвечает. Запросто могут отчислить из-за потерянных бумаг.
3) Сексизм, харассмент, взятки
На кафедре по-прежнему преподаёт мужчина, который пристаёт к студенткам. На него регулярно жалуются, но ситуация вообще никак не меняется. И все знают о существовании проблемы, но предпочитают над этим шутить.

Вообще это специфика кафедры. Вместо того, чтобы работать над собой, кафедра предпочитает посмеиваться над своей неидеальностью. Но честно говоря, это не ВУЗ - это забегаловка. 

ИСКРЕННЕ жалею о потраченном времени. Крайне не рекомендую поступать тем, кто действительно хочет учиться и стартовать в карьере. Здесь этого ну будет.",negative
