Text,Mark
"


Добрый день! Пишу этот отзыв больше для абитуриентов, тк многим сейчас предстоит выбор между ВУЗами, факультетами и тд. 
Начать стоит с поступления, сам я только закончил первый курс, поэтому воспоминания о процессе подачи документов свежи. Стоит отметить, что у вышки удобный сайт, и всё очень ясно, поэтому с организационными вопросами обычно проблем нет. Проходные баллы относительно высокие, около 280+, но если сравнивать с другими факультетами ВШЭ это не так много. Плюсом является, что есть &quot;Зелёная  волна&quot;, то есть в определённый период вам сообщат некий балл (в прошлом году было около 282), и если вы имеете результат выше, то вам гарантируют поступление, хороша эта система, что абитуриент может не думать о конкурсе. 
Стоит упомянуть общежития. Общежития выдают всем бюджетникам (кто не Москвич). Но заселить вас могут куда угодно, зависит лишь от везения, но везде будут очень комфортные условия. Стоимость +- 1000 руб/мес.
Теперь же о обучении. Главным плюсом считаю, что факультет достаточно маленький (40 человек на курс), следовательно студентам проще контактировать с преподавателями. Сами лектора и семинаристы чудесны, интересно проводят занятия очень доступным языком ...Показать полностью... (имхо, есть лишь 2 предмета, где лекции читаются скучно, но при этом семинары по этим дисциплинам проводят прекрасно). Плюсом также считаю наличие ассистентов по предметами, к которым также можно обращаться, если что-то непонятно. 
Если подходить ближе к химии, то основной идей факультета является научная деятельность студентов в институтах РАН, на первом курсе после некоторых практикумов по неорганической химии (где вас научат работать с посудой, весами и т.п.) вам предстоит выбрать лабораторию для написания курсовой работы, которую вам предстоит защищать в конце первого курса. Также необходимо будет выбрать лабораторию для научной работы (в конце первого курса просто сдаётся отчёт по проделанной работе в лабе). 
Если говорить о предметах, то все предметы преподаются на очень хорошем уровне, стоит отметить матанализ и английский. Видимо у химиков какая-та традиция рассказывать о матанализе, но что касается факхима, то преподаётся он здесь на том уровне, который нужен химикам, проще говоря, он больше прикладной чем теоретический, но теорию на лекциях дают весьма полно и понятно, сам преподаватель чудесный и приятный. Английский же в вышке весьма спорный, тк итоговый независимый экзамен, который предстоит студентам в конце года, достаточно сложный, что портит жизнь людям, которые приходят в ВУЗ с 0-ым уровнем английского (английский в вышке, имхо, не преподают на уровень этого экзамена, поэтому придётся прикладывать немало собственных усилий).
Для кого-то минусом может показаться модульная система обучения (сессия происходит каждый модуль, проще говоря, как четверть в школе) и система накопа (итоговая оценка учитывает не только за экзамен, но и элементы контроля, такие как домашки, контрольные, квизы и тд) . Лично для меня это больше плюс, тк это не даёт полностью забивать на предметы. 
Ну и подводя итог, настоятельно рекомендую поступать сюда, если вы видите себя химиком в будущем.  Сам факультет и преподавательский состав очень приятен. ",positive
"


Я обучаюсь на 1 курсе магистратуры ВШБ.
НИКОГДА НЕ ПОСТУПАЙТЕ В ЭТОТ ВУЗ. 
Проучившись здесь год, я понимаю, что этот год своей жизни я успешно выкинул в помойное ведро. 
Я не могу начать ни с каких плюсов, потому что таких просто нет.
1. Отвратительные преподаватели. В этом году у меня было 14 преподавателей, и только 2 из них сравнительно (!!!!) адекватные. Преподаватели не приходят на занятия, просто забывают о них, могут вести занятия из машины, одновременно ведя автомобиль, поручают вести занятия каким-то вообще левым людям, которые не знают, что с нами делать. Постоянно меняют требования к заданиям. В ВШЭ 10-бальная система оценивания (8-10-отлично, 7-6-хорошо, 4-5-удовлетворительно, ниже 4 - неуд.), но с 2021 года в ВШЭ введена инфляция оценок, это значит, что чтобы ты ни сделал, даже если идеально выполнишь проект, максимум ты получишь 8(это отлично), но выполнить идеально невозможно, потому что буквально после сдачи задания, преподаватель может поменять требования. Оценивание происходит рандомно, экзамены/тесты абсолютно не соответствуют пройденному материалу (если вообще такой был); более того, часть преподавателей просто не знают свой предмет - сегодня говорят одно, завт...Показать полностью...ра другое. Результатов ваших экзаменов вы можете ждать месяцами, чтобы узнать, что вы вообще его не сдали. Также преподаватели принижают студентов по различным признакам. 
2. Организация обучения. Ещё при поступлении начался цирк. Половине абитуриентов перепутали баллы, и пришлось выяснить с каждым отдельно, кто сколько получил, а это достаточно нервно (очень!!!), когда речь идёт о 400 тыс. рублей за обучение. В деканате (или учебном офисе) откровенно сидят дауны. Они не знают ничего. Предупреждают о выборе научного руководителя или какого-то дополнительного курса за пару часов, и вообще неважно, что ты не имеешь доступа к компьютеру и не можно сделать выбор. Общаются представители учебного офиса по-хамски; могут не отвечать несколько недель, и неважно насколько важный у студента вопрос. Руководителю направления откровенно все равно на все, что происходит. Наш руководитель сказал, что он в «кризисе» и ничего не может нам сказать. Сколько бы писем мы не писали, никто не следит за ответственным исполнением всех обязательств, которые по идее должен брать на себя вуз. Даже проекты, в которых участвуют представители различных компаний организованы ужасно. Вы можете думать, что будете делать проект с крутой компанией, а на деле, никто с вами не будет общаться, а вы нужны для рабского труда, чтобы предложить им полноценный проект на блюдечке, а они могут даже не явится его заслушать. 
3. Сам вуз. Не видитесь на все эти россказни о том, какой это замечательный вуз. Ничего в нем замечательно. Они сделали хороший бренд, не более того. Но поверьте, я сейчас вижу реальное количество недовольных студентов, и через пару лет, рейтинг этого вуза улетит на глубокое дно. Здесь вы не сможете нормально жить. Вы можете лишиться работы, друзей, любимых людей; вам придётся отказаться от любимых хобби, прогулок, встреч; каждый день с утра до поздней ночи вы будете сидеть и учиться, чтобы получить какие-то убогие 5-6 баллов. Но ладно бы здесь учили. Нет. Не учат. Вам придётся искать море материала самостоятельно и пошатался на свои ранее полученные знания. Учится здесь не имеет никакого смысла. Платить тем более. Вы потерять себя, свою жизни, и возможно даже тягу к изучении ваших любимых (как вы ранее думали) наук. 
Настоятельно прошу, каждого человека, кто рассматривает данный вуз для поступления одуматься. Не бегите за «брендами», потому что в них вы можете потерять самих себя.",negative
"


Корееведение в школе востоковедения (важное уточнение)
Ж. Г. и И. О. – две барышни с весьма странным подходом к людям.
Первая – по образованию не кореевед, она пищевик и историю России еще изучала (это, к счастью, гуглится и легко проверяется), но, к корееведению, как к профессиональной области имеет косвенное отношение. Но это еще полбеды: отношение к студентам – кошмарный ужас, повергающий в шок. ЖГ выбирает в группе студента, которого «сознательно гнобит до потери сознания». Как результат: отчисления студентов с первого курса ввиду давления ЖГ, общее подавленное состояние третьекурсников, часто обусловленное вынужденным общением с этим человеком. Студентам откровенно угрожают, что «может вести себя как хочет» и что «красная кнопка не работает, жалуйтесь сколько хотите». Отношение к преподавателям: приходит на пары к преподам и начинает говорить, что «на них жалуются студенты». После «аргументированного давления» и в случае того, если ты не покоришься – напишет на тебя кляузу руководству, подробно «распнув тебя за все грехи корееведческие и преподавательские». Под руководством ЖГ прошел целый год – направление пустеет так же быстро, как наполнялось на его заре под руководством др...Показать полностью...угого руководителя, которого она мастерски сместила. Обещает ставку, потом не дает и даже не разговаривает с тобой про это. 
Вторая барышня - ИО (читай ЕА) играет с ЖГ в одной команде, прикрывает ее и всячески пытается объяснить, что преподаватели направления преподают неправильно. Казалось бы, подковерные игры – это нормально, скажете вы. НО, КАК ЭТО СЕЙЧАС (ВОТ ПРЯМО СЕЙЧАС) СКАЗЫВАЕТСЯ НА КОРЕЕВЕДЕНИИ В ВЫШКЕ:
1.	КАЧЕСТВО ОБРАЗОВАНИЯ СТРЕМИТСЯ К НУЛЮ. Преподаватели со стажем и норм образованием из-за давления и плохих условий труда уходят, поэтому есть практика приглашать вчерашних бакалавров вышки, которые учились у самой ЖГ и ЕА. Качество их языка вызывает вопросы
2.	БАЗА ВШЭ, КОТОРАЯ ИМЕЕТ НОРМАЛЬНЫЙ ПОТЕНЦИАЛ ДЛЯ НАКОПЛЕННИЯ НАУЧНОЙ МОЧИ, МЕЛЬЧАЕТ ИЗ-ЗА НЕКАЧЕСТВЕННЫХ КОРЕЕВЕДЧЕСКИХ КАДРОВ
3.	МОРАЛЬНОЕ ДАВЛЕНИЕ НА СТУДЕНТОВ И ПРЕПОДАВАТЕЛЕЙ НЕДОПУСТИМО
4.	НЕВОЗМОЖНОСТЬ ПОДЕЙСТВОВАТЬ НА МОРАЛЬНОЕ ПОВЕДЕНИЕ ОТДЕЛЬНЫХ КАДРОВ ДЕСКРЕДИТИРУЕТ ПОЛИТИКУ ВШЭ О ВОЗМОЖНОСТИ СТУДЕНТОВ ОТСТАИВАТЬ СВОИ ПРАВА И ХОТЬ КАК-ТО СЕБЯ ЗАЩИЩАТЬ
5.	КРОМЕ ВСЕГО ПРОЧЕГО: СТУДЕНТАМ ОБЕЩАЮТ СТАЖИРОВКИ, А ИХ НЕТ. ИХ ПРОСТО НЕ ХОТЯТ ОТПРАВЛЯТЬ (ДЛЯ АКТИВНОГО ОТПРАВЛЕНИЯ СТУДЕНТОВ В КОРЕЮ НИЧЕГО НЕ ДЕЛАЕТСЯ)

Уважаемые будущие корееведы, будьте бдительны. Не впускайте токсичных людей в свое сердце и берегите свое здоровье, если столкнетесь с этими людьми. Они попортили много крови. Проверено.
",negative
"


Я обучаюсь на направлении &quot;Инфокоммуникационные технологии и системы связи&quot; 2 курс. 
В начале выделю плюсы и минуса университета, а затем и мнение о направлении.
Плюсы университета:
+ в середине 1 курса можно выбрать предмет по выбору &quot;майнор&quot; ;
+ если ты активный человек проводятся много мероприятий лекций и т.д внутри вуза и всякие кружки; (p.s но на них мало кто ходит)
+ с началом нового предмета понятно как тебя буду оценивать т.е знаешь заранее формулу оценивания;
+ можно записаться на факультативы, но в ограниченном количестве;
+ расписание экзаменов знаешь заранее;
+ нет физры;
+ хорошие общежития;
+ можно сдать независимый экзамен с конца 2-го курса до февраля 3-го курса;
Минусы университета
- независимый экзамен по английскому языку
- то что можно выбрать разного уровня английский ( академический, коммуникативный и т.д) я записала это в минусы потому что из-за этого английского получается фиговое расписание как на 1 курсе так и на 2-ом, могут быть большие окна между парами, одна пара в день, а в другой 5 и т.д;
- сложности с этого года в получении общежития.
Теперь о направлении: плюсов у этого направления нету, кроме того что у тебя будет диплом вышки ...Показать полностью...и плюсы университета которые описала выше. Не ведитесь информации которая написана на сайте. Особо важно: если вы хотите научиться здесь программированию или математике, то вам точно не сюда т.к программирование будет только на 1 курсе и то в ускоренном режиме. Вот это пафосное название &quot;алгоритмизация и программирование&quot; будет на языке ПАСКАЛЬ первые пол года на 1 курсе, а оставшиеся пол года дойдя только до основ ооп &quot;изучите&quot; питон, c и c++. Больше программирования у вас не будет. По остальным предметам на 1 курсе хочу сказать что это в основном математика разная и преподаются они весьма скомканно и плохо, кроме мат анализа т.к выжинженеры, а не математики. Не успеваешь вникнуть в тему, по мат анализу каждая пара новая тема, в общем если вы не будете ботать сами то ничего в принципе и не запомните, как в общем по всем предметам до 2 курса (дальше думаю пойдёт всё так же). Для качественной подготовки инженера крайне недостаточно пар и по многим предметам преподаватели дедушки которые не стараются преподнести информацию. 
Как факт : у вас будет мало пар и они будут разбросаны неравномерно как по дню так и по неделе (около 12 часов в неделю по факту) и кому как это: если вы хотите стать хорошим специалистом в области, то с таким количеством пар навряд ли, может хорошо это для того чтобы работать разве. Очень бесит что много времени уделяется самоподготовке в теории т.е на парах даётся какой то краткий минимум и остальное ты должен прочитать, нарешать, откопать и сделать сам.
2-ой курс: у вас будет много электроники и разной теории связи, вроде бы даже не плохо преподаётся, но самое главное зачем это всё и связь между предметами не говорят. 
По поводу выбора трека на 2-3 курс: сейчас как раз настало время выбора трека, нам дали 4 дня на это, на соп и то больше времени дают, никакое собрание с объяснением какой трек для чего нужен не планируется ибо : &quot;вам рассказывали это на 1 курсе&quot;, будем выбирать на абу.
По поводу проекта: на 2-ом курсе вместо курсовой нужно выбрать проект на котором нужно набрать 114 часов никого объяснения что это и зачем не было собрания. Просто выслали по почте о том что нужно выбрать и всё. У многих возникли проблемы с проектом, сомнительная штука особенно с такой подачей.
Так же крайне большое разочарование это практика на 2 курсе которая начинается в феврале: у нас она проходила в ифхэ ран им. Фрункина. Во- первых это химический институт, а мы электронщики и каким боком это связано не понятно. Во-вторых мы пришли туда в первый день один сотрудник ран что-то набубнел под нос непонятного чего-то, раздали темы для рефератов и отправили домой, в итоге выбирай тему которая нравится считай нагугли информацию сделай отчётик по госту и сдай, хотя конечно была возможность туда приезжать и задавать вопросы по темам, но не думаю что это сильно помогло бы ситуации. В итоге: никаких новых полученных знаний, чего-либо сделанного практического не было, лишь пол дня потраченного времени для написания отчёта. Но справедливости ради вторая половина группы делала батарейку, уж как повезёт. 
Заключение: самое главное поймите что здесь вы выйдете электронщиком-радиотехником (p.s посмотрите количество вакансий и среднюю зп, в итоге большинство либо в прогу либор в аналитики ж уйдут и зачем учиться здесь) и всё будет заточено под это, никакой инженерности и программирования не будет. Надеюсь этот отзыв поможет абитуриентам сделать правильный выбор.
 ",negative
