Text,Mark
"


Многие в отзывах очень обтекаемо обходят вопрос со сложностью. «да, сложно, но интересно!», «тяжело, но оно того стоит!», так вот я хочу сказать что вам при рассмотрении этого вуза следует понимать, что пишут такие отзывы в большинстве случаев люди, для которых баллы под 90 — это «довольно слабо». Все очень сильно зависит от факультета потому что некоторые — самые новые в основном — это предел мечтаний, лучшее для ребят реально и куча позитива несмотря на реально кучу работы на дом и по подготовке, а некоторые — это помойка с токсичным окружением и консервативными неуступчивыми преподами, с которыми сделать что-то почти невозможно. В частности Таким является МО.
немного конкретики для тех среднячков, которые как и я не совсем были уверены что хотят в жизни и поступают сюда. Внимание. ЕСЛИ ВЫ НЕ УВЕРЕНЫ, ЧТО ЭТО ВАШЕ НЕ ПОДАВАЙТЕ ДОКУМЕНТЫ СЮДА! Серьезно. Вам будут часто говорить, что «международник должен знать все», и под этим всем понимается не общий кругозор, а реально мелкие и к чертям никому не нужные факты.
На первом курсе вас подгрузят историей, и если вы не готовы сдавать сессию с возмодными вопросами из серии «какой рост у Вудро Вильсона?» или «Как Наполеон понимал семью» ...Показать полностью...или если вы не готовы различать на карте столицы двух крошечных островов рядом Бастер и Бас-Тер — НЕ ПОДАВАЙТЕ ДОКИ. Я не утрирую — это реальные вопросы к экзаменам. Также за счет большого набора на некоторых направлениях, например ФКМД огромное количество студентов, которые тупо не помещаются в аудитории.
На семинарах за счет системы накопа идет дикая грызня за ответ, так что вы либо перекрикиваете других и деретесь за первые парты, либо молчишь и в итоге пытаешься наскрести себе оценку за экзамен, которая все равно, даже если ты учил но не любишь отвечать, не может быть максимальной. Либеральность также распространяется глубоко не на все факультеты. На некоторых преподаватель и сам входит в управление факультетом. и сместить или заменить его или других является почти непосильной задачей).",negative
"


Сейчас учусь на четвертом курсе на программе МИЭФ, которая сейчас называется Международная программ по экономике и финансам, а раньше программа двух дипломов ВШЭ с Лондонским университетом. Все 4 года я реально учился, так что могу дать какую-то оценку. Пойду по порядку:
 
Программа  
Во-первых, выпускники действительно получают диплом ЛУ по выбранной специализации и это именно диплом! Много раз слышал от знакомых с других факультетов, что это не диплом, а какая-то бумажка. Не верьте! Это нормальный диплом бакалавра, ребята, с кем я общался из выпускников, поступали в зарубежные вузы и устраивались на работу в других странах. Что будет со следующими наборами не знаю, но все студенты, кто учиться сейчас получат второй диплом.
 
Обучение на английском.
Действительно это так. Лекции на английском, семинары на английском, домашки, проекты, диплом тоже все на английском. Да, такое бывает, что семинарист переходит на русский, но, в основном это происходят, когда студенты откровенно начинают тупить и им нужно что-то разжевать. Преподаватели есть иностранцы, есть русскоговорящие, но они очень достойно знают язык и это крутые специалисты. Большой плюс обучения на английском – работа с совре...Показать полностью...менной литературой, а не с переводными учебниками 90-х годов, как в некоторых вузах. Также легко затем в работе, много слышал от выпускников и однокурсников, кто работает в IB, что без языка там намного сложнее, поскольку так или иначе все привязано к мировым финансам.
 
Карьера и работа.
В этом плане МИЭФ – лучший (не побоюсь этого слова) факультет не только вышки, но и России. Начнем с того, что у нас свой карьерный центр. Руководит им В. П******. Ей огромное спасибо. Она как энциклопедия, знает какие этапы собеседования, какие кейсы и как вообще себя лучше “подать”. С трудоустройством проблем нет у тех, кто хочет работать. Диплом МИЭФа реально важный знак для компаний, зачастую позволяет пройти этап скрининга сразу. Кстати, МИЭФ уже второй или третий год возглавляем рейтинг Headhunter по зарплате выпускников (кому интересно можете загуглить). Многие работаю part time, в том числе и я, но делать это с первого курса не советую (сам наступил на эти грабли). Лучше учебу не запускать, иначе будет тяжко.
 
Процесс обучения и предметы.
Сам процесс организован неплохо, единственное бывают приколы с расписанием, когда есть семинар первой парой, потом 2 окна и еще несколько пар. Предметы интересные и информативные, в основном упор, конечно, на экономические и финансовые. На втором курсе мы взяли специализацию (всего их 5 или 6). От математики и до банковского дела и финансов. В зависимости от специализации дальше идет углубление в эту сферу, но экономика все равно будет. Кстати, про финансы. Так как преподают их тут, насколько мне известно, не преподают нигде. В том смысл в том, что это не просто один предмет, а именно курс от простого к сложному из нескольких предметов на все курсы. Поэтому программу так и назвали. Что касается администрации, сотрудники все адекватные, отвечают на письма, зачастую доброжелательные и пытаются помочь.
 
Факультативы.
Очень много факультативов. Я посещал испанский, преподаватель был классный и носитель языка, ходил в группу для начинающих, за полгода с нуля практически выучил до +/- разговорного уровня. Есть и программирование и трейдинг, куча языков опять же, на любой вкус.
 
Оценки, рейтинг и экзамены.
Оценки для рейтинга учитываются итоговые, которые состоят из домашек, экзаменов, контрольных и часто из посещаемости и активности на семинарах. Автоматов нет, что я считаю правильно, поскольку даже если посетить все занятия и сделать домашки, это не отражает знание предмета. Так что, не сдав нормально контрольные и экзамены, вряд ли получится закрыть предмет. Домашки в основном дают на неделю. Сессии 4, как и во всей вышке. Экзамены все сдаем письменно, с одной стороны круто – потому что все честно, с другой напишу в минусах. Списать практически нереально, в аудитории есть независимые наблюдающие. Рейтинг достаточно достоверный, отражает кто как учится (или не учится). За скидку в основном не грызутся, живем дружно так сказать, за редким исключением. Если говорить про отчисления, в моем понимании, для этого нужно постараться – все, кто хоть какие-то усилия прикладывал успешно закрывали год.
 
Минусы:
Порой очень интенсивно все, много экзаменов подряд, а еще накладываются дедлайны. С другой стороны, если нормально распланировать все, а не оставлять на последний момент будет не так уж и сложно. Еще нужно понимать, что для сэлф стади отведена существенная часть обучения, как в школе никто не будет за вами бегать и уговаривать сделать домашку, так что придется заниматься самостоятельно.
Экзамены все письменные и есть ощущение что разговорные навыки притупляются, это частично компенсируют презентации и групповые проекты. 
Аудитории (тут скорее в целом про кампус). Кампус новый и очень классный, но сиденья в лекционных аудиториях просто трэш. Также есть маленькие семинарские аудитории, в которых зимой холодно, а летом душно. Не знаю, что сделали с системой кондиционирования, но работает она ужасно. Мы много раз с ребятами об этом говорили, но решить эту проблему не смогли, хорошо, что нам хотя бы давали другие аудитории.
 ",positive
"


Мой отзыв относится к направлению клеточная и молекулярная биотехнология(с когнитивной нейробиологией многие дисциплины пересекаются, но когнитивка совсем свежая, так что там не все так отлажено). У меня от учёбы на 1 курсе пока сплошь положительные впечатления.
Выбирала данный вуз из-за учебного плана. Если сравнивать с МГУ, НГУ, МФТИ - меньше всего воды и больше всего часов на профильные дисциплины.  У меня уже были знакомые, которые там учились и отзывы были у всех положительные , так что я рискнула выбрать ВШЭ, несмотря на то, что естественнонаучные факультеты там весьма молодые.
Как и заявлено в анонсе программы - все преподаватели очень приличного уровня( на сайте информация соответствует действительности), приглашенные профильные специалисты - МГУ, РАН..
Большая часть практикумов проходит на базе лабораторий ИБХ РАН. Всё хорошо с оснащением, приборной базой, реактивами, раздаточным материалом. Группы разбиваются на подгруппы по многим предметам, поэтому нет такого, чтоб на ушах друг у друга висели, все работают. В первом семестре было - 4 часа практикумов в неделю, во втором семестре - 6.
Также как и на классическом биофаке много приходится рисовать .
Есть возможность набрат...Показать полностью...ь доп.курсов внутри вышки (математика, ИТ), или зачесть профильные курсы, пройденные на базе других вузов (или он-лайн) с аттестациями для тех, кому не хватает того, что предлагает стандартный учебный план. Загруженность сильная, но посильная, требования адекватные, четко прописанные и обозначаемые в самом начале изучения дисциплины. Но объемы не маленькие, студенты на факультете достаточно сильные, спрашивают достаточно строго и тщательно, так что поступая сюда надо быть готовым учиться много и интенсивно.

Факультет очень комфортный для обучения, дружелюбная атмосфера среди студентов, преподавателей и администрации. Необычно, что что администрация открыта к пожеланиям и просьбам студентов (например, по просьбам большого числа студентов летнюю практику распределили по второму семестру, чтобы освободить месяц). 
Ко многим дисциплинам преподаватели выкладывают презентации, теорию к пракам, видеозаписи - на факультете такая же высокая цифровизация, как и во всем вузе.",positive
"


Привет, на связи студент ОП Управление бизнесом (УБ) НИУ ВШЭ и я хочу рассказать вам про некоторые неприятные моменты, которые ощутимо портят идеальную картинку с главной страницы официального сайта, но заставляют взглянуть на ситуацию в ВУЗе более реалистично
1) Расписание
Распределение нагрузки на УБ в течение рабочей недели выглядит примерно следующим образом: в один день (как правило это понедельник или вторник) на повестке дня 2-3 очных лекции в кампусе, далее (опять же в понедельник или вторник) 2-3 дистанционные лекции, затем среда, день майноров, и четверг - в этот день у большинства студентов стоит факультативное занятие по английскому языку. Пятница и суббота как правило самые загруженные; чуть позже я объясню почему, а пока просто предлагаю принять как факт, что на каждый из этих дней приходится до 4 семинаров. Таким образом, в среднем в неделю у нас проходит в лучшем случае 12 пар, что соответствует 2м парам в день при равномерной нагрузке. Посчитаем в астрономических часах: 2 * 80 = 160. 160 / 45 = 3,(5) школьных урока - нагрузка примерно соответствует средней загруженности ученика 3-4 класса школы.
2) Самостоятельная работа
Вышка позиционируется как максимально практи...Показать полностью...коориентирова: наши часы, фактически проведенные за самостоятельной работой очень ощутимо превосходят аудиторные, однако здесь часто происходит смешение понятий. Тот факт, что вы выполняете работу самостоятельно или с минимальным информационным сопровождением не означает, что она носит прикладной характер. Будьте готовы к тому, что более чем в половине случаев вам не удастся разглядеть практической ценности в тех заданиях, которые вы будете выполнять.
3) Преподаватели
Преподаватели на УБ действительно очень разные - в каком-то смысле это лотерея, в которой вы можете выиграть или проиграть. Стоит обратить внимание на то, что большинство преподавателей педагогического образования не имеют: значительная часть лекторов и семинаристов - это практики, для которых преподавание основным родом деятельности не является. Вернемся к моменту про расписание - единственное время, в которое многие преподаватели-практики готовы работать со студентами, - это вечер пятницы и суббота, поэтому, опять же, будьте готовы к неравномерной нагрузке и недоступности преподавателя в будни.
4) Лекции
На УБ действительно низкая посещаемость лекций - как правило это списывается на безответственность студентов, но это не совсем верно. Дело в том, что для многих студентов посещение лекций не имеет никакого смысла. Преподаватели без педагогического образования часто оказываются не в состоянии преподнести материал таким образом, чтобы он был воспринят студентами. Лекторы и семинаристы довольно часто не демонстрируют уверенности в знании фундаментальных теоретических основ преподаваемых ими предметов из-за чего у студентов возникают сомнения в их компетентности и квалифицированности. Часто разобрать рекомендованную литературу и презентацию оказывается гораздо проще, чем понять мысли лекторов и семинаристов.
5) Приоритет формы над содержанием
В целом в Вышке форма действительно заметно превалирует над содержанием - здесь часто происходит подмена и смешение понятий, что приводит к дезинформированию студентов. Из основного: практикоориентированное обучение =/= свободное плавание, преподаватели практики =/= хорошие преподаватели, отличные оценки =/= реальные знания, большое количество возможностей =/= шанс воспользоваться хоть одной из них.
Подводя итог, скажу следующее: УБ это действительно неплохая программа для тех, кто ищет место, где учеба не будет мешать какому-то другому, более значимому роду занятий, но если вы рассчитываете получить реальные знания, скорее всего вас будет ждать крайне неприятный сюрприз. Я также не советую идти сюда идеалистам, которые хотят отстаивать свое право на качественное образование -  скорее всего вас просто задавят авторитетом.",negative
