Text,Mark
"


1. Навыки и знания приобрести невозможно, так как  студенты все время обучения  обеспокоены только , как сдать контрольные, проекты  и куча других заданий. При этом четкости в формулировке задания не будет. У преподавателя четкие указания- поставить, как можно ниже балл - приказ сверху- &quot;инфляция оценок&quot;
2. объяснения на лекциях нудные, очень сложным академическим сухим языком, поэтому посещение только для галочки не более
3. семинары- только, чтобы устроить проверку непоняно чего,но в основном показать, что студенты - тупые и опять же выставить балл пониже, но и от него в общую оценку пойдет -какие-нибудь 0,001 %. Поэому вы будете тратить 24/7, чтобы в итоге хоть как-то закрыть модули (которых 4 в году).
4. интерес к развитию, специальности полностью отбивается,т.к. если даже до этого вам нравилось читать, посещать конференции- здест начинает тошнить от любой информации новой
5. Каждый преподаватель начинает с того, что ему провели беседу, что высокуие баллы ставить нельзя- и чтобы вам поставили оценку 5 (по 5 бальной) вы должны удивить чем-то преподавателя
6. преподаватели могут без предупреждения не приходить на занятия и затем не извиняются, а студенты просто просидят в аудитории
7 Полностью весь материал сами студенты изучают, ищут на просторах интернета",negative
"


Расскажу про образовательную программу ВШБ &quot;Маркетинг и рыночная аналитика&quot;.
Я супер рада учиться на Маркетинге в Вышке, так как мне нравится процесс обучения и формат “теория+практика”. Особенно заслуживают внимание партнеры ВШБ, с которыми мы часто сотрудничаем во время наших учебных проектов и курсовых работ. У нас проводятся регулярные лекции совместно с приглашёнными экспертами из таких компаний как L’OREAL, Remy Cointerau, Effie Russia и многими другими. Это отличая возможность пообщаться с топом компании, задать любой вопрос и попасть на стажировку. Также есть возможность принять участие в большой студенческой жизни вышки, так как нагрузка по учебным дисциплинам дает возможность охватить также и студенческие организации :) 

Из минусов можно отметить проблемы с реализацией курсов. По задумке некоторые хорошие, но бывают трудности во взаимодействии с преподавателями. 

Однозначно рекомендую программу тем, кто не любит сухую теорию. На МиРА вы сможете точно использовать теорию на практике.",positive
"


Эх , проучился я уже 3.5 года в ВШЭ , на факультете МИЭМ , и получил массу &quot;позитивных эмоций&quot; от этого факультета.
Желание перевестись было сразу после зимней сессии , и это желание присутствует до сих пор , т.к. каждые пол года , если вы не на высоком месте в рейтинге , вас пытаются отчислить. 
Начнем с первого курса, да приветствие ,игры , знакомства , все было круто , нам говорили , что : &quot; Вы не пожалели , что выбрали данный факультет , так как - тут будет лучшая математика &quot; , после этой фразы , появилось сомнение насчет моего направления , т.к. вроде бы направление &quot;Компьютерная безопасность&quot; ,но про программирование ни слово. На первом курсе начали учить СИ , и довольно прогрессивно , но потом на втором курсе , все программирование закончилось и на летней сессии уже было просто 5 математик подряд. 
От этого стало реально не по себе , т.к. , на протяжении полутора лет наш вышмат состоял примерно из 10 разных предметов , и все то же продолжается на 3 курсе. 

Про отчисление студентов на данной специальности - это отдельный прикол , менеджер программы прямо на парах заявляет , что ,блин , вас как-то много , ваше количество нужно сократить до 60 че...Показать полностью...ловек , до начала 3 курса , в кратце нас было около 120 на 1 курсе , к 3 осталось реально 60.

В МИЭМе , если вы попытаетесь пойти против какого-то препода , вам быстро пообломают рога , тут как-будто какая наша российская стандартная политика , если препод друг другого , то вас начнут валить оба и т.д. 

Еще хотел бы рассказать про ИУП - это такая же покупка экзамена , как в других вузах , только дороже , и это большой развод , так как в следующем году вам опять надо будет сдавать этот экзамен в вашу новую сессию , но только преподы к иупщикам относятся как к г***ну , ну с вами даже разговаривать не хотят , всю информацию получаешь через силу , а на пары ты придти вряд ли сможешь , так как пары ИУПа очень часто накладываются с вашими парами , и Уч.Офис - это никак не фиксит . 

Но про учебный офис могу сказать только положительное , там работают приятные девушки , которые всегда помогут , расскажут , поддержат , иногда конечно , в трудоемкие дни , могут долго отвечать , но у старост есть специальные группы в Whats&#039;app , где отвечает максимально быстро.",negative
"


Я студентка ВШЭ, учусь на программе &quot;Востоковедение&quot; на 4м курсе (из 5ти). Мое направление - Япония, специализация - политика и экономика Японии, поэтому и примеров будет больше про Японию.
Вообще собираюсь ругать не сам ВУЗ, а только отдельную программу - Востоковедение. Дело в том, что дисциплина позиционируется как &quot;комплексная&quot; - студенты изучают и историю, и культуру, и литературу, и политику, и экономику, и языки (в непропорциональных объемах), и многое другое. Но, как вы понимаете, если вы учите всё - вы не учите ничего.
Итак, первый и очень серьезный минус - программа обо всём и ни о чем одновременно.
На программе существует разделение на специализации: Ближний Восток, Китай, Япония и Корея. Однако, на большинстве дисциплин (за исключением литературы и истории региона) сосредоточиться на своем регионе вам не дают. Более того, всегда ПОЛОВИНА дисциплины отводится на Ближний Восток. То есть на весь регион Восточной Азии (Китай, Япония, Корея) отводится только половина курса. И, естественно, больший упор всегда делается на Китай. То есть студенты корее- и японоведы возможности изучить свои регионы подробно не имеют. Иногда совсем (например, на предмете &quo...Показать полностью...t;Деловая культура Азии&quot; попался преподаватель - любитель Китая, и Кореи с Японией даже не коснулся). В общем, специализации на регионе как таковой нет (опять же, за исключением языка и истории).
Далее, есть специализация дисциплинарная. Студенты могут выбрать одно из направлений: политика и экономика или история и культура. Казалось бы, это поможет сузить круг задач. Но не тут-то было. Разница между направлениями - примерно 1 дисциплина в год (например &quot;политэк&quot; учит математику, &quot;исткульт&quot; учит древний японский). При этом политэку приходится изучать литературу вместе с исткультом. В итоге политэк мешает исткульту, потому что преподавателям приходится под ничего не знающий политэк подстравиться, а политэк мучается, потому что не имеет соответствующих знаний и интересов.
Конечно, можно сказать, что знать следует всё и побольше. Этим и оправдываются на факультете. Преподаватели постоянно тыкают студентов носом со словами &quot;хватит жаловаться&quot;, забывая, что у них-то специализация есть. Студенты бы и рады не жаловаться, но учитывая масштабы разнообразия на программе, она превращается в большую такую кашу из несвязанных предметов. Востоковеды серьезно к последнему курсу не знают, на кого учились. То ли на историков, то ли на международников, то ли на экономистов, то ли они в бизнес-среде должны крутиться... А может они лингвисты и переводчики, учитывая объем языковых пар.
Второй спорный момент - преподавание языка. Восточка очень гордится тем, что дает язык в больших объемах и студенты после выпуска очень хорошо им владеют (что-то я к 4-му курсе знаю только одного человека, который говорит на японском). Однако, мы все с вами знаем, что для овладения языком - им надо пользоваться и учить его ЭФФЕКТИВНО, а не МНОГО. Когда вам впихивают по 8 пар японского в неделю, часто один и тот же аспект (грамматика, в нашем случае) по 3 пары в один день - весь смысл теряется. Человек просто не в состоянии сидеть на одной и той же паре 3 раза подряд (включая преподавателя, который к середине года заметно &quot;сдувается&quot;). В общем, я бы не была так уверена, что языка - &quot;фишка&quot; программы.
Третий пункт - на странице программы очень красиво всё расписано про возможность стажировки в стране изучаемого региона. Очень многие соблазняются этой возможностью и идут на восточку ради поездки в Японию (или еще куда-то) на полгода. На днях открытых дверей абитуриентам красочно расписывают, что целый четвертый курс выделен под стажировки... Вот только на момент написания этого отзыва факультет уже пару лет как порвал ПОЧТИ ВСЕ контракты с японскими вузами (уж не знаю, что там с Кореей и Китаем). А убрать информацию о них с сайта почему-то забыл. В итоге студентам - японистам приходится грызться за всевозможные сторонние гранты. В этом году мне &quot;посчастливилось&quot;  выиграть один такой - вот только учиться пришлось онлайн, т. к. Япония к иностранцам относится очень предвзято и вот уже несколько лет не открывает границы из-за ковида даже для студентов. Это лирическое отступление, но в целом, думаю, суть ясна - со стажировками ВСЁ СЛОЖНО. (Кстати, еще золотые горы обещают ближневосточникам, мол всё это не правда, про то что туда сложно въехать, и про то, что девушкам туда попасть тоже не сложно... Ага, как же. Сидят и не надеются никуда ехать.)))))
Четвертый пункт - поскольку нет нормальной дисциплинарной специализации - нет и приличной научной деятельности. То есть для вас, как и для всех, будут проводить &quot;научно-исследовательский семинар&quot;, вот только на нем вам не смогут дать базу (потому что у востоковедения в принципе с методологией всё сложно). В итоге курсовые работы придется чаще всего высасывать из пальца. Заинтересованных преподавателей тоже маловато, они либо с международниками &quot;тусуются&quot;, либо еще где-то. Известные люди, которыми рекламируют специальность (декан факультета, научный руководитель и многие другие) ПАРЫ НЕ ВЕДУТ и в жизни программы УЧАСТИЯ ПРАКТИЧЕСКИ НЕ ПРИНИМАЮТ. Вообще не уверена, что декан про существование восточки помнит...
В общем, моя мысль заключается в следующем. Если у вас есть интерес к какой-то конкретной дисциплине (международные отношения, история, культурология и т. д.) - лучше идти на это конкретное направление. На тех же международных отношениях есть японское направление. Да и на любой программе всегда можно выбрать себе какую-то страну в качестве сферы интересов. За язык можно не волноваться - на профи ру вас ждут толпы выпускников восточки, готовых научить вас хоть китайскому, хоть японскому, хоть арабскому ( ну и далее по списку). Если нравится наука, история, археология, литература, словесность и прочее - есть для этого ИКВИА (институт классического Востока и античности). Туда, конечно, попасть сложнее, но можно. И смысл будет. 
Я на восточку шла в надежде попробовать &quot;разное&quot; и потом понять, что нравится. Но это, увы, так не работает. К 4-му курсу, наоборот, больше запуталась. Да и знакомиться с &quot;разным&quot; приходится путем беготни по проектам других программ.
Что касается самой Вышки - в целом рекомендую. Ну ооооочень разнообразная студенческая жизнь, прямо на любой вкус. И с карьерой, скорей всего, проблем не будет, так как вас прям бомбардируют карьерными мероприятиями во всяких больших компаниях (ну это в том случае, если со своей специальностью не пошло). Проблем тоже много, но всё познается в сравнении. Только факультет и образовательную программу выбирайте с умом!",medium
"


Начнём с самого начала, пожалуй. С поступления. Оно устроено достаточно просто, вся информация/копии документов прикрепляются в личном кабинете абитуриента, там же можно без проблем подать и отозвать согласие на поступление. Для тех, кто(как и я) поступает на место за счёт средств Вышки предусмотрено подписание договора, подобного тем, что заполняют платники. 

Поступил я на ФЭН, на направление &quot;Экономика и статистика&quot; в 2021 году, на данный момент проучился 3 полноценных месяца и какое-то мнение об университете успело сформироваться. Не отрицаю, что возможно в будущем(если не отчислюсь, да да) оно изменится к лучшему, но пока - что есть, то есть. Внимайте.

Основные предметы моего направления за первое полугодие - социология, статистика, экономическое мышление, мат анализ, линейная алгебра и как факультатив - английский. Английский в Вышке, как многие наверняка знают, никакой, поэтому про него я подробно говорить не буду. Социология в моем сердце(особенно семинарист М.Е.М*****), т.к. по моему мнению(и мнению почти всех моих одногруппников) является чуть ли не единственным  предметом, вызывающим положительные эмоции. Относительно линейной алгебры - сложно, но можно, главн...Показать полностью...ое, не запускать(может попасться некомпетентный семинарист(как мне(б***ь), что усложнит вам учебу) - это кстати относится не только к линалу.

Матанализ. Потянуть его самостоятельно ооочень сложно, программа очень насыщенная, задания в контрольных и экзамене просто ужасные, а времени на их выполнение очень мало. Лектор прекрасно разбираться в предмете, но его лекции обычные смертные понимают редко:)) Та же ситуация потом с семинарами. Именно поэтому огромное количество человек ходит на платные консультации.  Нормально ли, что в престижном вузе со стоимостью обучения в 500 и больше тысяч нормальная практика - ходить к левым людям на занятия вместо посещения лекций и семинаров? Т.к. это единственный способ усвоить необходимую для сдачи экзаменов информацию? Вот и думайте. Для меня - это #$#&amp;@%. Платники наверняка тоже в восторге.

Статистика. Новый предмет в этом году, не могу сказать, что преподаётся на высоком уровне, т.к. непонятна цель наших заданий. Но, в целом, вполне образовательно. Да. Пойдёт. Наверное. На лекции правда ходит 10 человека из 200 с потока, но это так.

Экмыш. Тесты в сократив на 7 минут ненавидят все. Сама дисциплина является введением в микру и макру. С решением задач, как правило, нужно разбираться самостоятельно, потому что нормально их никто не объясняет.

Ещё минусы: маркеры в аудиториях часто не пишут(это неважно? это важно.) 

Теперь о плюсах: здание на Покровке прекрасно, нет обязательной физры, встречаются(о, чудо) очень компетентные преподаватели, есть много разнопрофильных(бизнес, волонтерство, танцы, художка, языки) кружков, спортивных секций, есть кураторы/ассистенты-старшекурсники, помогающие в каких-то вопросах(не только учебных), сами студенты(ма хорошие), в большинстве своём мотивированные, интересные и умные, можно заниматься научной деятельностью. В принципе, наверное, всё.

PS: все ещё не откинулся, потому что К***** Э******* кидает анекдоты на почту. Пошёл дальше готовиться к сессии
",negative
