Text,Mark
"


Студент 4-го курса исследовательского потока ОП &quot;Экономика&quot; 

Прежде, чем начну говорить о плюсах и минусах, я хотел бы прояснить некоторые моменты, которые судя по количеству негативных отзывов становятся откровением для абитуриентов. Университет - это не школа, вам не будут тут разжевывать каждую строчку из учебника и не будут принуждать вас делать домашку, чтобы вы лучше усваивали материал. Задача лекций и семинаров, особенно по математическим дисциплинам - дать вам ту базу, с которой вы легко сможете понять все остальные аспекты или пункты темы. Точно так же и с задачами. Максимум, что вам предложат - это страницы из задачника и номера задач, которые вы если хотите можете делать, а можете не делать. Могу сказать лишь, что по статистике все те, кто стараются выполнять все пункты, предлагаемые преподавателями, в итоге оказываются на вершине рейтинга, а те, кто филонят полгода и получают неуд начинают строчить негативные комменты о том, как плохо преподавание в ВШЭ. 
Также хочу обратить внимание, что пишу я максимум про свой факультет и скорее даже про образовательную программу. Я не знаю, как обстоят дела в других местах.

Плюсы:
1) Действительно мощное экономическое об...Показать полностью...разование. Хоть по началу вам и будет казаться, что вы проходите очень базовые и простые вещи, которые наверняка проходят все, вы сильно удивитесь, когда поймете насколько ваши знания в этой теме будут глубже, чем у большинства выпускников других ВУЗов. Особенно это касается студентов исследовательского потока (ИП), если вам удалось поступить на ИП - учиться будет очень сложно, но по глубине познаний это точно окупится. 
2) По основным дисциплинам чаще всего преподаватели очень качественные, действительно разбираются в предмете и очень часто коммуникабельны. Что самое главное, чаще всего семинаристами становятся аспиранты, которые совсем недавно были такими же студентами, которые прекрасно понимают ваши проблемы, ваши шутки и очень эффективно могут проводить свои занятия. Есть и отдельные &quot;приколы&quot; с преподами, о них расскажу в минусах.
3) Международный статус вышки без сомнений одно из ее главных преимуществ. С самого начала обучения вы получаете крЕдиты европейского образца, которые признаются почти всеми ведущими Европейскими университетами. В вышке постоянно можно встретить иностранцев как на лекциях, так и просто гуляя по кампусу. Под иностранцами я имею в виду не наших товарищей с постсоветского пространства, а Европейцев, Африканцев, Американцев. Очень сильно в вышке развита система мобильности студентов. Половина студентов моей группы, включая меня, хотя бы на полгода ездили учиться в Европейский университет. Причем это происходит по соглашениям абсолютно бесплатно. Вам нужно лишь оплатить перелеты и жилье. (Многие оплачивают это выигранными стипендиями) Причем, для того, чтобы это реализовать совсем необязательно быть в топах рейтинга, даже средние студенты без особых трудностей выбивают себе такие поездки.
4) Прозрачная система получения оценок. По большинству дисциплин оценка формируется в процессе выполнения множества разных активностей (выступление на семинарах, домашки, рефераты, контрольные). Вы в любой момент можете посчитать свою накопленную оценку и почти никогда финальный балл не станет для вас сюрпризом. Сценарий, что вы не понравились какому-то преподу и он вас задушил на экзамене почти нереален, потому что по большинству предметов люди к экзамену подходят уже минимум с 4 из 10 (удов). Рассказы об обратном вы скорее всего услышите от человека, который в лучшем случае пришел на 2 пары за полгода, провалился на экзамене и нашел внешнюю причину своей неудачи.
5) Гибкость посещения занятий. За 7 семестров моего обучения не было ни одной дисциплины, где отмечалась бы посещаемость на лекциях (кроме тех случаев, где на лекциях проходили мини-тесты, такая дисциплина была только 1). Вы сами решаете посетить лекцию, пройти материал самостоятельно по высланным материалам или просто забить. Иногда такая же система на семинарах по мат. дисциплинам, там тоже присутствие не смотрят. Смотрят в основном на предметах типо истории экономики или социологии, но это в основном связано с тем, что активность на этих семинарах входит в оценку. Что здесь по-настоящему важно, что никогда, ни при каких обстоятельствах, факт вашего непосещения не может стать основанием для недопуска к экзамену или к другим штрафам. Посещать или нет сугубо ваше решение, которое не несет никаких административных издержек.
6) Свобода выбора дисциплин. Уже начиная со второго курса, вам начнут предлагать множество курсов по выбору, причем брать можно даже с других факультетов. Вам ничто не мешает взять программирование с ФКН, если захотите и там будут места. На 4-м курсе вообще все курсы вы выбираете сами из очень большого перечня, таким образом вы будете изучать только то, что интересно вам и то, что будет полезно в вашей будущей профессии.
7) Майноры. Очень классная вещь, дает вам по сути вторую мини-специальность. Но тут все зависит от майнора. Бывают очень крутые и интересные майноры, которые действительно интересно проходить. А бывают абсолютно глупые и бесполезные, тут надо смотреть отзывы каждого майнора. С отзывами вас точно ознакомит студ.совет или другие студ. организации до начала процедуры выбора.
8) Очень хороший учебный офис. Иногда бывают определенные напряги с ним, но в большинстве случаев отвечают очень оперативно, по делу, всегда помогают или отправляют к тому, кто поможет. За 3,5 года не было ни одной проблемы с ним.

Минусы:
1) Преподаватели, особенно по непрофильным дисциплинам. Иногда бросают людей, которым откровенно пофиг и на вас и на то, как вы пройдете материал. Для тех, кому неинтересно изучать предмет - это дар божий, так как скорее всего большинство уйдет с 8-ками, 9-ками и навсегда про этот предмет забудут, для тех же, кто действительно хотел разобраться - это трагедия. Для них по сути остается смотреть программу курса и изучать предложенные материалы. Отдельные примеры &quot;забавных&quot; преподов: На первом курсе, по микроэкономике нам бросили недавно закончившего американский вуз PHD. Вести лекции и объяснять материал публике он совершенно не умел, в КАЖДОЙ презентации было куча ошибок, которые мы по ходу лекции исправляли. Единственным плюсом в итоге стало его реальное понимание предмета, когда подходил к нему 1 на 1, все становилось сразу гораздо понятнее. Второй преподаватель был по МСФО. Ей было мега в каеф опаздывать на пары, объединять 4 семинарские группы в одну (семинар на 120 человек lol), чтобы проводить меньше пар и больше отдыхать, ну а про качество объяснения материала и говорить не стоит. Повезло, что в программе был учебник, по которому она преподавала, что позволяло проходить программу, особо не слушая ее.
2) Легендарные падения LMS не оставили равнодушным никого. Большинство процессов связанными с выбором майноров или курсов по выбору проходит через внутреннюю систему LMS. На моей памяти не было ни разу, чтобы это удалось провести с первого раза без миллиарда сбоев. Каждый раз эта процедура станет для вас адом, который вы будете еще долго помнить.
3) Не знал куда записать этот пункт, запишу сюда. Вышка, хоть и является государственным ВУЗом, собрала в себе весьма конкретную политическую тусовку. РЕБЯТА! Если Вам неприятна вся эта тема, если Вы не разделяете эти убеждения или хотите быть абсолютно вне политики, Вышка не ваш выбор. Я не хочу никого отговаривать на этой почве, но просто поступая, учтите, что это может стать для вас проблемой или источником постоянных разногласий с одногруппниками.
4) Местами слабая практическая подготовка. Вышка предлагает множество действительно прикладных курсов, которые пройдя, вы станете гораздо конкурентоспособнее на рынке труда, но если все ваше образование и развитие сконцентрировано исключительно в курсах вышки, при этом вы сами не пытаетесь изучать тему (например инвестирование), смотреть лекции, самостоятельно изучать какие-то прикладные штуки типо моделирования. Назвать вас готовым специалистом будет сложно. Учиться вам придется как на стажировках, на которые вы вероятно пойдете, так и самостоятельно, но весь нужный фундамент, чтобы этот процесс не стал для вас сущим адом, вышка в вас заложит.

Итог: вышка по праву может считаться одним из лучших экономических ВУЗов России. Я не могу отвечать за другие факультеты, но в массе своей, негативные отзывы про ФЭН, написаны студентами, которые просто не вывезли все тяготы обучения здесь. Если вы хотите, чтобы с вами обращались как с ребенком, разжевывали материал - вам не сюда. Если вы хотите получить конкурентное, втч в западной среде, образование, с которым у вас действительно много перспектив в будущем - вам сюда. Когда читаете другие отзывы, о том, что рейтинг вышки завышен и по факту этот университет мусор, вы всегда можете просто открыть любой МЕЖДУНАРОДНЫЙ рейтинг, например QS, где в области экономики, Вышка занимает 68 место в мире и первое в России и понять, насколько такая позиция предвзята и необоснованна.",positive
"


Всем привет) Закончил Прикладную Математику и Информатику (Московский кампус) в 2022 году. 

Корпус:
Наверное лучший корпус среди университетов Москвы. Большая библиотека с коворкингом, куча кафешек на любой вкус, студенческие комнаты с принтерами.

Учебный офис:
Мне понравилась работа учебного офиса. Достаточно активно отвечают на вопросы, если что всегда помогут. Уведомляют о всех важных организационных дедлайнах. Когда мой научный руководитель по ВКР забыл прислать рецензию, то учебный офис разрешил прислать ее за 10 минут до защиты, что спасло от пересдачи))

Преподаватели:
На первом-втором курсе ничего особенного в преподавателях не нашел. Но вот на 3-4 курсе многие преподаватели работают в различных кампаниях (Райффайзен, Яндекс, Тинькофф, Сбер и т.д.), дают прикладные знания, что очень большой плюс, и активно делятся опытом, готовы отвечать на различные вопросы не только на лекциях но и в телеграме. 

Курсы:
На первом-втором курсе достаточно много бесполезных предметов, но это зависит от целей студента. Лично мне совсем не сдались дискретная математика и АКОС. Но вот на третьем-четвертом курсе большинство предметов можно выбирать самому по своим интересам, что является больш...Показать полностью...им плюсом. Еще разрешают в качестве курсов по выбору брать предметы из ШАД.

Система оценивания:
Мне очень нравилась вышкинская система. Она позволяла не тревожится из-за экзамена т.к. обычно он весил меньше 40%. И можно было спокойно тренировать знания на домашках, набрать более 4 балов за счет накопа и даже не сдавать экзамен. 

Руководитель:
Отдельный респект Е. А., академическому руководителю. Активно идет на контакт со студентами, делает все чтобы им было комфортно. Готов просто покекать в чате.

Учет посещения:
На мой взгляд самый огромный плюс это то что вообще никак не учитывается посещаемость, что позволяет выбрать наиболее удобную тактику обучения и не ходить на скучные/неинтересные предметы. После вышки решил попробовать пойти в магу в финансовый университет и для меня огромный шок, что они учитывают посещаемость. Как будто за маленькими детьми следят (клоунада какая-то).

Минусы есть, но они достаточно стандартные в виде душноты некоторых преподов или плохой структуры курсов, но справедливости ради от плохих курсов стараются избавляться или переделывать их программу.",positive
"


Не могу быть удовлетворен обучением в этом вузе по специальности &quot;Реклама&quot;. Хотя в принципе нормально работаю в данной сфере, но есть ощущение того, что уровень образования в НИУ ВШЭ по данной специальности не соответствует требованиям рынка. Мне реально обидно, что я потратил кучу времени на этот вуз. Главная проблема в том, что читая справку Яндекса и Гугла, изучая бесплатные материалы той же Еламы  вы получите больше знаний о маркетинге, чем в НИУ ВШЭ. Также учеба в НИУ ВШЭ не предполагает появления стоящего портфолио. Окончив НИУ ВШЭ, я даже не умел пользоваться Яндекс Метрикой, не знал про сквозную аналитику, екоммерс, не имел навыков работы в фотошопе, у меня не было никаких курсов по html и css, я вообще ничего не знал про триггеры в интернет-маркетинге, про mailchimp, про эффективную работу с гугл таблицами, про работу с коннекторами и прочее. А почему этого не знал?  Потому что меня никто этому не учил. То есть конкретным вещам, которые приносят доход, вас никто не будет обучать. Да, курсы могут вести руководители и менеджеры агентств, которые зачастую занимаются только управлением процессами. Про клиентскую сторону и про сторону ИП, вы в принципе тоже ничего, скорее всего, не узнаете.  

Имхо, основа для нормального существования - это уровень оплаты твоего труда. Так вот учеба в НИУ ВШЭ на специальности &quot;Реклама&quot; не позволит вам претендовать на хороший уровень зп. Все знания нужно будет получать самостоятельно в процессе работы. ",negative
"


Я учусь на факультете дизайна в ВШЭ. Никому не рекомендую выбирать этот вуз в качестве основного и даже запасного!
С первого взгляда людям кажется, что этот университет действительно стоящий в плане образования и контактов с людьми. Мне не доводилось сталкиваться с более лицемерной организацией. Когда я посещал курсы, со мной общались вежливо и почти всегда помогали, когда требовалась помощь или возникал вопрос.
Сейчас мне довелось поступить в этот университет, и я столкнулся с абсолютно другим отношением.
Преподаватели не объясняют, какой должна быть работа, забывают объяснить самые основные детали материала. Они требуют хороших результатов, но не объясняют, что нужно сделать, чтобы достичь такого результата.
На вопросы отвечать никто из преподавателей не готов. Даже если ответ на вопрос помог бы студенту осознать свои ошибки и 
понять, как сделать качество работ более высоким.
 За учениками не следят, они могут преспокойно начинать травлю других учеников, никто им и слова не скажет. Общаются все друг с другом без уважения. Преподаватели говорят грубости ученикам, а ученики говорят грубости друг другу. В такой среде вас могут избить, оскорбить и унизить. Никто не будет пытаться вам помочь в учёбе и при возникновении конфликтов.",negative
