Text,Mark
"


Закончила иняз несколько лет назад. Считаю, что безусловные плюсы - дисциплина, полученные навыки самоорганизации и самомотивации, стрессоустойчивость и целеустремлённость. Языки преподают хорошо, есть устаревшая лексика, но никто не запрещает слушать подкасты, Ютуб, общаться онлайн на английском или другом языке, было бы желание. 
Что всегда приятно было в нашем ВУЗе, так это то, что с лодырями быстро прощались. Придти заговорить зубы про всякие обстоятельства, работу параллельно с учёбой, постоянные болезни, плохое настроение, ворк-лайф бэлэнс и прочее - по крайней мере, долго никогда не прокатывало. Тот, кто продолжал учиться, видел, что находится в команде сильных мотивированных студентов, действительно элиты, а не среди неграмотных бездельников, которые не умеют даже на родном языке изъясняться. 
Сейчас, бывает, по работе встречаю разных хитрованов, которые привыкли врать не краснея, изворачиваться, забалтывать, лишь бы работу не выполнять и на кого-нибудь её сбросить... и приятно становится вспоминать, что пока училась, с такими не встречалась вообще, они в нашем ВУЗе ни минуты не задерживались.",positive
"


Мы, студенты, называем наш универ МГЛой. Мгла и есть.
Сейчас я учусь на третьем курсе переводческого факультета на специалитете. Сразу скажу, что писать о качестве преподавания языков я не буду: во-первых, все зависит от преподавателя, а, во-вторых, от языка и ваших ожиданий. Лучше я расскажу об отношении руководства к студентам.
Если на работе ваш начальник вас унижает, мешает вам спокойно работать или делает другие неприятные вещи, что вы сделаете? Скорее всего, уволитесь (если работа не приносит желаемого дохода). Что делать студенту, который страдает, правда страдает, от отношения руководства? Никакая учеба не в радость, если тебя втаптывают в землю. Уйти с университета? Попробуйте) Уйти по собственному вам будет очень сложно, но если вы будете создавать проблемы, вам пригрозят отчислением. Звучит невероятно, если задуматься. Хочешь уйти, не уйдешь, а будешь неугоден, припугнут. И родителям позвонят! 
Стресс в период сессии ничто по сравнению с посещением деканата.
Теперь о военке, она же военно-учебный центр. Девочки, подумайте 100 раз перед тем, как писать заявление. Мальчики, у вас с этим спокойнее, но и вы подумайте.
Плюсы военки:
- звание лейтенанта запаса (если вы на спец...Показать полностью...иалитете)
Минусы:
- служить вы все равно будете, но уже со званием
- приезжать нужно к 8:20, у вуц свое расписание, так что будьте готовы рано вставать
- расписание у вуц совсем свое. И никак со своими одногруппниками в «гражданском» вы не увидитесь в этот день
- военные, которые орут на студентов, как в казармах
- невозможно уйти с военки, потому что недобор у них, а страдаешь ты
- форма стоит 11-15к 
- жить в военный день строго по уставу. И не важно, что сами преподаватели вуц уставов не придерживаются.
Удачи при выборе вуза!",negative
"


Всем привет! Я выпускница этого вуза, закончила в 2015 году. Абитуриенты, не поступайте в этот вуз, даже не думайте об этом. Лет 30-60 назад это был крутой университет с мощной подготовкой, сейчас это мыльный пузырь. С каждым годом становится все хуже.  Понты, понты и еще раз понты. Учеба в МГЛУ не стоит того количества нервов, которые вы тут потратите. Ничего тут нет интересного, никакой студенческой жизни, стажировки - мимо. Нам сказали сразу, что в Германию на семестр поедут только начинающие, т.к. надо показать, как хорошо вуз готовит с нуля. 
Все то что пишут про аварийные здания, плохое и дорогое питание, скотское отношение к студентам и преподавателям, отвратительное расписание, поверхностные знания - все правда. Хамское, наплевательское отношение везде: от преподов, в столовке, в раздевалках. Свободомыслие и креативность не поощряются, а наоборот осуждаются. Если пытаешься отстаивать себя и свои права, угрожают отчислением.  Это не вуз, а машина времени. Поступая сюда переносишься в совок в его худших проявлениях.  После выпуска (если доживете) очень сложно найти работу - надо идти переучиваться, получать доп.профессию. В современном мире нормально получать доп.образование,...Показать полностью... но тогда какой смысл учиться в этом вузе, если потом все равно переучиваться. Языки на том уровне, что здесь преподают, не подходят доя работы, а подходят для анализа текстов. Методика преподавания, которой тут обучают, устарела лет 20 назад. Мрак.  С теми знаниями, что получите здесь, на перспективную работу не устроиться. Программа безбожно устарела еще когда мы учились, а сейчас бедные бакалавры страдают еще сильнее. Но зато есть физра! И философия! Стыд и позор людям, развалившим этот вуз. Очень обидно и горько, что некогда легендарный университет превратили в помойку. ",negative
"


Ребята!Берегитесь, этот Вуз высосет из вас всё!!!!! 
Я студентка 2ого курса ФНЯ, немецкий язык. На часы не жалуюсь, хотя да, учимся с 13 до 17:20/18:00. Что самое ужасное: преподы и их отношение. Я могу Вам по именам перечислить этих дамочек. Х******* А.И., которая будет оскорблять вас, и говорить, что ей &quot;плевать на вас&quot;, что &quot;вы смотрите не так, не смотрите на меня вообще&quot;. Она мне сказала, что я позорю мглушниц тем, что у меня маленькие синяки под глазами, сказала мне, что видела меня с парнем на Остоженке, а Я не ходила с парнем по Остоженке, отругала меня за это. Сказала, что у меня должен быть только немецкий и никакой личной жизни. Отругала и унизила девушку при всех за то, что она дотронулась до ее сумки. На любое замечание она будет повышать голос, потому что ты никто, а она БОГ, и если бы здесь была не она, тебя бы уже выгнали сто раз. Терпила, фу. Б******* Н.Р. и Ю.Р. сестрички. Это ещё те красотки по 27/29 лет. Выпускницы этого вуза. Просто, если хотите узнать какими вы будете через 10 лет, посмотрите на них. Если спросить у них не по учебнику, они будут гуглить по пол часа. И в итоге &quot;обсудим на другой паре&quot;. Самое страшное, что они оценив...Показать полностью...ают не твои знания, а твою посещаемость. А если ты не дай бог заболел или у тебя жёсткие проблемы, всем плевать. Они напишут докладную и даже не скажут тебе. Человеческое отношение - не, не слышали. Конечно же деканат не встанет на вашу защиту. Они скажут: преподаватели у нас хорошие, они специалисты. Мммм, зам декану моему 24, младше моего молодого человека. Она ещё магу не закончила, а уже преподает. Она не имеет права в вузе преподавать, так как магу она не закончила. Но преподаёт))). Класс. Знать языки????? Нет. Не мечтайте. На первом курсе - да, все было супер. Интересно, необычно. На втором: зубрежка. А вы знаете что такое пересказ текста: это выучить текст наизусть и не дай бог ты пропустишь хоть одно междометие. Кстати, ещё забыла про Х******. Она сильно бьёт по столу. Многие становятся заиками. И я не шучу. Недавно был скандал с мальчиком инвалидом в МГЛУ, посмотрите на Ютубе. Многое узнаете. 
Инфраструктура. Отстой. Туалеты воняют, столовка воняет, общага воняет. Говорящие названия: корпус в Ростокино - Жестокино(физра с лосями), Бабаевская - Бабайка(парты в 201 такие, что ты не разогнешься,стулья прикреплены к полу и расстояние от тебя до парты 30 см), Остоженка - остога(основной концлагерь), Комсомольская - комса. Там столовки нет, кстати.
Ещё преподы: К******** В.Н. Ну чтож, я хотела курсач у него писать, да не судьба. Он не отвечает никогда. Не снизашел до нас, смертных. Он поставил автомат девушке, которая написала одну презу, а тех, кто зубрил и написал рефераты, он послал нахер. А ещё он забывает свои обещания и быстро меняет мнение. 
Ребят, моя ошибка была в том, что я не посмотрела отзывы. Я бы лучше пошла на платку в МГУ, но не сюда. Не идите сюда. Если вы творческий человек, тем более. Вас никто не похвалит за креативность, вас отругают за то, что вы отошли от системы, потому что вы тупые и они знают лучше. Вы - оригинальность. Я это знаю и держу в голове, из меня эту &quot;дурь&quot; пытаются выбить. Я не поддаюсь. И за это могут отчислить. Не лижешь жопу - твоя проблема. ",negative
"


Если вы хотите поступать на не лингвистическое направление в данный вуз, подумайте трижды. Про то, что пары иностранных языков занимают почти все время, уже писали. И это правда. При обучении на направлении &quot;Психология&quot; вы получите: 3 пары английского, 3 пары немецкого и по одной паре профильных предметов. Помимо этого, еще и 4 пары ППК в неделю, который, в общем, не является обязательным, и наш поток сильно не заставляли покупать его, но благодаря ему можно получше понять второй язык, особенно, если вообще не был с ним знаком. Но вот ППК по английскому считаю абсолютно бесполезным в профессиональном плане. 
Про корпуса ничего писать не буду - на вкус и цвет все фломастеры разные, хотя Бабайка действительно заслуживает упоминания. В 2019 году студенты запустили флешмоб, в котором фотографировали аудитории в неприятно известном корпусе: многие кабинеты настолько маленькие, что находиться там даже группой из 10 человек очень сложно, на стенах обои облезают, а дырки закрывают газетами. 
Вообще, состояние корпусов - не самая большая проблема в вузе.  Будьте готовы к тому, что преподаватель на экзамене может вас просто не слушать, даже если ты сказал все, что только можно было...Показать полностью... по билету и даже поинтересовался, нужно ли добавить информацию, он может просто поставить 3, потому что его не удовлетворил ваш вид или лицо. Хотя преподаватели профильных предметов намного более приятные люди. 
Некоторые из преподавателей абсолютно безграмотные. Казалось бы, взрослые люди, но понять, что они пишут не представляется возможным. И это в лингвистическом вузе, который претендует на звание лучшего! Позор. 
В заключение скажу, что поступать сюда на профили, никак не связанные с языками, точно не стоит. Но насчет лингвистических профилей такого сказать не могу. Все друзья, поступившие на перевод или на лингвистику, довольны. ",negative
"


Я окончил(а) вуз (специалитет) с красным дипломом больше 5 лет назад и крайне не рекомендую поступать сюда.

Вы выйдете с абсолютно поверхностными знаниями каких бы то ни было дисциплин и будете хорошо знать 1-2 языка. Качественно преподаются только они.

Что вас ждёт дальше: вы будете искать работу, где нужен язык, на который вы потратили лучшие годы своей жизни. И это, скорее всего не английский, а второй язык, который позволит сузить конкурентное поле. В итоге кем вы сможете работать: личным ассистентом (то есть личный раб 24 часа), письменным переводчиком (крайне неблагодарно оплачиваемый труд в России), реже устным (но будете в постоянном поиске работы), менеджером по развитию (продавцом), секретарём, специалистом службы поддержки, а также преподавателем (то есть будете просто передатчиком этого сакрального знания; учились, чтобы учить других, а сами никогда эти знания в жизни и не применяли).

Мой совет: поступайте в вузы, где есть свободное посещение любых пар, где вы можете понять, какое вам направление по душе, где вы сможете получить качественное образование от практиков,получить специальность.

А язык, в случае необходимости, только ленивый не выучит. Вы удивитесь, но для студентов технических и научных специальностей существует гораздо больше бесплатных лингвистических стажировок в Европе, чем для лингвистов.

Всем удачи",negative
"


1. Расположение корпусов 
Всего 4 корпуса: 3 на «Парке Культуры», 1 на «Сокольниках» и 1 в «Ростокино». Все, кроме ростокино, находятся в 5-10 минутах ходьбы от метро. Поэтому за расположение учебных корпусов 7/10 

2. Ремонт в корпусах 
Очень много страшных отзывов, которые говорят о том, что у нас чуть ли не аварийно состояние. По факту же, отвратительное состояние только у корпуса на Бабаевской (Сокольники). В остальных же - мало-мальски проводится ремонт и поддерживается в адекватном состоянии то, что уже отремонтировано. 

3. Качество преподавания иностранных языков 
Для начала, стоит понимать, что язык вам может достаться ЛЮБОЙ. Но! Можно попробовать поменяться с однокурсниками, если будут желающие. Так как на моей кафедре изучаются европейские языки, речь пойдет о них. Язык преподаётся замечательно. У нас преподавание идёт по электронным учебникам, составленным в стране изучаемого языка. Ещё есть такая вещь, как ППК. Это дополнительные, ПЛАТНЫЕ часы языков (английский + 2 язык). В семестр ~30’000 рублей. Как по мне, очень полезная вещь (по крайне мере при изучении нового языка), поскольку очень расширяет словарный запас. 

4. Качество обучения в целом 
Именно на моей кафедре...Показать полностью... - все прекрасно. Не смотря на то, что вуз гуманитарный, даже математика преподаётся достойно. На моей кафедре с качеством образования все просто замечательно. Видно, что преподаватели - заинтересованы в нашем успехе в будущем и всеми силами пытаются нам помочь. Стоит также заметить, что у нас минимум «бесполезных» для профессии предметов (очень хорошо составленная программа, даже на 1 курсе не было этой лишней нагрузки в виде ненужных предметов) 
 
5. Питание 
Во всех корпусах есть столовая/кафетерий и автоматы с кофе и закусками. В целом, питание самое обычное и «столовское». Средний чек - 200-300 рублей за полноценный обед. А ещё у нас есть суши) 

6. Физкультура 
Она у нас есть, причём 2 пары в неделю. Работает система баллов, поэтому когда она закачивается - зависит от того, когда человек наберёт необходимое количество баллов. Сейчас вероятно будут изменения, связанные конкретно с физкультурой (по крайне мере, об этом говорит ректор), поэтому, возможно, ситуация поменяется 

7. Студенческая жизнь 
ОНА ЕСТЬ! Просто не такая богатая. У нас есть ежегодный конкурс талантов, работает «Парламентский клуб», сейчас запускают StandUp. Есть экологические объединения (проводятся различные акции. Например, в начале года собирали макулатуру), волонтерское движение. Очень, очень часто проводятся различные встречи. У кафедры «Социология», на сколько знаю, есть даже свой «день социолога» и организовывается празднество. Делают различные фотовыставки, был квест на Хэллоуин. Поэтому, если есть желание - есть и студенческая жизнь) 

8. Стажировки 
Они тоже есть, причём список университетов внушительный. Чем реже изучаемый язык - тем больше шанс отправиться на стажировку 

Как итог: да, есть проблемы с ремонтом (да и то, только на Бабаевской), возможно, есть какие-то вопросы и к преподавателям (я с таким не сталкивалась), но так или иначе - ВУЗ достойный. ",positive
