Text,Mark
"


Очень бы хотелось оставить свой отзыв об Институте международного права и правосудия МГЛУ. Проучился здесь 5 лет, поступить сюда не так уж и трудно. Куда сложнее здесь учиться. Достаточно интенсивный график обучения, занятий очень много (особенно занятий по английскому и немецкому языку). Но самый сложный язык, который изучался одной из групп на нашем потоке, - это, конечно, китайский.
Если вы будете готовиться к языкам постоянно - вам реально подтянуть грамматику и юридическую лексику. После 4 курса многие с нашего курса ездили на стажировку в Университеты Германии, Испании и Китая. В общем языковая подготовка для юристов здесь на хорошем уровне, но надо учить и еще раз учить!
Касательно юридических дисциплин хочу сказать, что преподаватели здесь очень грамотные. До сих пор вспоминаю зав. кафедрой Ш**** Н.А. Также очень сильный состав уголовной кафедры, где огромные слова благодарности А**** В.И., К**** С.Ю. Лично я здесь очень многое узнал из сферы борьбы с преступностью и судебно-следственной работы. На практике был и в суде, и у адвоката.
Также обучался на военной кафедре, так что по окончании обучения пришел на работу в отдел Следственного комитета - взяли без проблем. Планирую здесь работать и дальше.
Все, кто планирует сделать карьеру в правоохранительных органах и кто желает выучить как минимум один иностранный язык с юридической лексикой, съездить на языковую стажировку в другую страну, советую поступать МГЛУ на Юриспруденцию.
Деньги деньгами, но оно того стоит!!!",positive
"


2/10. Не поступайте, оно того не стоит. Ни один мой одногруппник не скажет, что доволен образованием, полученным в этой шараге.
Я закончила факультет английского языка (2021 год выпуска), кафедра Теоретической и прикладной лингвистики. Так что речь пойдет именно про факультет английского и болото ТиПЛа. Если ничего не путаю, теперь это направление платное. Смешно, что за это еще и деньги берут.
Кратко о хорошем: можно особо ничего не делать, чисто импровизировать на паре. Для кого-то это является плюсом.

Теперь о более насущном:
I. Про хамское отношение руководства к студентам пишут здесь все совершенно справедливо. Диалог построить невозможно, вопросы решаются с громким скрипом, а студенты никак не защищены. И так на всех уровнях.
Кафедра ТиПЛа — просто академический мрак с руководителем-самодуром. Преподы типла двух типов: странные и стремные. Преподают ненужную дичь, о чем сами прекрасно понимают, поэтому, верно, спрашивают не так уж строго, как могли бы. Наукой заниматься никто не даст. Ярких, светлых студентов гасили, если те хотели организовать хоть какие-то научные(!) движухи типа кружков или факультативов. Смышленые ребята сразу поняли все про ТиПЛ и направили свои силы на...Показать полностью... саморазвитие или взяли дополнительные занятия, которые им нужны (кто-то матан, кто-то языкознание, а кому-то понадобилось программирование, хотя все эти дисциплины преподаются).
II. О преподах языка. Платят им, что называется, нихе*а за дохе*а (высокая нагрузка). Пре Многие ушли или уходят. Чтобы выучить язык, никакой вуз не нужен. Можно записаться на курсы или изучать язык самостоятельно. А знание всяких грамматических особенностей пригодится лишь будущим ученым, языковедам, прикладным, прости гос-ди, лингвистам. А с наукой здесь не очень, увы. У мглы нет реальных связей с другими вузами, научные конференции здесь — фарс, напускное, публикации в местном Вестнике не представляют никакой научной ценности.
III. Общага. Место получить крайне трудно. Дают в 1 очередь льготникам (инвалиды, сироты, чернобыльцы, см. Положение об общежитии). Кому-то дали на 3-4 курсе. Общагу надо давать первакам! Народ приезжает в другой город, осваиваться непросто, начинается учеба, а приходится еще и тянуть съем квартиры. В самом общежитии бардак: половина мест просто пустуют, студенты там не живут, просто держут это место за собой, иногда приходя переночевать. Есть пустые (!!!) комнаты, размещение в которых производится за отдельную посуточную плату. Администрация общаги называет это гостинными комнатами для родителей студентов. Столько желающих, ждущих место в общежитии, а есть ПУСТЫЕ комнаты, где никто не живет! Тараканы позволяют себе всё, живут хорошо, фривольно разгуливают по спящим студентам. Е*учая травля е*учих тварей стабильно раз в месяц, всех выгоняют около 10-00. Душевые в подвале, кстати. В 2019-2021 гг. плата была 36-38 руб/день, плата повышалась каждый год. В месяц, соответственно, около 1147 руб. 
IV. Языки. Никто выбора не даст. Переводят из группы в группу, но, как и все в этом месте, нехотя.
V. Стажировки. Нет и не будет. Все мои знакомые, которые ездили куда-то за границу, платили за все сами, добивались разрешения на отъезд. Вуз только препятствовал, студентам угрожали отчислением или неуспеваемостью на следующей сессии. Эти ребята были с переводческого (3 чела), имоиспн (3 чела) и двое с фая (в Китай).
VI. Смены. Нормальная учеба с 8-00 только для элиты aka переводчиков (имоиспн тож с 1, например). Инст. ин яз, где ФФЯ, ФАЯ, ФНЯ, учился со 2 смены с 11-00 или 13-00 и сидишь-пердишь до 17-18-19 часов. В итоге на подработку устроиться нереально, вот и батрачили все кто на фрилансе, кто репетом, возвращаешься домой около 22.
VII. Корпуса и аудитории. Полный сюр с номерами аудиторий. Неужели так сложно сделать нормальную нумерацию? Почему каб. 138 хе* пойми где, почему ауд. 78 в подвале? Почему в корпусах зимой можно умереть от холода? Почему нет норм вайфая, который нормально работал бы везде? Аудитории микроскопические, мебель советская, дышать нечем, вечная борьба тех, кому холодно с теми, кому вечно жарко. Ростокино — самый новый, приятный корпус, до которого можно добираться целую вечность, даже если живешь в самой Москве. Остоженка 38 — холодный, старый корпус, где вечный холод даже в самую теплую погоду. Остоженка 36 — норм корпус во всех смыслах. Бабайка — старый и страшный корпус, похожий на больницу. В этом же корпусе одна из общаг, занимающая верхние 4 и 5 этажи. Комсомольский пр., 6 — более менее приличный учебный корпус и общага для иностранцев.

Что администрации следует сделать:
— разобраться с нумерацией кабинетов
— обеспечить ХОРОШЕЕ отопление зимой
— студентам, преподавателям и посетителям нужны нормальные туалеты, дырка в полу федерального вуза на Парке культуры — смешно
— куллеры на всех этажах
— электронные пропуски
— вайфай
— если уж физру никак нельзя исключить из жизни несчастных полудохлых студентов, создать больше кружков по физре (помимо волейбола и настольного тенниса) и сделать возможным получение баллов за посещение этих кружков
— верните автоматы с едой, что случилось
— наладить коммуникацию со студентами. сегодня оповещение больших масс людей элементарно по элпочте, это не сложно устроить

Вышка не обязательная ступень образования. Никто не заставляет идти на вышку (родители не в счет :)). Все можно изучать самостоятельно (экстрим, да, но это возможно). Так что вуз нужен для связей. Во мгле есть преподы, которые работают в индустрии (переводческая, юридическая, преподавательская), но их мало, на стажировку в компанию попасть через них — ну такое.. ",negative
"


Здравствуйте все жаждущие услышать отзыв об Институте международного права и правосудия МГЛУ.
Буду краткой. В Университете есть военная кафедра, поэтому вопреки расхожему мнению парней достаточно.
Уровень подготовки абитуриентов разный, но большинство ребят с высокими баллами ЕГЭ и учиться там достаточно непросто.
Большинство преподавателей очень требовательные, и просто так зачет вам не получить ни при каких обстоятельствах. Уровень преподавания достаточно высокий. Много практиков - судей, адвокатов, сотрудников правоохранительных органов. Дипломатическое право преподает действующий сотрудник МИД РФ.
Отдельно - несколько слов о языковой подготовке. Вы обязательно изучаете 2 языка. Как правило, один из них английский. Второй - французский, немецкий или испанский.
Скажу сразу, если вы знаете английский, то вам сюда. Я знала, и мне было интересно продолжать его изучение в юридической сфере. С немецким было намного сложнее, но я заставила себя его выучить.
Сейчас работаю в представительстве одной международной компании в Москве, и сразу скажу годы учебы в сфере гражданского и корпоративного права зря не прошли.
Я благодарна своему факультету за хорошие знания в области права и за углубленный английский!!!
Советую поступать сюда, если вы реально готовы учиться, а не страдать дурью!",positive
"


При поступлении читала отрицательные комментарии и думала: да нее, быть такого не может, кому-то просто не повезло. ОДНАКО всё написанное оказалось правдой. Отношение руководства и преподавателей скорее как к заключённым, а не студентам. Кромешный бардак в деканате. Расписание сессии дают непосредственно перед самой сессией. Про сайт я даже не заикаюсь. Преподавателя могут не найти, тогда n-ое число занятий в семестре просто пропадает (а на сессии всё спросят). Нам  2,5 месяца искали хоть кого-нибудь, кто взял бы 8(!) часов языка. Могут нахамить, если будете спрашивать что-то лишнее. Ну и самое главное. УЖАСАЮЩАЯ АТМОСФЕРА. Постоянное давление, стресс 24/7 и тонны домашки. Можете забыть о всех своих хобби, спорте и тд, потому что у вас не будет времени ни на что. Да и это ещё не всё. Даже если вы будете всё делать и учить (в ущерб еде, сну и личной жизни), то и тогда у вас не будет хороших оценок. Абсурдность, мрачность и безысходность обучения в МГЛУ  можно сравнить с романами Кафки. Ощущения от учёбы, как от липкого кошмара. И самое обидное — количество затраченных усилий не равно полученному результату.  Можно хоть целыми днями всё учить и писать, но у вас всё равно не будет положительных текущих оценок. Язык можно выучить и в менее чудовищных условиях. Это не стоит потраченных нервов. Мою (казалось бы, устойчивую) психику учёба в МГЛУ не просто пошатнула, а разломала вдребезги. Если вы не любите страдать, не поступайте в МГЛУ.",negative
