Text,Mark
"


Не поступайте в эту шарагу или посторонним вход воспрещён
Когда я поступил в 2014 году на специальность &quot;Сервис&quot;, по началу было нормально. Но потом нас представили преподавательнице Ч******* О.И. и она у нас преподавала математику и информатику. Методы преподавания у неё не подарок, скажу сразу. К студентам относится, как к рабам и она считает, что у нас есть обязанности, но нету прав. Мы не можем сказать свое мнение ей, выразить свое недовольство оценкой на экзамене, а про экзамены с ней, это вообще отдельная история. В туалет она вообще никого не выпускает и стоит человеку спросить можно ли выйти по малой нужде, на что О.И. тебе в ответ скажет:&quot;Приносите справки о том, что все живы и здоровы и вы в состоянии вынести пару! &quot; Получить зачёт у неё автоматом или экзамен даже не надейтесь! Когда наступает день сдачи экзамена она требует, как на ЕГЭ в школе класть все телефоны ей на стол и сумки оставлять в коридоре, можно только взять ручку и листок бумаги. Списать экзамен возможности она никому не позволит. Если завалил экзамен она и дальше тебя будет заваливать и добьётся своего, чтобы тебя исключили из университета. Теперь про другого субъекта расскажу, красивы...Показать полностью...е девушки и не очень берегитесь! Есть один преподаватель по философии и английскому, немецкому языку Б****** С. А. Он, как и Ч******** имеет манеру отвечать студенту с хамством, даже если ты с ними по-людски обращаешься! У Б****** есть своя манера общения и преподавания предмета. Он сказал нам один секрет, что сам не знает и забыл немецкий язык и я его буду учить заодно вместе с ребятами во время урока. Если он открывает учебник он будет читать все в подряд, вплоть до того &quot;Как правильно разговаривать на немецком языке. Язык при произношении буквы A приподнимается к небу и щеки расслаблены. &quot; Лично я не понял, к чему он такую фигню читает, когда студент самостоятельно в состоянии при изучении этого предмета сам прочесть! С. А. никогда сам не напишет на доске ни предложения, ни слова. Вместо этого он нам говорит:&quot; Мне доску жалко. Меня ругают за то, что я пишу на доске!&quot;. Он вызвал написать к доске слово только одного студента и все, на этом и закончилась его симфония. К симпатичным студенткам он присматривается внимательно и он медленно, но верно начинает к ним домогатся, например:может попросить у неё номер телефона прилюдно у всей группы и не стесняясь говорить, что он ей вечером позвонит и устроит ей &quot;Тет-А-Тет&quot;. Спрашивает, есть ли у неё ухажер или были ли мужчины в её жизни вообще? С удовольствием им рассказывает про свое наблюдение о том, что в колледже уже есть студентки и уже беременные сидят у него на уроке. Метода преподавания у него нету, поверьте! Вместо того, чтобы рассказывать умные вещи, он рассказывает нам про маньяков и проституток. Особенно у него в идеале был рассказ про доцента-убийцу И. Д********* и про &quot;Ксению Бэнтли&quot;. Ребята, внешность не то, чем кажется, поверьте! Он любит проявлять к студентам психологическое насилии в виде троллинга прилюдного, может специально не выговаривать правильно твое имя и фамилию, придираться на уроке по поводу и без, если ты правильно прочитал и перевёл текст, он его по своему исправит и выставит тебя дураком. Однажды он у девушек спросил, кто едет на электричке, каждый день! Если узнает, кто же это, он начинает свое. О боже! Как это прекрасно! Я смогу развеять себе и вам скуку и могу оказаться вам приятной компанией. Иногда он сам просился в компанию к девушкам в попутчики электричек. Был ещё такой неприятный момент, когда от ребят узнал, что он иногда заходит в женский туалет и сидит там в кабине, ну явно не справить малую нужду. Он смотрит из-за двери, кто из девушек вошёл в туалет и следит за ними и сам не подаёт виду, что он там сидит на толчке и смотрит, что там девушка у зеркала. Настаёт день экзамена. Экзамен сдавать у него тоже не сахар! На автомат тоже не надейтесь! С одной девушкой произошёл неприятный инцидент, она оказалась последней в списке сдачи предмета. Она вошла в кабинет и взяла билет, а когда она стала сдавать свой ответ. Вот тут то все и началось! С. А. попросил сесть к ней поближе и пока девушка отвечала, он пытался её поцеловать и студентка сопротивлялась, он ещё раз предпринял попытку её чмокнуть в губы. В итоге девушка убежала, так и не сдав экзамен. Она пошла и написала заявление в деканат о том, что он домогался к ней и причём не в первый раз он к ней пристаёт. Девушка написала в своём заявлении и заместителю ректора рассказала такие вещи, что у нормального волосы встают дыбом! Когда она отвечала на свой билет на экзамене, он опустил одну руку вниз в свои штаны и он стал трястись и девушка, заметила, что он др*чит, в прямом смысле слова! Есть ещё один факт про этого Б****** С. А. Он раньше работал в Москве в МИД России и он потом стал преподавателем там, не удивлюсь, что его оттуда за домогательство выгнали из его же хваленного МИДА! На этом и весь мой рассказ, надеюсь вы примете правильное и мудрое решение не поступать в этот дурдом, который страшно и вузом назвать!",negative
"


Итак, если прочитав этот отзыв хоть кто-то из потенциальных абитуриентов откажется от подачи документов,то отзыв написан не зря. Начнем с того,что у университета очень сильная пиар-кампания (гранд мерси ПрофОтряду и иже с ними). Вам навешают лапши о том,как это престижно,участвовать в продвижении университета. Одно лишь маленькое условие-напиши хороший отзыв и ты в деле;)Такая манипуляция действует, естественно,только на первокурсников,которые ещё не успели &quot;очухаться&quot; и осознать всю жесть ситуации. Идём дальше. Первое сентября,торжественный момент и непонятные телодвижения,называемые флэшмобами,от кураторов. Которые первым делом начнут затирать про то,как они уже вас всех любят просто потому,что вы пуськи. Но камон,ребят,с первой встречи? А потом начинается бесконечное промывание мозгов,собрание группы для объединения. Ваши кураторы,возомнив себя гуру психологии,будут затирать пропаганды о восхитительности университета не хуже профессиональных иеговистов. Ну что ж,теперь пару слов об учебе. Её нет. Об учебе всё. А если серьезно,вас ничему не научат. Долгое время ,учась в школе,пределом мечты было поступить в этот университет,обучиться практическим навыкам. И поверьте,бОл...Показать полностью...ьшего разочарования в моей жизни ещё не было. 4 года жизни потрачено впустую. Множество ненужных предметов,абсолютно некомпетентные преподаватели,которые далеки от современных тенденций. О трудоустройстве от университета забудь. Ну,если конечно имеется ввиду престижное место работы. Тебе ,дружок,придется искать работку самому. А поверь,сочетание букв РГУТИС не впечатляет HR-спнциалистов.Проверено на собественном опыте. Если всё же волею случая тебя сюда занесет,начинай работать как можно раньше. Опыт,а не диплом твое преимущество. Иначе после защиты диплома окажешься за дверьми общаги и без возможности заработать денежку.Итак,к выводам. Знаний универ не даёт,но зато станешь профи в организации концертов,песен и плясок. Лагерь &quot;Орленок&quot; отдыхает. Диплом не котируется ни в каком цвете,ни в красном,ни в синем. Активистская жЫзнь активная лишь попытка сбежать от реальности. Активисты в основном ребята с коммерческих отделений,так как есть шанс,что если ты сильно засветишься,тебя переведут на бюджет. В общем,друг,хорошо обдумай свое решение прежде,чем подавать сюда документы. А ещё лучше не поленись и пообщайся не с профотрядом через соцсети,а найди выпускников последних нескольких лет и попроси рассказать об университете.",negative
"


Постараюсь кратко изложить причины почему вам НЕ стоит поступать в этот университет. 
1. Образование на уровне пту, хотя может даже там лучше обучают профильным специальностям. 
2. Незаинтересованность преподавателей в своей работе
3. Коррупция. Можно не учиться, просто денежку вовремя вносите 
4. Отработка в общежитиях ? Это что вообще. Помимо внесения денег, ещё и рабский труд 
5. Диплом, который открывает, но не мир, а глаза на бесполезность полученной профессии. 
Из плюсов могу отметить:
1. Актив. Если любите движ, то это туда. Много новых друзей и социального опыта
2. Общежития. Да тараканы, да душ на всю ораву, да лифт, который работает по расписанию. Но это очень крутая школа жизни. И условия неплохие в сравнении с другими 
3. Чистый воздух, вокруг зелень, нет машин и 40 минут до Москвы. 
Вывод. Если вы набрали достаточное количество баллов, чтобы поступить в другой универ, то даже не думайте о РГУТиС. А если выбора нет и вы лоханулись с ЕГЭ, тогда идите лучше в пту. Но если вам больше интересна студенческая жизнь, чем учеба и получение достойного образования, то РГУТиС ждёт) ",negative
"


Хочу рассказать о нахваленном на официальном сайте вузе. Ситуация на самом деле довольно печальная. Я ,будучи в радужных мечтах, не ожидала, что происходит на самом деле и какая тут обстановка.

Начну пожалуй с самой больной темы - общежитие. Первокурсников, как правило заселяют в общежитие номер 4, специализированное на этом и гордо носящее название общежитие повышенной комфортности, о которой слышать можно лишь на словах. Об этом свидетельствуют периодически сломанные душевые рейки в душах, несоответствие жилой площади на одного человека, отсутствие (в данный момент) и платные услуги стиральных машин, закрытие кухни после 11, комендантский час, который крайне неудобен для тех, кто уже устроился на работу (учитывая то, что его уже давно отменили), также есть некий нюанс с заселением родственников (1 день стоит 500 рублей) и приглашением гостей, что в принципе невозможно. 

Помимо всего вышеперечисленного хочу добавить, что здесь вы столкнетесь с таким понятием, как бесплатная обязательная отработка (о которой нигде не прописано ни в договоре о найме жилого помещения, ни где бы то ни было ещё). Про коменданта могу сказать следующее: как по мне, этот человек истинный самодур, которы...Показать полностью...й не видит дальше своего носа. Её не волнуют проблемы других людей, если ей не хочется или у неё нет времени, она ничем вам не поможет. Сказать, что к этому человеку нужно иметь подход, это ничего не сказать. На своём опыте поняла, что пытаться найти с ней общий язык как минимум бесполезно и как максимум небезопасно (для своей же здоровой психики). 

Если коснуться цены, то здесь идёт полное несоответствие цены/качества. Как я уже говорила, те условия, которые я привела в пример, просто недопустимы в общежитии повышенной комфортности за 3 тысячи рублей в месяц!!! 

На общежитии пожалуй всё.   Переходим к ещё более главному аспекту - образованию. Не могу сказать, что образование тут ужасное, но и что оно на приличном уровне тоже. Есть некоторые преподаватели, которые преподают устаревшими, неэффективными методами, которые никак не заложат в голову то, что действительно нужно. Однако есть и такие, которые чётко знают свой предмет и умеют грамотно его преподносить (но таких, к сожалению, меньшинство). В общем могу сказать, что это очень усредненный вуз, где далеко не все идут тебе навстречу. Таковы суровые реалии жизни(((",negative
"


Хотелось бы рассказать конкретно об общежитиях в Ргутис, они просто отвратительны
Первый год вы будете платить 3000₽ в 4 общежитии ни за что, вам будут говорить, что здесь евроремонт, поэтому так. Но в 1 вы будет платить в 2 раза меньше с теми же условиями, но даже лучше. У вас будет вход в 4 общежитии(туда заселяют большинство перваков) до 22(для тех, кому 17) и до 23 кому 18+, что максимально неудобно, когда хочется съездить на концерт, у вас будут постоянные кофликты с комендой. Также вам придется выполнять 12 часовые отработки то есть помогать той же коменде 12 часов, это нечестно, потому что платя 3000₽, они нам сами должны отрабатывать. Также кухня закрывается в 23:00, даже чайник не поставишь после 23, а в это время часто кушать хочется
У вас будут ограничения на гостей, в 4 общ вообще их нельзя приводить, а в 1 и во второе в определённое время только
В результате, вы получается мерзотные общежития с лицемерными заведующими, которые хотят только сделать вам хуже",negative
"


Это п***ц, а не вуз, товарищи.
Буквально три дня назад я еще являлся студентом 4-го курса, но нет, не подумайте, меня не отчислили, я защитил диплом. Отчислить в данном вузе могут только из-за неоплаты или... неоплаты. Если быть кратким, за 4 года обучения в вузе я не написал ни одной курсовой, не потому что я неуч, у нас просто в принципе не водится такое страшное понятие как курсовая работа.
Касательно качества образования. Судите сами, если не сдать сессию невозможно, любой экзамен можно купить. Простите, не купить, оплатить курсы дополнительного образования. На которые вас ни разу никто и не пригласит. Достаточно просто занести преподу чек об оплате и ваш неуд., в зависимости от того сколько &quot;часов доп.образования&quot; вы оплатили, чудесным способом превращается в удовл. или хор.
Можно ходить на пары, можно не ходить
Хотите 5 ходите, хотите просто закончить вуз, приходите за дипломом через 4 года, предварительно оплатив все сессии.
Но справедливости ради, стоит сказать, что преподы денег не вымогают к прилежным студентам относятся соответствующе.
Вам, кстати, на приемной комиссии будут говорить, что &quot;наш диплом открывает мир&quot;...прошу  вас, не обманывайтесь. 
",negative
