Text,Mark
"


Я даже не знаю, с чего вообще начать. Недавно был выпускной, получение диплома и вот, теперь можно спокойно строчить отзыв про этот университет. И да, спойлер: та шикарная надпись, которая чуть ли не везде висит, прикреплена, упоминается в видео или еще где: &quot;Наш диплом открывает мир&quot;, так вот, ни шиша он ничего не открывает, запомните. Этот лозунг чисто зазываловка детишек в данный университет.
Начну что ли. РГУТИС мною был выбран случайно, проезжая мимо него, возникла мысль: надо зайти глянуть, что это такое. В итоге все 4 года учебы прошли здесь. Плачевный отзыв можно будет писать бесконечно, выделяя бесконечное количество минусов. Но я пожалуй ограничусь в этом плане и выделю те минусы, которые лично я считаю, что их вообще нужно устранять (поверьте, этого никто делать не будет) и мииизерное количество плюсов (а их от силы где-то 1-2, ну мааксимум 3).
Начнем с плюсов:
1) собственная территория университета, зеленая зона весной летом, золотые краски осенью и сказочная зима, многие называют территорию &quot;мини-парком&quot;, чему нельзя не согласиться. Территория действительно красивая, большая, есть где походить, для нынешней молодежи поделать кучу разных фотографий, ...Показать полностью...да и просто насладиться природой в перерыве между парами, обедом. Несложно погуглить и найти фотографии университета.
2) как и писали ниже большинство людей - активная, прям до невозможности студенческая жизнь и вот здесь я полностью соглашусь с комментатором по имени &quot;Некто&quot; по поводу кураторов, они закрепляются за вами вплоть до окончания они будут вам впихивать всевозможные участия, конкурсы, фестивали и тд, и при любом отказе, начинают гнать на вас, какие вы нехорошие и все такое. Именно мне это вообще не нравилось, хочется заниматься чем-то своим, а не идти туда, куда тебя автоматом записывают. Но это дело каждого, поверьте, любители были и им это нравилось.
В общем, если вы поступаете чисто тусить и активничать, то вперед и с песней сюда. Если хотите прям хорошую стипендию (до 12 тыс скажем), то как раз участвие во всяких этих флешмобов, конкурсах, фестивалях и тд вам поможет
3) общежитие в 5-8 минут ходьбы от университета, что позволяет экономить время и выходить на занятия позже (москвичам приходилось/приходится вставать к 1 паре в 6 утра, чтобы нормально добраться до вуза). На вопрос: &quot;Почему они не могут взять общагу если им так нелегко вставать?&quot; Опять же, на вкус и цвет, из моих знакомых москвичей общагу брали немногие и то не все прям жили там. Они брали его на запас, в случае если допоздна остаешься в университете, не тратить время на дорогу до дома, а остаться тут, в общаге. Что было очень хорошим замыслом, но так делали очень мало людей.
На этом плюсы вуза заканчиваются. Теперь переходим к самому интересному: минусы.
1) это минусом прям совсем нельзя назвать, но для кого-то это реально является минусом - расстояние, далеко ехать до университета и обратно. Я считаю, что вполне норм расстояние для Москвы (на элке до вокзала 40 минут, на маршрутке до м.Медведково +- час)
2) общежитие - если вы боитесь насекомых, жуков, тараканов и тд, запасайтесь отравами, пшикалками и тд, ибо их в общаге пруд пруди. у 1 общаги, где проживают несовершеннолетние условия получше, чем у остальных, но там и тотальный контроль есть. Первое время с перваков будут сдирать 3 тыс рублей в мес. за содержание, в последующие дни около 500-600 рублей.
3) обучение - оно никакое. От слова совсем. На 1 курсе вообще некоторые предметы повторение из школьной программы, которые вообще не понятно, зачем ввели. Да, некоторые предметы были интересны, но их было там 2-3, остальные дичь полная. И это на бюджете, про заочку вообще молчу, там большинство времени ты проводишь за занятиями сам, пытаешься САМ все понять и что-то сделать.
Преподаватели. Не знаю, как там у других ребят, но именно мне с преподами повезло, все были адекватными, на уступки всегда шли, тут прям без претензий. Было всего лишь 2 препода, с которыми мне было тяжело, но все прошло хорошо и это главное. У каких-то преподов реально интересно было слушать лекцию, выполнять задания, проводить дискуссии и тд, с какими-то очень скучно, просто садишься слушать и начинаешь заниматься своими делами (так кстати очень многие делали во время дистанционки, тупо включали зум, скайп и тд, выключали у себя звук и шли делать свои дела, поверьте, таких было половину вуза).
4) оплата - слишком сильно завышены цены. Ты платишь чуть ли на 200к в год (это контрактники, заочка до 100к) за ни за что. И с каждым годом ценник все выше и выше.
5) практика - ее вообще нет. Хотя нет, она есть, на бумажке. А так ты просто выполняешь задание в Ворде и все, считай, практику прошел. Если хочешь действительно пройти хорошую практику в турфирме или гостинице, ищи сам.
Можно еще долго перечислять, но я остановлюсь на самых значимых минусов, которые впринципе для всех важны.
Если делать итоговый вывод, то он такой: если вы любитель тусовок, активности, то вам сюда - участвовать, танцевать всех мероприятиях и тд; если вы действительно хотите получить навыки, знания, мой вам совет, найдите вуз получше, вам же будет лучше. И да, совет, не читайте отзывы на других сайтах, по типу Яндекса, так как там проплаченные отзывы студентов, которые как раз таки и являются в университете активистами (им за хороший отзыв дают баллы, мб и автоматы по каким-то предметам). Многие спросят &quot;А почему Вы не указываете свое имя в отзывах?&quot;
АХАХАХАХАХ, комон, вы серьезно? Все же знают такое слово как &quot;крыса&quot;? Увидят отзыв, доложат и все, гудбай:)))
На этом я заканчиваю свой отзыв. Всем спасибо!",medium
"


Я поступала на базе средне-специального образования и даже моя шарага лучше, чем этот университет. 
Так я дизайнер, но пришлось идти на туризм потому, что дизайна заочного на момент моего поступления не было и, если не ошибаюсь, то и нет. 
Плюсы университета: можно вообще не учиться, главное во время вносить оплату, но если и не во время внесли, то вам дадут время на внесение, есть рассрочка. Можно поступить в любое время, я поступала в октябре. Никто не следит за вами на сдаче вступительных экзаменов. На этом всё.
Учусь здесь на платной 
заочной форме обучения( заочная она, конечно, по документам, а по факту дистанционная). Поступала только ради того, чтобы был хоть какой-то диплом и была возможность совмещения с работой, если вы поступаете учиться и думаете, что после этой &quot;учебы&quot; пойдете работать по специальности, то лучше выберете другой университет. 
Меня смутило все ещё на этапе поступления. Вступительные экзамены по одному из предметов я сдала плохо, судя по баллам, которые я увидела. Бóльшую часть я, конечно, списала, было странно увидеть низкий балл. У меня сложилось впечатление, что мой тест проверяли не по тому варианту и просто дотянули до минимального порога,...Показать полностью... если не ошибаюсь, то это было 42 балла. 
С каждым годом повышают стоимость, при поступлении цена составляла 70к/год, на данный момент 77350 (да-да прям 350), а условия работы с переподавателями только ухудшаются, но на 1 курсе 1 семестре всё было прекрасно. Даже было желание учиться. У них был сайт, куда мы выгружали свои работы, презентации, сдавали тесты. Порой сайт работал некорректно и требования к работе на 4-5 были космические. К примеру, работа по философии на любую выбранную, из предложенных, тему должна быть не менее, чем на 70% оригинальной иначе ставят не зачёт, а чтобы получить 5 на 90%. Выходит с нас просили какой-то научный труд по философии при том, что данный предмет не является для нас профильным. Но судя по всему преподаватели даже не открывали наши работы, а просто ставили оценки. 
Позже работу перенесли на площадки с видео-трансляциями. Всё виснет, глючит, вылетает, у кого-то из учащихся нет звука. Иногда учителя перегибают палку и дают задания не соизмеримые с доступным для нас временем (работающие люди всё-таки). К примеру, присылают нам файл, а в нём 2 теста по 25 вопросов, таблица, которую надо заполнить и индивидуальный проект, который обычно дают на 2 недели и в него входит создание текстового файла и презентации не менее, чем на 15 слайдов, и преподаватель объявляет, что на всё у нас времени до конца пар, а из 3 часов осталось всего 2 потому что до этого преподаватель целый час рассказывал, где у него живут родственники и как прекрасна жизнь в Швеции. На явное возмущение преподаватель отвечает, что вы просто не умеете распределять своё времявремя, а на вопрос сможет ли она сама это всё сделать ответа не следует. Покорчив из себя недовольную царицу, уступает время до 10:00 следующего дня, а на момент пары время уже около 19:00, а у некоторых учеников и того больше (другие страны). Покорчившись ещё с барского плеча дарит время до 10:30. 
Вас будут обучать всему, кроме работы в сфере туризма. Научитесь делать сайты в конструкторе, ментальные карты. Соскучились по школьной географии? Тут вы будете также раскрашивать их только с огромной вотермаркой чужого сайта. Соскучились по презентациям? Тут вам будут их давать по каждому предмету по несколько штук! Конечно же любимый Word с Times New Roman. Не умеете читать? Преподаватель две пары подряд будет делать это за вас не отходя от текста ни на шаг. Как насчёт составить Топ-чего-угодно с перезентацией? Пфф пожалуйста всё для вас! 
Затем становится понятно, что учителям это всё вообще не надо, когда просишь что-нибудь скинуть, чтобы закрыть долги они спокойно могут с вами не поздороваться и начать наезжать, даже иногда хамить в скрытой форме, как бы вежливо вы к ним не обратились, если вообще сможете обратиться потому, что как таковой обратной связи нет. Многие учителя просят не писать им на вотсапы и т.д., ссылаясь на то, что и так учеников много, пишешь им на почту и ждёшь ответа дней по 5, если повезёт, то 2.
Если хотите закрыть долг, то расхотите, как бы вы не дергались и не вертелись им всё равно, самое главное вносите оплату за обучение, а остальное вообще не важно. Долги можно закрыть в определенные месяца, всё рассылают лично ученикам, но за всё это время мне и моим одногруппникам не присылали ссылки на закрытие долгов.
Если хотите, чтобы вас отчислили, то не платите - это единственное за что могут тут отчислить. 
Что касаемо практики, то от неё одно название, честно, не знаю, что там на очной и очно-заочной, но у нас это Word файл.  Единственное о чем вам напоминают: об оплате. Остальное вообще не важно. Плати, плати и ещё раз плати, а если не будешь платить, то тебе угрожающе будут присылать письма с отчислением и с разрывом договора в одностороннем порядке потому что ты внёс деньги, но не все, чем нарушаешь договор оказания услуг. 
Платите, а потом вам пришлют диплом по почте голубям, за который вы заплатили ~300к, а знаний вы получите 0. 
Дешевле просто купить диплом топового ВУЗа и закончить какие-нибудь экспресс-курсы. ",negative
