Text,Mark
"


Поступил с невысокими баллами на направление туризм. Первые две недели были вступительными, перед первокурсниками выступали различные представители сферы туризма. Ничего кроме пустой болтовни ( которой будет и дальше очень много). Также в эти дни решались организационные вопросы. На группы делили в результате странного тестирования по английскому языку, точнее собеседования. Дальше самое &quot;интересное&quot;- знакомство с кураторами. Готовьтесь к кураторским каждую неделю, на которых вы познаете все прелести &quot; team building&quot;. Кураторы Вуза будут часто напомнать вам кураторов &quot; синего кита&quot;. Ваш общий чат всегда будет полон сомнительными предложениями пойти на разнообразные мероприятия. А если вы откажитесь или придёт мало народу, то ваш куратор устроит вам истерику ( я не берусь судить о всём составе кураторов моего года, однако в моей высшей школе таких было как минимум трое). Вуз оправдывает репутацию активной студенческой жизни. Здесь всегда что-то происходит, хотите ли вы этого или нет. Пару слов о знаниях, их нет. Вся учёба состоит из презентаций. Есть несколько преподавателей на пары, которых реально интересно ходить, более менее адекватных я насчитал тр...Показать полностью...оих. Лично меня мои ноги несли только к одной. Остальные же оставляют желать лучшего. По какому-то определенному вселенскому закону именно преподаватели общих дисциплин как право или философия требуют больше, чем могут дать. Английский на уровне МБОУ СОШ. Физкультура отдельная тема. Готовьте справки, форму которых в вашей поликлинике никто никогда не видел. Поэтому вам никогда не будет грустно, вам всегда будет весело от очень искоментных шуток некоторых тренеров. А если вы любите поговорить, готовьтесь отжиматься. Стоит отметить, что в моей высшей школе огромной властью обладал господин Ш, который играл своеобразную роль классного руководителя для всей высшей школы. Однако, всю важную информацию вы будете получать в самый последний момент, чаще всего вечером, когда господин Ш соизволит до вас снизойти. Он как Джон Сноу-ничего не знает, а вы Сэмвел Тарли, который ищет ответы на интересующие и важные вопросы через &quot;Цитадель&quot; в Староместе, то есть через знакомых и кураторов, и не забудьте запастись терпением и взять что-то покушать, вам предстоит долгий путь в поисках какого-нибудь мед. центра либо паспортного стола. Ведь связаться с людьми или помочь вам господин Ш не может, слишком занят уничтожением &quot;белых ходоков&quot;- студентов без масок. Зато у вас будет уникальная возможность приобщиться к знанию, где родился, где крестился и где служил господин Ш.  А потом не  удивляйтесь, когда вам сообщат, что завтрашние пары будет дистанционно уже только в девятом часу вечера. По поводу общежития, я пожил и в 4 общежитии, куда селят всех перваков, и во 2. Первое чуть лучше, но строже правила, второе подешевле, больше, там хуже ремонт, однако отхватить можно и в нём. Особенно, если вы ведёте свой личный блог, и привыкли быть честными со своими подписчиками. То забудьте, теперь ваш Инстаграм или тик ток принадлежит Вузу, который очень печётся о своей репутации. Контингент кому как повезёт. Если у вас в группе попались неплохие ребята, то не радуйтесь так сильно, в общаге могут проживать более маргинальные личности. В заключение, хочется сказать, что Вуз подарит вам массу приключений на одного мягкое место. Ведь уровень безопасности не всегда соответствует заявленному.  Получите ли вы знаний, большой вопрос, наверное если только очень захотите. У вас высокие баллы- я уверен, вы найдете вариант получше. Для вас это идеальный ВУЗ только в одном случае, если вы любите танцевать и готовы ночами учить знаменитые флешмобы.",medium
"


Я студент РГУТИС. К сожалению, это было единственное место в Москве и области куда я мог попасть на бюджет (расположение, кстати, отвратительное). Проходные здесь невысокие, однако лучше десять раз подумать стоит ли оно того. В то время как мои друзья в более топовых вузах активно приобретают новые знания, я просто клепаю бесконечные презентации. Нет, если вы решили провести свои студенческие годы ненапряжно и при этом отдаете себе отчет о том, что на выходе знаний у вас будет примерно 0 и хорошей работы вам в этой сфере не видать (большинство выпускников работают не по профессии, хотя в вузе убеждают в обратном), то добро пожаловать. Студенческая жизнь слишком активная. Иногда хочется просто отдохнуть, но кураторы (второкурсники) никогда не дают этого сделать. Бесконечные конкурсы, активности и разного рода мероприятия буквально каждую неделю по несколько раз. Учеба и правда несложная, но мне как человеку, который хотел бы хоть чему-то научиться, такое не совсем по душе. Стоит отметить и парочку дисциплин. Например, английский язык. В начале обучения вас разделят на группы по &quot;слабому&quot; и &quot;сильному&quot; английскому, но, по факту, это не имеет никакого значения. Так ...Показать полностью...что людям с сильным английским здесь придется поднапрячься, чтобы вовсе не забыть язык. Мероприятий много, как я уже и писал, но судя по тому, как всех просят ничего не афишировать, проводятся они в коронавирусную ситуацию не очень легально. Кстати, если вы решите отлынивать от мероприятий и конкурсов, ваш куратор обязательно надавит на жалость.
Подведу итог, если вы любите мероприятия и всякую активность, не хотите сильно напрягаться с учебой и в целом вам не важно какой диплом у вас будет на выходе, то добро пожаловать, а остальным советую пересдавать егэ на следующий год или подавать в региональные вузы.",negative
"


Разочарование. Вот как стоит назвать это место. И вуза действительно сильная пиар программа и с виду хороший сайт, особенно для несчастных абитуриентов, которые не знают всю поднаготную. Но все это мираж: все позитивные отзывы, комментарии и т.д. оставляют одни и те же люди, которые являются участниками различных движений. Вступают в них, в первую очередь те, кто хотят перевестись на бюджетную форму обучения или те, кто легко вдохнавляется подобными вещами.  Они соотвественно и создают однообразный актив. Поэтому рекомендую не верить картинке.
Знаний по факту никаких, особенно ощутилось это на дистанционном обучении. На туризме практика так таковая отсутсвует, хотя другие вузы,которые как и РГУТиС входит в различные топы по направлентю подготовки специалистов туризма, имеют контракты с различными турагенствами и пр. Отсутсвуют курсовые, действует балльная система. Набираешь за счет посещений и сдачи контрольных определенное количество баллов - получаешь 3ку или 4ку, для 5ки нужно идти на экзамен. С одной стороны удобно, с другой стороны вся учеба скатывается в бестолковую сдачу контрольных и все. По сути, хочешь получить опыт и знания, то скорее устраивайся на работу, вуз тебе ниче...Показать полностью...го не даст. 
Общежитие не такое уж и плохое, хотя кто к чему привык. Есть несколько корпусов. 4 новее, но правила (в особенности коменданты) там жестче, так как рассчитано на колледж, людей младше 18. 1 и 2 в плане ремонта хуже, но остальные условия мягче, хотя там тоже могу по голове дать. Первый курс университета всегда (попроситься в другую можно, но скорее всего откажут) заселяют в комнаты с собственным холодильником в комнате, микроволновкой и чайником на одно крыло. Сейчас все это удовольствие стоит 3к. Со второго курса переселяют на другие этажи, где всего этого удовольствия нет, но стоит гораздо дешелве. Душ - небольшая ржавая кабинка, рассчитаная на 10 человек (1 блок). Летом оставаться нельзя, при дистанте тоже, хотя он скорее всего уже не грозит.
Итог, если вам не особо нужно образование и вы идете ради спокойствия родителей или факта наличия волшебной бумашки, хочется быть ближе к заветной Москве (40 минут на электричке до Ярославского или час до ст. Медведково), то этот вариант нормальный. Если вы хотите знаний, то даже какой нибудь провинциальный областной вуз с РГУТиСом может посоревноваться.
",negative
"


Прочитала все отзывы моего вуза, и пришла к выводу, что они немного приукрашены. Сразу к коррупции: За год обучения я не сталкивалась с этим. Если хотите 4, то просто ходите на пары и исправно делаете проекты и пишите контрольные точки. Автоматом 4- вам обеспечено. Иногда даже 5 поставят. Но чаще для 5тёрки нужно будет прийти на экзамен и сдать его на соответствующею оценку.

Учёба- ну такое, да. Из всех предметов напряг со стороны иностранного языка, в остальном- полный расслабон. Делаете проекты (презентации на заданные темы) и получаете 10 из 10. Если вы хотите работать в гостиничной индустрии или туризме, то это точно вуз для вас. Практика проходит на уровне. И ВУЗ действительно гарантирует вам пойти работать по профессии. 

Общежитие. Я проживаю в 4-том. Там проживает некоторая часть первокурсников университета, и весь колледж. Общежитие строгое, но честно сказать, это стоит того. Тараканов в нашем общежитие нет. В других есть. Существует коменд. час., который регулирует больше вашу дисциплину. Особенно у детей из колледжа. Ребята младше 18ти лет должны быть в общежитие до 22.00. Ребята 18+ до 23.00.
Если вы хотите на концерт или что-то подобное- договариваетесь с комендой) Он...Показать полностью...а без проблем вас отпустит. Главное, предупредить и всё.
Да, кухни закрывают в 23.00. Поэтому стоит всегда иметь покушать то, что можно скушать без использования кухни. Зато тишина. А вот во втором общежитие кухни не закрываются, и постоянные ночные посиделки на кухни- приводят к шуму.  Во втором общежитие тоже живут первокурсники. Там коменд. час до часу ночи. Но к несовершеннолетним стараются относиться строже. Тараканы там есть. Но многие студенты гордятся, что живут в таком не строгом общежитие:) Везде свои плюсы и минусы. 
В 4-том общежитие есть комната для обучения, то есть, чтобы не мешать своему соседу и делать домашнее задание где-то в соответствующем месте. Комната отдыха (плазма, джойстики). Стоимость общежития для всех первокурсников- 3000. Дальше вас переселят в комнаты не повышенной комфортности и будет стоить дешевле.

Местоположение. Далековато от Москвы. Но пока вы молоды, вам будет норм. В общем, с учётом ожидания автобуса или времени пути до станции- час до центра Москвы. На электричках будет дешевле ездить) Но вы разберётесь, когда поступите. От университета до общаги- 7 минут ходьбы, поэтому удобнее жить в общежитие. Вокруг есть, всё, что вам нужно для первой нужды. На станции есть кафе. Ближайшие ТЦ в городах- Мытищи или Пушкино. 10 минут езды на электричках до этих городов. Через дорогу университет МВД. Пятёрочка и ларёк цветов. Остальное на стации (пешком минут 15 от РГУТиСа)

Студенческая жизнь. Вас не подведёт. Очень активная жизнь. Университет живёт ею. Множество мероприятий. Люди вас будут окружать хорошие) Друзей точно найдёте, все простые, потому что сам универ такой.

Оставляю положительный комментарий, потому что на самом деле рада, что поступила в данный университет. Баллов у меня была достаточное количество (250). ",positive
