Text,Mark
"


Несколько дней назад я закончила специалитет по клинической психологии. К сожалению, выпустил меня уже не тот тёплый, относящийся с уважением к своим студентам институт, в который я поступила и в котором училась 5 лет. За последние полгода в нём произошли существенные изменения, которые развалили свою особенную школу, готовившую на протяжении многих лет профессиональных специалистов (теперь о высокой квалификации и проф. этике можно забыть).

К сожалению, ни новая заведующая выпускающей кафедры (нейро- и патопсихологии), ни декан, ни директор института больше не идут на встречу студентам и не заинтересованы в налаживании здоровой атмосферы обучения: был уволен мощный преподавательский состав, расформирована кафедра дифференциальной психологии и психофизиологии, оставлены преподаватели, которые уже несколько лет работают с не самой лёгкой формой деменции и т.д.
Главное предостережение тем, кто думает сюда идти учиться - нам, выпустившимся студентам, стыдно перед людьми, основавшими и выстроившими наследие института психологии им. Л.С. Выготского. Мы всё потеряли.

Главное предостережение тем, кто уже учится - старайтесь общаться с людьми на перечисленных выше должностях (см. кто на ...Показать полностью...момент осени и зимы 2020-1 года) с сохранением переписки/звонков, чтобы в случае чего не быть голословным. Студентам здесь больше не верят.
И ни в коем случае не идите писать ВКР к зав. кафедры нейро- и патопсихологии - она сама же вас и потопит (не спрашивайте, что за бред, мы сами мечтали провести с ней пато диагностику) - таких разгромных отзывов на своих же студентов не было ещё ни от кого. При этом есть переписки, где студент просит её прочитать его работу, в ответ - игнор или &quot;позже, сейчас много дел&quot; - по итогу работа остаётся без ведения научным руководителем, который на защите утверждает, что с ним не выходили на связь. Думаю, вы понимаете, кому тут поверят. Есть случаи, когда студент вежливо просил объяснить ему критерии оценки по итогу защиты ВКР (в переписке) - и был заблокирован. Звонки от научных руководителей других студентов игнорировались.

Далее. Комиссия для защиты ВКР была сформирована из преподавателей МГУ, где и училась зав. кафедры. Если вы не знаете о специфике атмосферы на психфаке МГУ - погуглите, всё поймёте. То же творилось и на защите ВКР - неуважение к студентам, несоблюдение процедуры защиты (что отрицалось заведующей кафедры нейро- и патопсихологии, но на апелляции от увиденного в ужас пришёл даже ректор). К сожалению, нам не смогли помочь. Апелляция была утверждена, но комиссия на защите осталась по существу та же (если судить по членам ГЭК, участвующих в опросе студентов и обсуждении работ). И они, как вы понимаете, были очень разозлены. Теперь работу громили даже за опечатки. Но не это самое страшное.

В комиссии находились люди, не обладающие достаточной компетенцией в некоторых областях, чтобы по достоинству оценить представленные работы. Что ими отрицалось.
Лично моя работа касалась области, находящейся на стыке клин. психологии, психофизиологии и медицины. Ранее данные работы всегда высоко ценились и в комиссии были люди, имеющие проф. опыт в данных областях.
Теперь же - вместо того, чтобы развивать науку, на защите проходил спор по типу &quot;докажите, что трава зелёная&quot;: &quot;фантастика&quot; и &quot;бред&quot; - так был прокомментировано то, что &quot;смена состояния покоя выполнением какой-либо деятельности сопровождается, в частности, существенными перестройками в работе сердечно-сосудистой системы&quot;. По мнению членов ГЭК - в организме в связи с этим ничего не меняется, чем бы человек ни занимался, о чём бы ни думал. Это школьная программа, понимаете, да? В нашем институте более не изучают психику в едином целом с организмом. Нейропсихология ещё как-то (что странно) вписывается в их представления, но вот психофизиология - уже нет.
К сожалению, при данной зав. кафедры нейро- и патопсихологии у студентов больше нет возможности следовать своим научным интересам, если эта сфера не интересует членов ГЭК. В случае - если они не будут обладать достаточным знанием в области вашей работы - это не будет ими признано - они вас демонстративно потопят.
Более того - институт не в курсе, кого он выпускает. Я подавала апелляцию, поскольку процесс защиты был нарушен. Когда меня спросили, почему меня не устраивает оценка 4, мой ответ о том, что я шла на красный диплом, удивил всех.
Видимо, руководству нужно было как-то оправдаться, в связи с чем директор института (видевшая меня от силы второй раз в жизни) после повторной защиты, позволила себе оскорбить не только меня, но и моих преподавателей: утверждалось, что свои пятёрки я получала &quot;не совсем честным образом&quot;, и что я вовсе не отличница.
Очень жаль, что МинОбр, который выдал мне, находящейся в другой стране, грант на обучение в данном ВУЗе, а также те, кто посчитал меня достаточно компетентной для работы с олимпийскими чемпионами, спортсменами сборной России - не смогли распознать мои &quot;ненастоящие&quot; способности и навыки. Так же, вероятно, ошибся и мой рецензент, работающий в сфере космонавтики и высоко оценивший мою работу. Зато человек, который говорил со мной первый раз в жизни - сразу выдал обо мне всю правду!
Я надеюсь, что мой отзыв поможет определиться абитуриентам с выбором ВУЗа, а также поможет студентам нашего института заранее иметь представление о его руководстве. Мне очень жаль, что мы столкнулись с таким и нам мало кто и что может помочь. Страшно от того, что и руководство нашего института, который уже в народе называют &quot;филиалом МГУ&quot;, более не намерено растить успешных специалистов в заботе, внимании и уважении. Такое же отношение касается и тех преподавателей института, которые проработали в нём уже не первый десяток лет.
Сил, терпения и удачи.
",negative
"


Замечательный универ! Когда поступала, начиталась негативных отзывов наподобие: ой, универ разваливается; ой, преподы не нравятся; ой, недостаточно хорошо преподают, иду в МГУ! 

Итак, начну по порядку.
1. Внешний и внутренний вид.
РГГУ построен был в прошлом веке, а точнее в 1930 году. Здание снаружи красивое, как собственно и внутри. Все жалобы на его внутренний вид беспочвенны, потому что универ в хорошем состтоянии. Удобные и светлые аудитории, оборудованные техникой, хорошие туалеты, вообще обстановка очень приятная. Минус в том, что РГГУ состоит из 7 корпусов, разбираться на первых парах, что где находится очень сложно, особенно в главном здании, где коридоры очень странно расположены. ГЗ (главное здание) обычно называют Хогвартсом, ибо реально потеряться там очень легко, знаю на своем опыте. Но сущетсвует мобильное приложение РГГУ, где есть карта главного здания (пока только его, но надеемся, что там будут и другие корпусы), которая ооочень помогает. 
В универе есть небольшой музей, обширная библиотека, также есть книжный магазин, интернет-кафе, милый внутренний двор, в котором живут знаменитые кошки РГГУ.
2. Столовая неплохая. Вкусно кормят и недорого. Также есть буфеты и с...Показать полностью...толовые в других корпусах. Напротив универа есть продуктовый магазин, в котором на перерывах огромные очереди из студентов, также в пешей доступности есть KFC, Теремок, Мак, пиццерии, есть столовая и куча кафешек. Найти еду по вкусу реально не составит труда.
3. Для студентов существует куча всяких активностей. ОСО (объединенный совет обучаюихся) - самый высший орган студенческой власти, студсовет, профком, большое количество всяких кружков, в этом году добавился и киберспорт. Найти занятие по душе возможно каждому
4. Немаловажным аспектом для иногорднего студента является общага. С этим в РГГУ проблема. Общага есть, но только одна, а желающих попасть в нее - вагон и маленькая тележка. Минобр не хочет выделять средства на строительство второй, поэтому многие состоят в очереди на общагу около 1.5 года или же просто забивают на это и снимают квартиру/комнату. 
5. Теперь про всеми любимую физ-ру. Итак, РГГУ подчинены 2 места для физ-ры: корпус ИИНТБ на Янгеля и &quot;Новая Лига&quot; на м. Марьина роща. &quot;Новая Лига&quot; - это современный спорткомплекс, заниматься в нем одно только удовольствие. На счет Янгеля не знаю, не занималась там, но по слухам тоже неплохо, но не так как на НЛ. Добираться с универа на физ-ру на НЛ - около 15-17 минут (на метро), а на Янгеля придется дольше ехать - примерно 50 мин от РГГУ (тоже на метро). 
И сейчас будет совет всем абитуриентам и первакам на 1 семестре: ХОДИТЕ НА ФИЗРУ! ХОТЬ ИНОГДА! ИЗ-ЗА НЕЕ ТОЖЕ МОГУТ ОТЧИСЛИТЬ! 

А сейчас перейду к юрфаку, потому что учусь на нем уже вот 1 семестр и могу кое-что рассказать.
1. ТГП. Пожалуй, эту аббревиатуру недолюбливают все первокурсники юф. Сложно - да, непонятно - еще раз да, особенно в начале. Читает лекции Г******** Л.И. Заслуженный и опытный препод. Да, со своими тараканами. А тараканы еще те)))))) На семинары можете попасть к ней, а можете и к Ц********* В.А., к тоже хорошему преподу. Но если у вас будет отличаться лектор и тот, кто ведет семинары, скажу сразу - будет непросто. Г.Л.И. дает на лекции одно, а на семинаре Ц.В.А спрашивает совсем другое и говорит то,что дала Г.Л.И совсем неправильно.
2. Наболевшая тема всех первокурсников 2020 года - это преподша по ИГПЗС Е******* Н.Н. Она пришла только в этом году и у нас не было никакой инфы о ней от старшекурсников. Скажу сразу, нервов вы сней потратите ой как много. На семинарах получить &quot;5&quot; очень трудно, но зато ставить &quot;4&quot; она обажает. Требует, чтобы ответы были по ее любимой хрестоматии, которая есть в интернете только платная. Автомат получить у нее невозможно, т.к. абсолютно все выходят на экзамен - хоть ты пахал как лошадь весь семестр, хоть ты не явился ни разу на ее семинар. Зачем, спрашивается, мы рвем жопу ради оценок?
3. По ИГПР хороший препод - наш куратор. Женщина хорошая, лояльная, дает неплохие знания, любит поболтать.
4. Хочу выделить преподавателя по римскому праву. Она просто чудесна! Дает материал очень понятно, который сразу запоминается. Тот самый препод, который называет вас &quot;коллеги&quot; и всегда обращается на &quot;вы&quot;. Жаль, что она только 1 семестр преподает у перваков. Ее семинары я просто обажала.
5. На 1 курсе много предметов, которые идут только один семестр, со 2 курса уже появляются предметы по отраслям права.
6. Изначально все попадают на гражданско-правовой профиль и учаться почти до конца 2 курса. Потом уже, к концу 2 курса, студент выбирает для себя профиль: уголовный, финансовый, государственный или же остается на гражданском.
7. На счет деканата. Декан - очень приятный мужчина, двери в его кабинет всегда открыты (еще потому что у него сломалась дверь). Впринципе, деканат нормальный, нареканий пока нет.
8. Есть юридическая клиника. Туда приходят люди (в основном пенсионеры) со своими проблемами, с которыми поможет юрист. Под руководством опытного преподавателя и практикующего юриста, начиная с конца 2 курса можно помогать данным людям. Т.е вы полностью становитесь юристом: заводится дело и начинается расследование. Можно даже выступать в суде со стороны своего клиента))) Поверьте, это очень интересно. Юр. клиника РГГУ славится

Итак, подведу итоги по юрфаку. Поступать на юф в РГГУ стоит, знания вы получите. Преподы хорошие, опытные. Да, есть пара преподов с тараканами, но такое есть в каждом универе. Я не жалею, что поступила сюда.

На счет вообще РГГУ. Универ престижный, особенно для журналистов. Про другие факультеты сказать не могу, т.к не общалась еще с ними. Поступать/не поступать - дело ваше, но РГГУ я рекомендую",positive
