Text,Mark
"


Очень надеюсь, что данный отзыв абитуриентам как-то поможет. 
Я являюсь студентом Клинической психологии и хотела бы рассказать немного о нем. 
Итак, Все психологи учатся в главном корпусе и имеют собственный «уголок», где находятся в основном студенты псих.фака. 
Учителя здесь разные. Например, самые главные - это преподаватели по Анатомии и Общей психологии, У***** А.Б. и П****** И.А. 
У.А.Б. - будет преподавать 2 предмета, анатомию цнс и физиологию. Всего 2 года. Она любит пообщаться со Студентами, пошутить и т.д. Требовательная. При этом на семинарский занятиях помогает при ответе, наводит на мысль, пытается сделать так, чтобы ты именно понял предмет, а не вызубрил. Спрашивает всех на семинарах. Проводит так называемые коллоквиумы, т.е. делит группу на 2 подгруппы, они ей отвечают только на лабораторных занятиях по материалам 3 семинаров (лекций).
Насчёт П.И.А. Если вы знакомы с психологией, то наверное, слышали про Петухова В.В. —советского и российского психолога, кандидата псих.наук, доцента, затем профессора кафедры общей психологии факультета психологии МГУ (если что можете прогуглить его). Так вот она — его жена. 
Сама по себе, хороший преподаватель. НО! Она очень зависит...Показать полностью... от настроения. То есть если ей хорошо, то хорошо и вам. Если нет, то студентам, грубо говоря, конец. Очень любит задавать эссе.
Ненавидит бакалавров, любит Клин.псих., потому что считает, что бакалавр — неполное обучение и из них никаких психологов не получится. 
Ненавидит, когда с ней спорят или вообще отвечают ей так, как она не хочет. Ещё, когда опаздывают или пропускают лекции и семинары.
Очень любит унижать и давить на студентов. Она это делает при любой возможности. Будет промывать постоянно мозги про Петухова и про себя. Деканат ничего с этим не делает, потому что боится ее, и она прекрасно это знает, поэтому пользуется случаем, так сказать. Она также ведёт 2 года. НО! Не любит экзамены, поэтому щедра с автоматом. но если автомата нет, то вам конец. А если пересдача, то вовсе она будет вас постоянно из-за этого ругать и унижать. Короче говоря, с ней все очень трудно и запутанно всем психологам, вне зависимости от специализации. 
Кроме них, есть прекраснейший преподаватель, Б**** В.Ю. Он ведёт ТОЛЬКО у Клин. Психа. У него разные предметы: клиника внутренних болезней, психиатрия, психофармакология и т.п. Будете встречаться с ним в течении 5 лет обучения. 
Великолепный пожилой профессор. Очень трепетно относится к студентам, любит поговорить на лекциях, всегда спокоен и улыбчив. Ему главное ваше здоровье, а не оценки и экзамены. Он сам это каждый раз повторяет. Для закрытии сессии даёт список вопросов или же просто написание и защита реферата. 
Русский язык обычный преподаватель. В основном, ничего не спрашивает на семинарах. Главное — присутствие. 
История России ведёт пожилой преподаватель. Это предмет ставят мало в расписание, поэтому особо не парьтесь. 
Всеобщая историю ведут разные преподаватели. У кого-то лекции и семинары будет вести один и тот же препод, у кого-то разные. 
У меня С******С.Ю. Могу с уверенностью сказать, что один из самых лояльных преподов в псих.факе. Просто готовьтесь к семинарам, отвечайте на них, задавайте доп.вопросы. Он обожает пообщаться не только про темы семинаров, но и в общем об истории. Будет с вами шутить, смеяться, дружить. Щедр с выставлением баллов. Просит выбрать 1 вопрос из списка и подготовить его к сессии. Проводит на последнем семинаре пробный экзамен, и если вы его сдадите хорошо, то может засчитать, по вашему желанию, как основной и всё. 
Логику ведёт препод из ВШЭ Б**** А.С. Требует подготовку к каждому семинару. Требует активность. 
Если с/р и к/р пишутся хорошо + посещаемость и активность на семинарах, то автомат получите спокойно. 
И напоследок социология. Ее ведёт У******* Г.К. Она спокойная, общительная. Сразу даёт список вопросов на семинары. В зависимости от кол-ва делится между Студентами и готовятся доклады/презентации на семинары. Ставит баллы за посещения лекций и семинаров. Добрая, общительная.
Англ.язык. Пишет весь поток тест, который определяет Ваш уровень знаний. Потом делят на 3-4 группы. Все учителя неплохие. У меня ведёт П***** З.В. Она у самых сильных. Хороший преподаватель. Зачеты и экзамены будут для вас легкими, если вы посещаемость и активность хорошая + нет никаких долгов. 
МИНУСЫ — во-первых, физ.ра в основном проходит на ст. метро «улица академика Янгеля». Там находится ИНТБ. Это другой корпус. Всегда ставят 1 занятием, на 8:15. 
Во-вторых, бесконечно меняющееся расписание. Каждый день, кроме воскресенья его меняют в 22:30. Проверяйте всегда! Его составляют студенты 4 курса, поэтому может быть так, что в один день у вас 3 лекции и 2 семинара подряд, а в другой — только физ.ра и всё. Страдают от него не только студенты, но и преподы.
Огромное значение предают посещению и справкам. 
В общем, как и в любом другом вузе, есть и хорошие, и плохие моменты.
Надеюсь, при выборе вам как-то поможет эта информация. ",medium
"


Уважаемые абитуриенты и студенты, большинство положительных отзывов об РГГУ на ВСЕХ сайтах - сфабрикованные. Во время летней практики нас заставляют их писать ради зачета и перевода на следующий курс, уже по одной этой информации можно судить обо всём остальном, что происходит в стенах этого высшего учебного заведения, этот отзыв тоже пишу для зачета.

Если вы ищете универ, в который можно поступить с любыми баллами ЕГЭ, появляться там 2 раза в год на экзамены, и прийти через 4-5 лет за дипломом, заплатив не особо много, относительно цен за корочку по Москве, то это ваш идеальный вариант. В частности говорю о вечернем факультете рекламы, здесь вас не будут валить на сессии или топить за несданные задания.
А если всё-таки хотите учиться, то в течение года всегда найдется пара преподавателей, лекции которых будут действительно интересные, но остальные 100500 преподов просто бубнят что-то несвязное в микрофон, пока на экране висит одна и та же тема разными словами из разряда &quot;Что такое реклама?&quot;, так что здесь вам тоже не повезло.
Поскольку РГГУ позволяет студентам проходить практику в Госдуме, то руководство зорким глазом следит, чтобы никто не открывал свой рот против того...Показать полностью..., чье имя нельзя называть, если не можешь сказать ничего хорошего, иначе будут разборки.
Насчёт бытовых удобств молчу, полный набор: штукатурка падает, рамы трескаются, ПАРЫ В ПОДВАЛЕ, а уличные WC по сравнению с нашими - СПА-центр премиум-класса. 
Как часы работает только бухгалтерия, которая каждый год (не)исправно повышает цену. Меняется ли что-то в лучшую сторону от ежегодно растущей прибыли ректора? Отвечайте на этот вопрос сами, проучившись здесь хоть один семестр.
В общем, приходите сюда только ради корочки без заморочек и по бюджетной цене, но прежде подумайте, стоят ли того даже эти деньги (135 тыс. в год на 2021 г. за вечерний факультет рекламы РГГУ против 690 тыс. в год за очный тот же самый, но ВШЭ), и не лучше ли по возможности потратить больше и поступить куда-то ещё, чтобы ваш статус студента приносил вам хоть какие-то знания и пользу.",negative
"


Если уж и оставлять негативный отзыв, то не про сам РГГУ, а про систему российского высшего образования в целом. Сам университет достаточно средний, он не входит в топ лучших по стране, но и совсем помойкой его назвать сложно.  
Качество образования конкретно на юридическом факультете не лучшее, многие преподаватели субъективно оценивают знания студентов, исходя из своего отношения к ним. Однако не все такие и есть достаточно интересные кадры, но как правило не по профильным предметам. В сравнении с отзывами друзей о своих университетах, могу сказать что педагогический состав не самый худший. 
Если финансовая составляющая вас не очень сильно беспокоит, то советую присмотреться к более рейтинговым университетам, но и в РГГУ учиться тоже можно. Многие занятия проходит не особо напряжно, так что учиться на четверки не сложно, с какой-то стороны это можно отнести к плюсам. 
Что касается минусов, так это самое ужасное расписание, которое я когда-либо видела. В одну неделю могут поставить по две лекции в день 5 и 6 парой, а в другой 6 семинаров. Так же присутствуют окна в расписании, из-за чего очень сложно совмещать очное обучение с работой, только если у вас не супер гибкий график, так...Показать полностью... же учеба по субботам мешает выходить на полные смены по выходным. 
Если вам просто нужен диплом и вы не хотите слишком много сил тратить на его получение, то советую поступать в РГГУ , однако спешу огорчить, что красный диплом получить будет тяжело, так как убогая система баллов, в которой экзамен дает только 40 из 100, не позволит вам спокойно прогуливать весь год, так что чтобы получить хорошие оценки в зачетку все равно придется что-то делать. 
Проучившись год в этом университете могу сказать, что это не худшее, что могло случиться, но расчитывать на получение бесценных знаний и дальнейшее трудоустройство в хорошую компанию тоже не приходится. Вуз совершенно обычный, не стройте вокруг него ложных надежд, диплом только пятерки лучших вузов будет действительно ценным для работодателя, а дипломы всех других вузов будут примерно на одном уровне.",medium
