Text,Mark
"


РГГУ. Институт Экономики Управления и Права

Здравствуйте дорогие читатели, хочу поделиться с вами отзывом о Российском Государственном Гуманитарном Университете(РГГУ), 
Учусь на 3 курсе Факультета Управления. 
Из плюсов данного ВУЗа могу выделить следующее:
1) Хорошее расположение. ВУЗ находится в 5 минутах ходьбы от метро Новослободская/Менделеевская, также рядом есть еще 2 станции Белорусская и Маяковская, говорит о том что добираться до этого универа очень просто, особенно если живешь в Москве. Также вокруг универа расположено огромное количество кофеен, заведений фаст фуда и продуктовых магазинов
2) Качество образования. Об этой теме можно говорить сколько угодно, всегда будут довольные и недовольные качеством образования студенты. Лично меня обучение в РГГУ полностью устраивает, есть достаточное количество очень интересных предметов, которые ведут хорошие преподаватели. Тут можно сказать лишь фразу &quot;Тот кто ищет, тот всегда найдет&quot;
3) Атмосфера. Атмосфера в данном заведении и правда очень приятная, особенно это относится к главному корпусу. Тут тебе и огромная столовая, и новые лифты, и интернет кафе. Также в главном корпусе почти все аудитории новые, чистые, с обор...Показать полностью...удованием. К сожалению это относится только не ко всем корпусам.
4) Наличие удобного приложения. У РГГУ есть свое очень удобное приложение, где можно быстро смотреть расписание не заходя на сайт. Также очень удобной функцией является навигатор по вузу, так как РГГУ похож как Хогвартс, то по началу первокурснику будет очень сложно ориентироваться где находятся нужные аудитории, в этой ситуации на помощь как раз и приходит приложение.
5) Студенческая жизнь. Студенческая жизнь в данном ВУЗе очень насыщенная и разнообразная. раз в месяц-два проходит какое-нибудь большое мероприятие, позволяющее студентам найти новые знакомства, раскрыть свои личностные качества, проявить себя. Также в РГГУ огромное количество секций и кружков от настольного тенниса до чирлидерства.
6) Хороший уровень  преподавания языков. Также есть возможность самому выбрать какой язык ты хочешь изучать

Как и в любой ситуации не обошлось без минусов:
1) Расписание. Очень часто бывает так, что в расписании присутствуют &quot;окна&quot;, тоесть у вас стоит 1 пара и 6, и не понятно что делать в это время
2) Нет ремонта в остальных корпусах. Почти во всех корпусах, кроме главного нету ремонта (старые туалеты, шатающиеся парты, стены требующие покраски и тд&quot;

Я очень доволен тем, что поступил именно в этот  университет. РГГУ помог приобрести новые знания и много новых друзей. &quot;Лучший ВУЗ на всю страну - это наш РГГУ!!!&quot;",positive
"


Поступила на гостиничное в 2020, однако осталась разочарована своими одногруппниками. Если вы действительно хотите изучать гд и работать по профессии, то, боюсь, вам не сюда, ибо 99% ребят: «куда прошёл, туда пошёл». Преподы не нагружают, на дистанционке вообще были кайфушки. При поступлении меня заверили, что будет китайский как 2, а по итогу - исп, нем, фр, да арабский, что сильно расстроило, тк это было чуть ли не приоритетом в выборе вуза. Но должна предупредить, что каждый год набор языков меняется, поэтому, если что, выбивайте в деканате. Английский язык дико слабый, максимально, хотите учить - берите репетитора, по другому не получится. + его преподают только на 1/2 семестре, дальше его в плане нет, но присутствуют дисциплины на англе со 2 курса. В целом, пока что всё не так плохо, за исключением вышеперечисленного неудачного потока, думаю, это просто мне не повезло...очень не повезло. Если вы действительно идёте за знаниями, то пишите конспекты (лично мне они особо не пригодились на семинарах, только для общего развития, поэтому все же советую их писать), занимайтесь, не прогуливайте, и отвечайте на семинарах, получите автомат ;) Много интересных семинаров, к которым нужно ...Показать полностью...готовиться, иначе получите по шапке, не шучу, готовьтесь и читайте литературу, особенно по истории России!!
Расписание. У нас проблем не было пока, большинство пар по вечерам, окон огромных не было, а если и были, то передавали привет в деканат или сами договаривались с преподами перенести пару. Главное - сказать.
Здания да, жизнью побитые, никто ремонтировать почему-то не хочет, из 2х лифтов в 5 корпусе (там в основном у нас занятия) работает только 1, второй слишком часто ломается, а если и работает, то на нужный для гд-шника этаж тупо не приезжает, кнопочка не фурычит)) 
Теперь еда - магнолия вас обберет до нитки, поэтому лучше покупайте заранее или ходите в столовку. А если хотите пошиковать, то во Вьет кафе на ланч (~275р. по студаку).
Ну, это вкратце обо всём, надеюсь, было полезно :) удачи!",medium
"


ФРиСО или факультет рекламы и связей с общественностью. Поступила в него летом 2019 не от большого желания -- просто выбора не было, но оказалась довольной. Я закончила уже 2 курса и могу сказать, что факультет делает хорошие вещи. 

На 1 курсе у нас были очень интересные предметы: теория коммуникации, введение в профессию, реклама в мировом искусстве. Уже после двух первых семестров ты можешь спокойно работать либо по профессии (рекламист или пиарщик) или же пойти в какой-нибудь фриланс. Летом у нас была выставка! Делали ее всем первым курсом, мы рисовали рекламные плакаты для разных исторических эпох. Удивительный и прекрасный опыт. Спасибо организаторам за это. 

Второй курс содержит еще более увлекательные предметы. Теория и практика маркетинга, связей с общественностью, литература -- все это очень поможет и пригодится будущим профессионалам. Любое знание полезно, если знаешь, как с ним обращаться. 

Преподаватели факультета и кафедры очень отзывчивые и интересные люди. Всегда предлагают пойти на какую-нибудь конференцию или изучить что-то (например, мы часто смотрели фильмы на 1 курсе). 

Могу сказать, что наш факультет еще совсем молодой, довольно много неорганизованности, ес...Показать полностью...ть, безусловно, свои минусы и недостатки, но я недавно общалась со своим другом из ВШЭ, тот же факультет. Он был удивлен, когда узнал, что мы изучаем и как. Он говорил, что в его университете такого нет, что они вообще изучают другие предметы, которые особо с рекламой и не связаны. 

Люди на факультете, то есть студенты, очень талантливы! Есть много нереальных девочек и чуть поменьше парней, которые делают интересные учебные проекты, всегда помогут и подскажут. Им за это все отдельный респект! 

",positive
"


Заведение по выкачке денег у государства и подростков.  Абсолютно вся группа была разочарована, что поступили сюда. Приходят нормальные обучаемые люди с хорошей успеваемостью, но с таким образованием не подняться, а спуститься на самые низы жизни. Посмотрите на их направления , одна бредовее другой. Попадают сюда в основном те, кого особо не баловали.   Штампуют непонятных ненужных выпускников типа &quot; сервиса&quot; . Когда спрашивают, кем будешь.  Я - &quot;сервис и гостиничное&quot;   и скромно улыбаешься... Если не готовы к такому и хотите нормальной жизни  -не тратьте свои лучшие годы ...Потом окажется что все это только твои проблемы и ты сам ни на что не претендовал, поступая сюда...
Обучение - сдать полностью скачанные статьи из интернета и прочитать с листа при всех. Темы - тупорылые , никому не нужные и преподы нередко сами тебе об этом говорят. Стиль и атмосфера тут  - нести все подряд прямо на паре, и круче тот, кто больше прогуливает .  Как повезло, не правда ли. Кстати неважна посещаемость , всегда можно получить пять не ходя и ничего не делая.  Прямо на моих глазах вновь приходящие на работу преподы увольнялись через пару месяцев работы ( такое точно было раз 10) в...Показать полностью...идели бы вы их лица .  Платишь за якобы нужную тебе корочку. При этом непонятные программы , типа рекламы , сервиса, гостиничного растянуты на бакалавриат, хотя проходить там нечего.   Не думайте , &quot;наверно интересно&quot; - будете разочарованы ! Заметьте, факультет Истории , политологии и права , но ничего с общего с правом тут нет. Это шутка такая.  И таких серьезных направлений как юриспрунденция и история тоже. Это о многом говорит. 
Тот, кто хотел лёгкой учебы , вы ее получите , вместе с безработицей.  Преподы постоянно прогуливают, так как их все не устраивает . Молодые перспективные преподы  там не задерживаются и их жалобы достойны отдельного слива ( к слову, все студенты в курсе). Есть преподы-энтузиасты , котрые как раз кормятся там годами  . Они видимо искренне считают, что преподаваемые ими дисциплины современны и готовы пихать вам уши любую галиматью, от которой реально за годы может поехать крыша, хотя сами они никогда в этих бизнесах не работали. Можете представить что это за подборка.  У меня одна препод спрашивала , ставя мне пятерки: &quot; Надеюсь я не лишаю тебя последнего куска хлеба &quot;. Только спустя несколько лет стало понятно о чем она  .. Чего только стоят предметы  &quot; основы толерантности  &quot;, &quot; человек и его потребности &quot;,  &quot;информационная эвристика &quot;. Знаний ноль и поражаешься как можно так отупеть. 
Преподы и администрация получают зарплаты и в этом весь смысл. Студенты им сами денежку  несут . К слову , если вы что не сдали - этот долг может висеть до самого диплома и вам его закроют безо всяких пересдач. Вы же деньги платили  ,никого не отчисляют и студенты этим пользуются.  Преподы прямо на парах со студентами обсуждают куда же делись деньги платников, уж точно не на ремонт , там даже уборщицы нет , битые стекла и дохлые птицы, бутылки после попоек,  в туалетах все раздолбано. Все вечно едят  прямо в аудиториях,оставляя за собой  помойки, вуз напоминает &quot;рыгаловку&quot;. Если кто-то не верит,  стоит поступить и проверить , осознаться, так сказать,в РГГУ. ",negative
