Text,Mark
"


Если вы знакомы с произведением Кафки &quot;Замок&quot;, то это именно об этом Вузе.  Закончил этот &quot;Лучший вуз&quot; зимой 2021, учился на заочном, и с облегчением выдохнул, что это каким-то чудом закончилось. Ранее я обучался в колледже и действительно шёл в РГГУ с надеждой и дальше работать в сфере рекламы, но за 4 года этот университет убил во мне всякое желание заниматься рекламой. 
По порядку. 
1. Знания
Более бестолкового плана обучения представить сложно - преподаватели не контролируют что рассказывали их коллеги в прошлом семестре и повторяют одно и то же как попугайчики. Чья тут вина не понятно - просто нет никакой внутренней коммуникации у персонала вуза. В итоге к 3-4 курсам уровень знаний у большинства ребят из группы, у которых в виду работы не было возможности искать информацию самостоятельно, остался всё также на 1 курсе, а у тех, кто пришёл уже с большим запасом знаний, произошла деградация - к концу 4 курса я и в себе заметил, что знаю и помню меньше, чем после выпуска из колледжа. Безусловно, были и достойные предметы, но и они под тяжестью постоянных замен преподавателей (их увольнений в основном), быстро потеряли свою полезность. 
2. Преподаватели
Я вспомн...Показать полностью...ю дай бог двух преподавателей, которые действительно оставили позитивный отклик. Остальные... Скажем так, вроде никто взяток не брал - и это единственный плюс. Преподаватели тщательно доводят студентов до белого каления. Постоянные проблемы с ведомостями, потерями оценок сдавших студентов, от того возникающие из неоткуда долги, выслушивание претензий со стороны этих самых преподавателей и администрации. Особенно в этом деле отличился И******* Д. В., он  годами копит долги и не даёт студентам их сдать, а когда те всё -таки добиваются оценки - забывает о них или просто не находит время выставить их в ведомость. Зато самый умный, самый занятой, самый крутой член гильдии маркетологов, будь она неладна, если там все специалисты такие - вряд ли хоть один выпускник РГГУ после знакомства с И******* Д.В. захочет туда вступить.
Конечно, всё было не так чтобы совсем плохо - некоторые преподаватели умели развеселить - вызывали в основном истерический смех. За периоды обучения можно наслушаться и как правильно дышать маткой, и про гороскопы узнать и их связь с духовным равновесием, почитать сообщения с орфографическими ошибками, зато с капслоком и множеством восклицательных знаков. Откровенное хамство со стороны преподавателей - это не хамство, это студент плохо воспитан, что приватно понимает крики в свой адрес и оскорбления. 
3. Расписание
В РГГУ нормально нарушать собственные же правила и закон. Расписание за день до пары могло поменяться два-три раза спокойно, и конечно, никто об этом не сообщал из администрации. На вопрос &quot;а почему так, это же нарушение&quot;, ответ мы так и не получили. Огромные окна в 3-4 пары - это база, это классика. Я поступал на заочку, чтобы появляться в вузе только во время сессий, но большинство преподавателей видимо сами никогда не совмещали работу с учёбой - в их понимании нормально устраивать &quot;обязательные встречи&quot; перед сессиями или после них в будний день в 11-15 часов дня. Стоит ли говорить, что если пропускал такие встречи последствия могли быть самые разные? От ничего до завала предмета, ведь &quot;ты не был на нашей встрече&quot;. 
4. Администрирование и делопроизводство
Полное отсутствие внутренней коммуникации. Преподаватели и администрация устраивали концерты каждую практику - они никак не могли договориться что можно писать в отчете, что нельзя, требования зачастую были совершенно противоположными, а угодить надо и вашим и нашим - иначе практика уйдёт в долг. Как же, спросите вы, а для чего методичка? А методички либо не было совсем, либо её присылали в начале практики, а в момент, когда ты присылал свой уже написанный по ней отчет - методичка устарела, вы откуда её взяли? Нет, мы не могли её вам прислать, ну может разве что по ошибке, вот новая, правьте. И сидишь, переписываешь всё после работы до двух часов ночи и уже не знаешь - плакать или плакать. Порядком всё это напоминает тот ещё цирк, где ты сначала вроде был наблюдателем, но по ходу представления становишься и сам непосредственным участником. Пиком провала администрирования можно считать тот факт, что перед дипломом весь поток дружно оказался без оценок - то ли портал слетел, то ли что ещё, но большинство выставленных оценок оказались сброшены в утиль. Учитывая каким выдался 2020 и 2021 года несложно понять как тяжело студентом было по крупицам отыскивать всё оценки в огромном пласте переписок - ведь в зачетки их не ставили уже как два года. Помимо этого бюрократия в РГГУ просто бесподобна в плохом смысле слова. Найти нужный кабинет легко, но вот попасть туда сложно, как и дозвониться - если не знать источники - никогда не сможешь найти верный телефон деканата. По крайней мере так было на моих 2-3 курсах, на 4 я перестал звонить вовсе и спустил все свои вопросы в слив, так как получить ответ надежды уже не осталось. Весело было, когда мы заранее просили скинуть список необходимых документов на практику, например, а получали в обратку письмо через месяц, за день до начала практики с буквально требованиями срочно, вот прям сегодня предоставить подписанные документы от компании(во вложении шаблоны), если сегодня не пришлёте не будете допущены до защиты. И абсолютно плевать, что люди могут быть в отпуске, в другом городе, в другой стране и уже физически не успеют оформить эти документы на своей работе за сегодня. 

Итоги. 
Если хотите железные нервы, полный пофигизм, а заодно познать реальную жизнь со всеми её негативными и абсурдными ситуациямм - вам сюда. Если дотянете до 4 курса (сделать это легко, большинство уходило именно из-за отсутствия времени на всякие абсурдные срочные &quot;нам сейчас же нужны эти документы! &quot;), то в подарок получите потерю интереса к образованию и работе в своей сфере. 
Также можете унести с собой умение писать всевозможные заявления и даже докладные, поймете что &quot;старше - не значит умнее&quot;, научитесь красиво закатывать глаза, а если у вас развитие чувство справедливости - можете даже познакомиться с деканом и теми, кто за него пишет объяснительные. 
Ну а также достаточно легко 
за небольшие деньги получите диплом, когда пройдёте через весь бюрократический ад. ",negative
"


Привет всем, кто рассматривает &quot;лучший вуз на всю страну&quot; в качестве своего первого образования. Я студент уже 3 курса юридического факультета гражданско-правового профиля, и я вам расскажу как же всё-таки проходит обучение в РГГУ. 
Итак, начнём с университета в целом.
Поступить в него проще простого, если у вас есть достаточно денег. Хахаха какой ещё бюджет? Забудь! Насколько мне известно (информация недостоверная) у нынешних первачей уже в принципе нет бюджетных мест. Кому хорошо, кому не очень-судить вам.
Первые пару недель в университете проходят лайтово: вашей группе назначают тим-лидеров(ребята с более старших курсов, приставленных к вам для того, чтобы познакомить с устройством университета), которые будут на протяжении двух недель везде сопровождать вас. Они вам расскажут всё об университете, всю внутреннюю кухню. Стесняться их не надо, и, я бы даже сказал, обязательно надо задавать побольше вопросов, чтобы быстрее адаптироваться.
После первых двух недель начинается учёба, и тут уже начинается самое интересное. В первом семестре вам будет казаться, что вы учитесь вовсе не на юриста, а на кого-то ещё. Такое впечатление будет у вас из-за обилия предметов, которые ес...Показать полностью...ть непонятно для чего (с этим вы столкнётесь и позднее). В первый семестр особое внимание стоит обратить на предмет ТГП. Это основополагающий предмет для профессии юриста. Советую вести как можно лучше конспект и внимательно слушать. Что касается семинаров по этому предмету? Моим преподавателям был Ц**** В.А. Хороший преподаватель, который всё всегда объяснит, и его семинары проводятся в формате обсуждения-дискуссии. Также из хорошего выделю предмет Римское право. Замечательная преподавательница З**** П.Е. От себя добавлю, что преподаватель всегда обращается к студентам на &quot;Вы&quot; и называет &quot;коллегами&quot;, что очень сильно удивляет после учёбы в школе. Предмет может не особо применим практически, да и дальше вам врядли знания пригодятся эти, но он очень интересный.
Ну что, хорошее закончилось! Теперь о плохом. Две истории, экономика, информатика (с тремя разными преподавателями) и, упаси Господь, физра. В дальнейшем знания по этим предметами вам пригодятся мало, но забивать на них точно не стоит, потому что с первого курса очень легко вылететь. Отдельное внимание стоит уделить физре и истории государства и права зарубежных стран. Да, из-за физры могут отчислить, вы не ослышались. Физра в РГГУ это отдельный вид пытки. На протяжении двух лет она проводилась в хорошем спортивном комплексе на Марьиной роще, а с этого года проводится в Южном Чертаново. В Чертаново, Карл! Кроме отвратного расположения вас также может ожидать какое-то неадекватное отношение преподавателей (не всех) к тем, кто хоть иногда не ходит на физру. Теперь поговорим про историю государства и права зарубежных стран. За 3 года обучения и опыта работы по профессии я ещё ни разу не столкнулся с острой необходимостью знать этот предмет. Я думаю вы тоже. Лекции по этому предмету крайне нудные. Семинары тем более. Я застал семинары по этому предмету онлайн, и возможно всех ужасов ещё не видел, но на моей памяти любимой фразой преподавателя была &quot;ты читаешь&quot;. Оценку отлично получить на семинары почти нереально. Самая жесть начинается в конце, когда вы вдруг узнаёте, что всё это время вы зря усердно старались, чтобы получить автомат. Е**** Н.Н. у нас особенный преподаватель, который не ставит автоматы априори. Её экзамен это что-то неадекватное: 50 вопросов с ответом на пол страницы без времени на подготовку на ответ. Как вы думаете к чему это привело? Правильно, половина потока отправилась на пересдачу, с последующей пересдачей с комиссией. Никого не отчислили, но было очень неприятно.

Самое главное в РГГУ в начале-перейти Рубикон (1 семестр) и дальше будет проще. В определённой степени это так, но потом вы все равно столкнётесь с определёнными трудностями. Есть такой преподаватель Л***.С.В, ведущий гражданский процесс. Производит хорошее впечатление успешного юриста, но на этом всё заканчивается. Весь второй курс она рассказывала о её деле с Романовскими дачами, и о том какая она крутая. С ней ни раз конфликтовали студенты. Кроме неё, стоит выделить и хороших преподавателей. Например преподавателей гражданского и трудового права. Их семинары по-настоящему интересные, готовы идти на встречу, и они действительно могут вас чему-то научить. Также выделю Б*** О.Н. Очень интересный преподаватель с интересными лекциями, однако семинары оставляют желать лучшего, потому что кроме как рассказывания докладов там ничего нет. К слову так половину семинаров и будет вестись. Также из хороших преподавателей выделю преподавателя административного права. Прекрасная женщина, которая всегда готова пойти на встречу к студенту и объяснить то, что непонятно.

Теперь затрону 3 курс. Проучившись 2 месяца на 3 курсе, выбрав гражданско-правовой профиль, я бы ни за что не подумал, что только на 3 курсе моё желание учиться испариться. Такое чувство, что я вернулся на 1 курс. И это связано с преподавателями и их отношением к студентам. Тут появляется две крайности: излишняя дотошность, которая сопровождается к пренебрежению студенту и полный пофигизм с читанием лекции по бумажке. По идее, на 3 курсе ,когда студенты уже выбрали дальнейшее направление ( в РГГУ это гражданский, уголовный, государственный и финансовый профили), вам все равно будут пихать непрофильные предметы, которые вам врядли пригодятся. Это очень сильно потреплет вам нервы, потому что в нашему ВУЗе такие преподаватели зачастую отличаются полным отсутствием лояльности к студентам. В случае гражданского профиля так точно. 

Итак, если подытожить, то я полностью не стал бы рекомендовать поступать в этот ВУЗ, а выбрать что-то лучше, потому что уровень образования хороший только по отдельным дисциплинам и у отдельных преподавателей. Если вы не готовы к тому, что вам будут трепать нервы по бесполезным предметам-лучше выберете какой-то другой ВУЗ.",medium
